,Headlines,Links
0,Top-10 most valued firms lose over Rs 2.29 lakh crore in m-cap,https://www.moneycontrol.com/news/business/markets/top-10-most-valued-firms-lose-over-rs-2-29-lakh-crore-in-m-cap-8675481.html
1,"Exclusive | ADIA investment key to penetrating deeper into affordable housing, says IIFL Group’s Nirmal Jain",https://www.moneycontrol.com/news/business/exclusive-adia-investment-key-to-penetrating-deeper-into-affordable-housing-segment-says-iifl-groups-nirmal-jain-8668711.html
2,Exclusive | HDFC Bank asks parent to cut exposure to certain loans before merger,https://www.moneycontrol.com/news/business/exclusive-hdfc-bank-asks-parent-to-cut-exposure-to-certain-loans-before-merger-8661791.html
3,HDFC Bank hikes lending rates by 0.35%; 2nd hike in two months,https://www.moneycontrol.com/news/business/hdfc-bank-hikes-lending-rates-by-0-35-2nd-hike-in-two-months-8653891.html
4,Weekly Tactical Pick- HDFC Bank,https://www.moneycontrol.com/news/business/moneycontrol-research/weekly-tactical-pick-hdfc-bank-3-8588481.html
5,Buy HDFC Bank; target of Rs 1800: Emkay Global Financial,https://www.moneycontrol.com/news/business/buy-hdfc-bank-target-of-rs-1800-emkay-global-financial-8567021.html
6,RBI Governor Interview | Central bank to conclude on HDFC twins merger in the near future,https://www.moneycontrol.com/news/business/rbi-governor-interview-central-bank-to-conclude-on-hdfc-twins-merger-in-the-near-future-8559691.html
7,Moneycontrol Selects: Top stories this evening,https://www.moneycontrol.com/news/business/moneycontrol-selects-top-stories-this-evening-23-8547691.html
8,"HDFC, HDFC Bank FII shareholding shows lot of room",https://www.moneycontrol.com/news/business/earnings/hdfc-hdfc-bank-inform-exchanges-about-foreign-holding-after-investor-queries-8546101.html
9,"HDFC Bank to tap into semi-urban, rural regions; announces opening of 1,060 branches",https://www.moneycontrol.com/news/business/banks/hdfc-bank-to-tap-into-semi-urban-rural-regions-announces-opening-of-1060-branches-8539171.html
10,Central bank approves HDFC Bank's request to set up step-down subsidiary,https://www.moneycontrol.com/news/business/central-bank-approves-hdfc-banks-request-to-set-up-step-down-subsidiary-8512771.html
11,Mcap of eight of top-10 firms tumbles over Rs 2.48 lakh crore,https://www.moneycontrol.com/news/business/markets/mcap-of-eight-of-top-10-firms-tumbles-over-rs-2-48-lakh-crore-8508541.html
12,Buy HDFC Bank; target of Rs 1650: ICICI Direct,https://www.moneycontrol.com/news/business/stocks/buy-hdfc-bank-target-of-rs-1650-icici-direct-8489521.html
13,"Axis Bank plans to scale up credit card business, says slippages under control",https://www.moneycontrol.com/news/business/axis-bank-plans-to-scale-up-credit-card-business-says-slippages-under-control-8483481.html
14,Exclusive | HDFC Bank top brass batted for merger with HDFC as early as November,https://www.moneycontrol.com/news/business/exclusive-hdfc-bank-top-brass-batted-for-merger-with-hdfc-as-early-as-november-8475361.html
15,"Exclusive| HDFC Bank may get RBI glide path to pare holding in HDFC Credila, HDB Financial after merger",https://www.moneycontrol.com/news/business/exclusive-hdfc-bank-may-get-rbi-glide-path-to-pare-holding-in-hdfc-credila-hdb-financial-after-merger-8473921.html
16,Mcap of top-10 most valued firms falls over Rs 2.85 lakh crore; Reliance biggest drag,https://www.moneycontrol.com/news/business/markets/mcap-of-top-10-most-valued-firms-falls-over-rs-2-85-lakh-crore-reliance-biggest-drag-8470991.html
17,HDFC Q4 earnings marked by strong loan growth and better asset quality,https://www.moneycontrol.com/news/business/moneycontrol-research/hdfc-q4-earnings-marked-by-strong-loan-growth-and-better-asset-quality-8452011.html
18,HDFC increases Retail Prime Lending Rate on housing loans by 5 bps,https://www.moneycontrol.com/news/companies-2/hdfc-increased-retail-prime-lending-rate-on-housing-loans-by-5-bps-8437781.html
19,Union Bank becomes first public sector bank to go live on Account Aggregator framework,https://www.moneycontrol.com/news/business/announcements/union-bank-becomes-first-public-sector-bank-to-go-live-on-account-aggregator-framework-8434251.html
20,"LIC IPO is quite cheap at current valuation, we may apply: Samir Arora of Helios Capital",https://www.moneycontrol.com/news/business/markets/lic-ipo-is-quite-cheap-at-current-valuation-we-may-apply-samir-arora-of-helios-capital-8411711.html
21,"Mcap of 8 of top-10 most valued firms lose Rs 2.21 lakh crore; Infosys, HDFC Bank biggest drags",https://www.moneycontrol.com/news/business/markets/mcap-of-8-of-top-10-most-valued-firms-lose-rs-2-21-lakh-crore-infosys-hdfc-bank-biggest-drags-8401691.html
22,HDFC Bank declares 1550% dividend for shareholders,https://www.moneycontrol.com/news/business/banks/hdfc-bank-declares-1550-dividend-for-shareholders-8400761.html
23,Account aggregator system in banking ensures enhanced customer experience with better data security: Experts,https://www.moneycontrol.com/news/business/account-aggregator-system-in-banking-ensures-enhanced-customer-experience-with-better-data-security-experts-8397501.html
24,HDFC-HDFC Bank merger to be EPS-accretive from day 1: Keki Mistry,https://www.moneycontrol.com/news/business/banks/hdfc-hdfc-bank-merger-to-be-eps-accretive-from-day-1-keki-mistry-8396011.html
25,"Saurabh Mukherjea dismisses concerns around HDFC merger; extremely bullish on Nestle, Asian Paints",https://www.moneycontrol.com/news/business/earnings/saurabh-mukherjea-dismisses-concerns-around-hdfc-merger-extremely-bullish-on-nestle-asian-paints-8392871.html
26,Moneycontrol Selects: Top stories this evening,https://www.moneycontrol.com/news/business/moneycontrol-selects-top-stories-this-evening-3-8391401.html
27,"HDFC Bank to open 150 branches in UP this year; to create 1,000 jobs",https://www.moneycontrol.com/news/business/companies/hdfc-bank-to-open-150-branches-in-up-this-year-to-create-1000-jobs-8390711.html
28,"Regulatory, tech challenges will test HDFC Bank’s top brass during merger, say experts",https://www.moneycontrol.com/news/business/regulatory-tech-challenges-will-test-hdfc-banks-top-brass-during-merger-say-experts-8389821.html
29,ICICI Bank tops rival HDFC Bank in valuation multiple for first time,https://www.moneycontrol.com/news/business/earnings/icici-bank-tops-rival-hdfc-bank-in-valuation-multiple-for-first-time-8388041.html
30,Investors should think of capital protection in 2022: Kotak AMC's Pankaj Tibrewal,https://www.moneycontrol.com/news/business/markets/investors-should-think-of-capital-protection-in-2022-kotak-amcs-pankaj-tibrewal-8383601.html
31,Why markets have fallen in eight out of nine sessions,https://www.moneycontrol.com/news/business/earnings/why-markets-have-fallen-in-eight-out-of-nine-sessions-8380331.html
32,Buy HDFC Bank; target of Rs 1997: KR Choksey,https://www.moneycontrol.com/news/business/stocks/buy-hdfc-bank-target-of-rs-1997-kr-choksey-2-8380561.html
33,Selloff binge knocks HDFC out of MCap list of top 10 companies in India,https://www.moneycontrol.com/news/business/economy/selloff-binge-knocks-hdfc-out-of-indias-top-10-most-valued-companies-in-terms-of-mcap-8378341.html
34,Buy HDFC Bank; target of Rs 1950: Emkay Global Financial,https://www.moneycontrol.com/news/business/stocks/buy-hdfc-bank-target-of-rs-1950-emkay-global-financial-8375711.html
35,Buy HDFC Bank; target of Rs 1960: Choice Equity Broking,https://www.moneycontrol.com/news/business/stocks/buy-hdfc-bank-target-of-rs-1960-choice-equity-broking-2-8375681.html
36,Buy HDFC Bank; target of Rs 1864: Arihant Capital,https://www.moneycontrol.com/news/business/stocks/buy-hdfc-bank-target-of-rs-1864-arihant-capital-8375621.html
37,"Ideas For Profit | HDFC Bank’s Q4: Strong loan growth, margins dip & asset quality improves",https://www.moneycontrol.com/news/business/earnings/ideas-for-profit-hdfc-banks-q4-strong-loan-growth-margins-dip-asset-quality-improves-8375491.html
38,Buy HDFC Bank; target of Rs 1831 LKP Research,https://www.moneycontrol.com/news/business/stocks/buy-hdfc-bank-target-of-rs-1831-lkp-research-8375051.html
39,"With interest rates set to go up, Indian banks look to time debt raising",https://www.moneycontrol.com/news/business/banks/with-interest-rates-set-to-go-up-indian-banks-look-to-time-debt-raising-8373961.html
40,Buy HDFC Bank; target of Rs 2000: Prabhudas Lilladher,https://www.moneycontrol.com/news/business/stocks/buy-hdfc-bank-target-of-rs-2000-prabhudas-lilladher-2-8373931.html
41,What is behind HDFC Bank’s modest Q4 operating performance?,https://www.moneycontrol.com/news/business/earnings/what-is-behind-hdfc-banks-modest-q4-operating-performance-8372741.html
42,"HDFC Bank’s Q4 shines, growth takes precedence over margins",https://www.moneycontrol.com/news/business/moneycontrol-research/hdfc-banks-q4-shines-growth-takes-precedence-over-margins-8372061.html
43,"HDFC Bank after Q4 Earnings | What should investors do: Buy, sell, or hold?",https://www.moneycontrol.com/news/business/stocks/hdfc-bank-after-q4-earnings-what-should-investors-do-buy-sell-or-hold-8371511.html
44,"HDFC Bank to raise Rs 50,000 cr via bonds; re-appoints Renu Karnad as director",https://www.moneycontrol.com/news/business/hdfc-bank-to-raise-rs-50000-cr-via-bonds-re-appoints-renu-karnad-as-director-8369111.html
45,"HDFC Bank Q4 result | Net profit jumps 23% YoY to Rs 10,055 crore as provisions dip, NII up 10.2%",https://www.moneycontrol.com/news/business/earnings/hdfc-bank-q4-profit-jumps-23-to-rs-10055-crore-net-interest-income-reaches-rs-18873-crore-8367381.html
46,"HDFC Bank Q4 Net Profit seen up 18.4% YoY to Rs. 9,692.8 cr: Motilal Oswal",https://www.moneycontrol.com/news/business/hdfc-bank-q4-net-profit-seen-up-18-4-yoy-to-rs-9692-8-cr-motilal-oswal-8344121.html
47,The gigantic HDFC of today is part of H.T. Parekh’s rich entrepreneurial legacy,https://www.moneycontrol.com/news/business/remembering-h-t-parekh-founder-of-hdfc-as-rbi-examines-proposal-to-merge-hdfc-hdfc-bank-business-history-8338521.html
48,"Market ends with marginal gains in volatile week; midcap, smallcap outperform",https://www.moneycontrol.com/news/photos/business/markets/market-ends-with-marginal-gains-in-volatile-week-midcap-smallcap-outperform-8337681.html
49,HDFC sells 3% stake in Bandhan Bank via bulk deals,https://www.moneycontrol.com/news/business/banks/hdfc-sells-3-stake-in-bandhan-bank-via-bulk-deals-8335501.html
50,"RBI examines HDFC-HDFC Bank merger proposal, says Governor Shaktikanta Das",https://www.moneycontrol.com/news/business/banks/rbi-examines-hdfc-hdfc-bank-merger-proposal-says-governor-shaktikanta-das-8334991.html
51,These 10 rate-sensitive stocks look bright as RBI keeps monetary policy on expected lines,https://www.moneycontrol.com/news/business/markets/these-10-rate-sensitive-stocks-look-bright-as-rbi-keeps-monetary-policy-on-expected-lines-8333951.html
52,"After HDFC mega merger, M&As in NBFC sector likely to rise, say experts",https://www.moneycontrol.com/news/business/banks/after-hdfc-mega-merger-mas-in-nbfc-sector-likely-to-rise-say-experts-8329041.html
53,India’s home-loan market set for a churn after HDFC-HDFC Bank merger,https://www.moneycontrol.com/news/business/markets/indias-home-loan-market-set-for-a-churn-after-hdfc-hdfc-bank-merger-8327971.html
54,"Proposed merger of HDFC Bank, HDFC to moderately hurt bank's profitability: Moody's",https://www.moneycontrol.com/news/business/banks/proposed-merger-of-hdfc-bank-hdfc-to-moderately-hurt-banks-profitability-moodys-8325931.html
55,"HDFC Bank plans to raise up to Rs 50,000 crore by issuing bonds",https://www.moneycontrol.com/news/business/hdfc-bank-plans-to-raise-up-to-rs-50000-crore-by-issuing-bonds-8325671.html
56,"Merger of HDFC twins may drive up competition in housing finance market, say experts",https://www.moneycontrol.com/news/business/merger-of-hdfc-twins-may-drive-up-competition-in-housing-finance-market-say-experts-8323561.html
57,"HDFC-HDFC Bank Merger: It was only a question of when, says TT Srinivasaraghavan ",https://www.moneycontrol.com/news/business/hdfc-hdfc-bank-merger-it-was-only-a-question-of-when-says-tt-srinivasaraghavan-8323311.html
58,What we know about HDFC merger with HDFC Bank,https://www.moneycontrol.com/news/mcminis/what-we-know-about-hdfc-merger-with-hdfc-bank-8316591.html
59,HDFC Twins Merger | A financial mega-merger that’s all in the family,https://www.moneycontrol.com/news/opinion/hdfc-twins-merger-a-financial-mega-merger-thats-all-in-the-family-8322531.html
60,"As HDFC twins join up, experts decode merger gains for investors, depositors and borrowers",https://www.moneycontrol.com/news/business/personal-finance/as-hdfc-twins-join-up-experts-decode-merger-gains-for-investors-depositors-and-borrowers-8321881.html
61,HDFC–HDFC Bank merger – What’s in it for shareholders?,https://www.moneycontrol.com/news/business/moneycontrol-research/hdfc-hdfc-bank-merger-whats-in-it-for-shareholders-8320251.html
62,HDFC’s merger will light up action in the Indian financial services sector,https://www.moneycontrol.com/news/opinion/hdfcs-merger-will-light-up-action-in-the-indian-financial-services-sector-8322191.html
63,"HDFC Bank's $40 billion deal may face regulatory hurdles over insurance, analysts say",https://www.moneycontrol.com/news/business/hdfc-banks-40-billion-deal-may-face-regulatory-hurdles-over-insurance-analysts-say-8320811.html
64,Buy HDFC Bank; target of Rs 1960: Choice Equity Broking,https://www.moneycontrol.com/news/business/stocks/buy-hdfc-bank-target-of-rs-1960-choice-equity-broking-8319961.html
65,Buy HDFC Bank; target of Rs 2050: Emkay Global Financial,https://www.moneycontrol.com/news/business/stocks/buy-hdfc-bank-target-of-rs-2050-emkay-global-financial-4-8319891.html
66,Deepak Parekh exclusive interview | HDFC and HDFC Bank need to have a common culture,https://www.moneycontrol.com/news/business/companies/deepak-parekh-exclusive-interview-hdfc-and-hdfc-bank-need-to-have-a-common-culture-8319091.html
67,Buy HDFC Bank; target of Rs 2000: Prabhudas Lilladher,https://www.moneycontrol.com/news/business/stocks/buy-hdfc-bank-target-of-rs-2000-prabhudas-lilladher-8318751.html
68,Will the merger of the HDFC twins make indices more volatile? ,https://www.moneycontrol.com/news/opinion/will-the-merger-of-the-hdfc-twins-make-indices-more-volatile-8318381.html
69,HDFC twins merger gets thumbs up from brokerages even as stocks slump after rally,https://www.moneycontrol.com/news/business/stocks/hdfc-twins-merger-gets-thumbs-up-from-brokerages-even-as-stocks-slump-8318101.html
70,"Trade Spotlight | What should investors do with HDFC Bank, IndiaMART, Edelweiss, Zuari Agro Chemicals, Ujjivan Financial Services on Tuesday?",https://www.moneycontrol.com/news/business/markets/trade-spotlight-what-should-investors-do-with-hdfc-bank-indiamart-edelweiss-zuari-agro-chemicals-ujjivan-financial-services-on-tuesday-8316171.html
71,Moneycontrol Daily: Your Essential 7,https://www.moneycontrol.com/news/business/moneycontrol-daily-your-essential-7-288-8317241.html
72,"HDFC merger likely to benefit investors and the banking system, believe analysts",https://www.moneycontrol.com/news/business/hdfc-merger-likely-to-benefit-investors-and-the-banking-system-believe-analysts-8316151.html
73,"Requested RBI for phased full implementation of SLR, CRR, says Deepak Parekh",https://www.moneycontrol.com/news/business/banks/requested-rbi-for-phased-full-implementation-of-slr-crr-says-deepak-parekh-8316061.html
74,Accumulate HDFC Bank; target of Rs 1910: Arihant Capital,https://www.moneycontrol.com/news/business/stocks/accumulate-hdfc-bank-target-of-rs-1910-arihant-capital-8315971.html
75,HDFC & HDFC Bank Merger: What's in store for investors & is it too late to buy the stock?,https://www.moneycontrol.com/news/business/hdfc-hdfc-bank-merger-whats-in-store-for-investors-is-it-too-late-to-buy-the-stock-8315841.html
76,HDFC Bank merger to create entity twice the size of ICICI Bank: S&P Global Ratings,https://www.moneycontrol.com/news/business/hdfc-bank-merger-to-create-entity-twice-the-size-of-icici-bank-sp-global-ratings-8315851.html
77,HDFC-HDFC Bank merger: What does it mean for depositors and borrowers?,https://www.moneycontrol.com/news/business/personal-finance/hdfc-hdfc-bank-merger-what-does-it-mean-for-depositors-and-borrowers-8315411.html
78,HDFC Bank and HDFC: Then and now - a timeline,https://www.moneycontrol.com/news/business/stocks/hdfc-bank-and-hdfc-then-and-now-a-timeline-8314321.html
79,"Once merged, HDFC twins to pop into global club of 100 most valued firms led by Apple",https://www.moneycontrol.com/news/business/earnings/hdfc-twins-to-pop-into-global-club-of-100-most-valued-firms-led-by-apple-8315111.html
80,HDFC-HDFC Bank merger will quicken HDFC Bank’s growth further: Marcellus’ Saurabh Mukherjea,https://www.moneycontrol.com/news/business/hdfc-hdfc-bank-merger-will-quicken-hdfc-banks-growth-further-marcellus-saurabh-mukherjea-8314381.html
81,The Long & Short of HDFC-HDFC Bank Merger: In conversation with Samir Arora of Helios Capital,https://www.moneycontrol.com/news/business/the-long-and-short-of-hdfc-hdfc-bank-merger-n-mahalakshmi-in-conversation-with-samir-arora-founder-and-cio-helios-capital-8314141.html
82,First Take | Managing people and technology transition will be key in HDFC twins' merger,https://www.moneycontrol.com/news/opinion/first-take-managing-people-and-technology-transition-will-be-key-in-hdfc-twins-merger-8314721.html
83,Banking Central | Why did HDFC decide to merge with HDFC Bank now?,https://www.moneycontrol.com/news/business/companies/why-did-hdfc-decide-to-merge-with-hdfc-bank-now-8314401.html
84,‘We had two sleepless nights’: HDFC’s Deepak Parekh on HDFC Bank merger,https://www.moneycontrol.com/news/trends/hdfc-hdfc-bank-merger-we-had-two-sleepless-nights-hdfcs-deepak-parekh-on-hdfc-bank-merger-8314301.html
85,'Zero leak of information': HDFC-HDFC Bank merger sparks internet frenzy,https://www.moneycontrol.com/news/trends/current-affairs-trends/zero-leak-of-information-hdfc-hdfc-bank-merger-sparks-internet-frenzy-8313991.html
86,HDFC-HDFC Bank Merger - 'One for the ages': HDFC Bank-HDFC board mark mega merger with group photo,https://www.moneycontrol.com/news/trends/hdfc-hdfc-bank-merger-board-members-photo-after-mega-merger-8313801.html
87,HDFC-HDFC Bank Merger Highlights: Completion of merger process expected by 2nd or 3rd quarter of FY24,https://www.moneycontrol.com/news/business/markets/hdfc-hdfc-bank-merger-live-hdfc-to-acquire-41-stake-in-hdfc-bank-through-transformational-merger-8313751.html
88,HDFC Bank rises 14% on merger with HDFC and better March quarter numbers,https://www.moneycontrol.com/news/business/stocks/hdfc-bank-rises-10-on-merger-with-hdfc-and-better-march-quarter-numbers-8313101.html
89,HDFC all set to merge with HDFC Bank,https://www.moneycontrol.com/news/business/companies/hdfc-hdfc-bank-announce-transformational-merger-8313241.html
90,"HDFC Bank loans grow by 21% y-o-y, deposits by 17%",https://www.moneycontrol.com/news/business/hdfc-bank-loans-grow-by-21-y-o-y-deposits-by-17-8312221.html
91,Pandemic-related stress on unsecured loan assets over: HDFC Bank,https://www.moneycontrol.com/news/business/pandemic-related-stress-on-unsecured-loan-assets-over-hdfc-bank-8296651.html
92,PGInvIT secures Rs 700 crore credit facility from HDFC Bank,https://www.moneycontrol.com/news/business/pginvit-secures-rs-700-crore-credit-facility-from-hdfc-bank-8296601.html
93,HDFC Bank to infuse Rs 3 crore to acquire stake in debt resolution firm IDRCL,https://www.moneycontrol.com/news/business/hdfc-bank-to-infuse-rs-3-crore-to-acquire-stake-in-debt-resolution-firm-idrcl-8290231.html
94,"Ather Energy partners HDFC Bank, IDFC First Bank to offer retail finance for its e-scooter",https://www.moneycontrol.com/news/technology/auto/ather-energy-partners-hdfc-bank-idfc-first-bank-to-offer-retail-finance-for-its-e-scooter-8268661.html
95,Nine best stocks for your portfolio to secure healthy returns by next Holi,https://www.moneycontrol.com/news/business/markets/nine-best-stocks-for-your-portfolio-to-secure-healthy-returns-by-next-holi-8247921.html
96,"Exclusive Interview| After RBI green light, HDFC Bank will take 2-3 quarters to regain credit card market share, says Parag Rao",https://www.moneycontrol.com/news/business/banks/exclusive-interview-after-rbi-green-signal-hdfc-bank-will-take-2-3-quarters-to-regain-credit-card-market-share-says-parag-rao-8240491.html
97,Buy HDFC Bank: target of Rs 1973: Sharekhan,https://www.moneycontrol.com/news/business/stocks/buy-hdfc-bank-target-of-rs-1973-sharekhan-2-8234841.html
98,HDFC Bank share price rises 2% after RBI lifts restrictions on fresh digital launches,https://www.moneycontrol.com/news/business/stocks/hdfc-bank-share-price-rises-2-after-rbi-lifts-restrictions-on-fresh-digital-launches-8228231.html
99,"With digital woes behind it, HDFC Bank now needs a friendlier world",https://www.moneycontrol.com/news/opinion/with-digital-woes-behind-it-hdfc-bank-now-needs-a-friendlier-world-8227961.html
100,"9 of top 10 firms gain Rs 1.91 lakh crore in m-cap; Reliance, Infosys biggest winners",https://www.moneycontrol.com/news/business/markets/9-of-top-10-firms-gain-rs-1-91-lakh-crore-in-m-cap-reliance-infosys-biggest-winners-8226121.html
101,HDFC Bank steps up focus on customers as RBI revokes bar on digital launches,https://www.moneycontrol.com/news/business/banks/rbi-lifts-restrictions-on-hdfc-banks-new-digital-launches-8224361.html
102,Buy HDFC Bank : target of Rs 1955: ICICI Securities,https://www.moneycontrol.com/news/business/stocks/buy-hdfc-bank-target-of-rs-1955-icici-securities-8221481.html
103,Buy HDFC Bank; target of Rs 2000 : Motilal Oswal,https://www.moneycontrol.com/news/business/stocks/buy-hdfc-bank-target-of-rs-2000-motilal-oswal-4-8217821.html
104,Equity m-cap lowest in 7 months in February; top 10 companies lost over Rs 3.3 lakh crore last week,https://www.moneycontrol.com/news/business/markets/equity-m-cap-lowest-in-7-months-in-february-top-10-companies-lost-over-rs-3-3-lakh-crore-last-week-8170281.html
105,SAT dismisses SEBI order against HDFC Bank in BRH Wealth Kreators case,https://www.moneycontrol.com/news/business/markets/sat-dismisses-sebi-order-against-hdfc-bank-in-brh-wealth-kreators-case-8142861.html
106,Srikanth Nadhamuni resigns as Non-Executive Director of HDFC Bank,https://www.moneycontrol.com/news/business/srikanth-nadhamuni-resigns-as-non-executive-director-of-hdfc-bank-8135081.html
107,Slice completes first ESOP buyback worth Rs 65 crore,https://www.moneycontrol.com/news/business/startup/slice-completes-first-esop-buyback-worth-rs-65-crore-8089751.html
108,"New Umbrella Entity applications under evaluation, clarifies RBI Governor Shaktikanta Das",https://www.moneycontrol.com/news/business/new-umbrella-entity-applications-under-evaluation-clarifies-rbi-governor-shaktikanta-das-8072391.html
109,"ICICI Bank posts solid Q3 earnings, re-rating to continue",https://www.moneycontrol.com/news/business/moneycontrol-research/icici-bank-posts-solid-q3-earnings-re-rating-to-continue-7974081.html
110,Buy HDFC Bank; target of Rs 2000: ICICI Direct,https://www.moneycontrol.com/news/business/stocks/buy-hdfc-bank-target-of-rs-2000-icici-direct-2-7952561.html
111,Ideas For Profit | HDFC Bank: Strong Q3 result on lower provisions; Can stock bounce back in 2022?,https://www.moneycontrol.com/news/business/earnings/ideas-for-profit-hdfc-bank-strong-q3-result-on-lower-provisions-can-stock-bounce-back-in-2022-7948921.html
112,Buy HDFC Bank: target of Rs 1973: Sharekhan,https://www.moneycontrol.com/news/business/stocks/buy-hdfc-bank-target-of-rs-1973-sharekhan-7948141.html
113,Buy HDFC Bank; target of Rs 2050: Emkay Global Financial,https://www.moneycontrol.com/news/business/stocks/buy-hdfc-bank-target-of-rs-2050-emkay-global-financial-3-7947711.html
114,Buy HDFC Bank; target of Rs 1910: Arihant Capital,https://www.moneycontrol.com/news/business/stocks/buy-hdfc-bank-target-of-rs-1910-arihant-capital-7947501.html
115,Buy HDFC Bank; target of Rs 1870: Prabhudas Lilladher,https://www.moneycontrol.com/news/business/stocks/buy-hdfc-bank-target-of-rs-1870-prabhudas-lilladher-2-7947461.html
116,Buy HDFC Bank; target of Rs 2000: Motilal Oswal,https://www.moneycontrol.com/news/business/stocks/buy-hdfc-bank-target-of-rs-2000-motilal-oswal-3-7947341.html
117,HDFC Bank gets growth back in Q3 but fees need a fix,https://www.moneycontrol.com/news/business/earnings/hdfc-bank-gets-growth-back-in-q3-but-fees-need-a-fix-7945561.html
118,"HDFC Bank Standalone December 2021 Net Interest Income (NII) at Rs 18,443.48 crore, up  13.03% Y-o-Y",https://www.moneycontrol.com/news/business/earnings/hdfc-bank-standalone-december-2021-net-interest-income-nii-at-rs-18443-48-crore-up-13-03-y-o-y-7945791.html
119,"HDFC Bank Consolidated December 2021 Net Interest Income (NII) at Rs 19,864.00 crore, up  14.63% Y-o-Y",https://www.moneycontrol.com/news/business/earnings/hdfc-bank-consolidated-december-2021-net-interest-income-nii-at-rs-19864-00-crore-up-14-63-y-o-y-7945911.html
120,HDFC Bank Q3: Strong on lower provisions; can the stock bounce back in 2022?,https://www.moneycontrol.com/news/business/moneycontrol-research/hdfc-bank-q3-strong-on-lower-provisions-can-the-stock-bounce-back-in-2022-7945181.html
121,"What should investors do with HDFC Bank after Q3 earnings; buy, sell or hold?",https://www.moneycontrol.com/news/business/stocks/what-should-investors-do-with-hdfc-bank-after-q3-earnings-buy-sell-or-hold-7945111.html
122,"HDFC Bank Q3 profit rises 18% to Rs 10,342 crore, net interest income grows to Rs 18,444 crore",https://www.moneycontrol.com/news/business/earnings/hdfc-bank-q3-profit-rises-18-to-rs-10342-crore-net-interest-income-grows-to-rs-18444-crore-7939591.html
