,Headlines,Links
363,Buy HDFC Bank; target of Rs 1500: YES Securities,https://www.moneycontrol.com/news/business/stocks/buy-hdfc-bank-target-of-rs-1500-yes-securities-5982741.html
364,Buy HDFC Bank; target of Rs 1500: Emkay Global Financial,https://www.moneycontrol.com/news/business/stocks/buy-hdfc-bank-target-of-rs-1500-emkay-global-financial-5982221.html
365,"HDFC Bank Consolidated September 2020 Net Interest Income (NII) at Rs 16,709.09 crore, up  15.57% Y-o-Y",https://www.moneycontrol.com/news/business/earnings/hdfc-bank-consolidated-september-2020-net-interest-income-nii-at-rs-16709-09-crore-up-15-57-y-o-y-5981931.html
366,"HDFC Bank Standalone September 2020 Net Interest Income (NII) at Rs 15,776.39 crore, up  16.73% Y-o-Y",https://www.moneycontrol.com/news/business/earnings/hdfc-bank-standalone-september-2020-net-interest-income-nii-at-rs-15776-39-crore-up-16-73-y-o-y-5981871.html
367,Buy HDFC Bank; target of Rs 1400 : Motilal Oswal,https://www.moneycontrol.com/news/business/stocks/buy-hdfc-bank-target-of-rs-1400-motilal-oswal-5981311.html
368,HDFC Bank: Resilient performance will drive valuation re-rating,https://www.moneycontrol.com/news/business/moneycontrol-research/hdfc-bank-resilient-performance-will-drive-valuation-re-rating-5980641.html
369,"What should investors do with HDFC Bank after Q2 results: buy, sell, or hold?",https://www.moneycontrol.com/news/business/stocks/what-should-investors-do-with-hdfc-bank-after-q2-results-buy-sell-or-hold-5979821.html
370,"Aditya Puri hangs up boots with a good quarter, but asset quality remains a concern amid COVID-19 pandemic",https://www.moneycontrol.com/news/business/aditya-puri-hangs-up-boots-with-a-good-quarter-but-asset-quality-remains-a-concern-amid-covid-19-pandemic-5975921.html
371,"HDFC Bank reports 18.4% jump in Q2 profit at Rs 7,513 crore, NII rises 16.7%",https://www.moneycontrol.com/news/business/earnings/hdfc-bank-reports-18-4-jump-in-q2-profit-at-rs-7513-crore-nii-rises-16-7-5972271.html
372,HDFC Bank Q2 preview: May post over 16% profit growth; asset quality trends key monitorable,https://www.moneycontrol.com/news/business/earnings/hdfc-bank-q2-preview-may-post-over-16-profit-growth-asset-quality-trends-key-monitorable-5972981.html
373,HDFC Bank vs Bajaj Finance: Which stock makes a better bet?,https://www.moneycontrol.com/news/business/moneycontrol-research/hdfc-bank-vs-bajaj-finance-which-stock-makes-a-better-bet-5936451.html
374,"Your jobs, increments, bonuses are secure: HDFC Bank's Aditya Puri assures employees",https://www.moneycontrol.com/news/india/your-jobs-increments-bonuses-are-secure-hdfc-banks-aditya-puri-assures-employees-5929821.html
375,Buy HDFC Bank; target of Rs 1300: Emkay Global Financial,https://www.moneycontrol.com/news/business/stocks/buy-hdfc-bank-target-of-rs-1300-emkay-global-financial-2-5928401.html
376,Business returning to pre-COVID levels: HDFC Bank MD Aditya Puri,https://www.moneycontrol.com/news/business/business-returning-to-pre-covid-levels-hdfc-bank-md-aditya-puri-5907091.html
377,Buy HDFC Bank; target of Rs 1300: Emkay Global Financial,https://www.moneycontrol.com/news/business/stocks/buy-hdfc-bank-target-of-rs-1300-emkay-global-financial-5895071.html
378,HDFC Bank aims 10-fold growth in merchant segment in 3 years to 20 million,https://www.moneycontrol.com/news/business/hdfc-bank-aims-10-fold-growth-in-merchant-segment-in-3-years-to-20-million-5891601.html
379,Eight of top 10 valued firms lose Rs 1.57 lakh crore in market valuation,https://www.moneycontrol.com/news/business/markets/eight-of-top-10-valued-firms-lose-rs-1-57-lakh-crore-in-market-valuation-5891531.html
380,"LIC, GIC Re and New India are systematically important insurers for 2020-21",https://www.moneycontrol.com/news/business/companies/lic-gic-re-and-new-india-are-systematically-important-insurers-for-2020-21-5886221.html
381,HDFC Bank launches FAQs on one-time loan restructuring scheme,https://www.moneycontrol.com/news/business/hdfc-bank-launches-faq-on-website-on-one-time-loan-restructuring-scheme-5871841.html
382,HDFC Bank denies allegations in class action suits; says will defend 'vigorously',https://www.moneycontrol.com/news/business/hdfc-bank-denies-allegations-in-class-action-suit-says-will-defend-vigorously-5866441.html
383,Business Insight | HDFC Bank faces class action suits brought by 3 US-based law firms,https://www.moneycontrol.com/news/eye-on-india/videos/business-insight-hdfc-bank-faces-class-action-suits-brought-by-3-us-based-law-firms-5858821.html
384,Another US-based law firm Pomerantz announces class action suit against HDFC Bank on ‘false and misleading’ statements about its business,https://www.moneycontrol.com/news/business/another-us-based-law-firm-pomerantz-announces-class-action-suit-against-hdfc-bank-on-false-and-misleading-statements-5856271.html
385,HDFC Bank shares trade lower after US law firms file class-action suit,https://www.moneycontrol.com/news/business/markets/hdfc-bank-shares-trade-lower-after-us-law-firms-file-class-action-suit-5855441.html
386,"Rosen Law, Schall file class-action suits against HDFC Bank in US, allege lack of disclosure",https://www.moneycontrol.com/news/business/companies/rosen-law-schall-file-class-action-suits-against-hdfc-bank-in-us-allege-lack-of-disclosure-5854861.html
387,Volvo Car India partners with HDFC Bank to launch Volvo Car Financial Services,https://www.moneycontrol.com/news/technology/auto/volvo-car-india-partners-with-hdfc-bank-to-launch-volvo-car-financial-services-5847591.html
388,"HDFC Bank raises late payment fees for credit cards, others may follow: Report",https://www.moneycontrol.com/news/trends/current-affairs-trends/hdfc-bank-raises-late-payment-fees-for-credit-cards-others-may-follow-report-5826861.html
389,Customers buying high-value products through credit card EMIs at all-time high: HDFC Bank,https://www.moneycontrol.com/news/business/customers-buying-high-value-products-through-credit-card-emis-at-all-time-high-hdfc-bank-5814811.html
390,US investors' rights law firm announces probe against HDFC Bank,https://www.moneycontrol.com/news/business/us-investors-rights-law-firm-announces-probe-against-hdfc-bank-5714101.html
391,HDFC Bank launches farm loan product for armed forces,https://www.moneycontrol.com/news/business/hdfc-bank-launches-farm-loan-product-for-armed-forces-5702771.html
392,Weekly Tactical Pick | HDFC Bank: Ripe for re-rating,https://www.moneycontrol.com/news/business/markets/weekly-tactical-pick-hdfc-bank-ripe-for-re-rating-5700271.html
393,"Lot has been done, but best of HDFC Bank yet to come: Aditya Puri",https://www.moneycontrol.com/news/business/lot-has-been-done-but-best-of-hdfc-bank-yet-to-come-aditya-puri-5697511.html
394,D-Street Talk podcast | HDFC Bank employees have in their DNA to become entrepreneurs: Shankar Sharma,https://www.moneycontrol.com/news/podcast/d-street-talk-podcast-hdfc-bank-employees-have-in-their-dna-to-become-entrepreneurs-shankar-sharma-5677861.html
395,Masterclass with Shankar Sharma: Be conservative. Don't be a cowboy in investing,https://www.moneycontrol.com/news/business/markets/masterclass-with-shankar-sharma-be-conservative-dont-be-a-cowboy-in-investing-5667511.html
396,"Where Aditya Puri should invest Rs 843 crore raised from HDFC Bank share sale, according to top money managers",https://www.moneycontrol.com/news/business/personal-finance/where-should-aditya-puri-invest-the-money-from-his-hdfc-bank-stock-sale-5662181.html
397,"Uncertainty at HDFC Bank ends, Sashidhar Jagdishan a hard task master & investors’ choice: Brokerages",https://www.moneycontrol.com/news/business/markets/uncertainty-at-hdfc-bank-ends-sashidhar-jagdishan-a-hard-task-master-investors-choice-brokerages-5648391.html
398,"Connecting the dots: Puri always wanted an insider, post Sukthankar’s exit Jagdishan was his favourite",https://www.moneycontrol.com/news/business/connecting-the-dots-puri-always-wanted-an-insider-post-sukthankars-exit-jagdishan-was-his-favourite-5645651.html
399,'Insider' Sashidhar Jagdishan new HDFC Bank CEO: Here are some of the challenges he faces,https://www.moneycontrol.com/news/business/sashidhar-jagdishan-new-hdfc-bank-ceo-an-insider-takes-charge-5644181.html
400,What worked in favour of Sashidhar Jagdishan to get HDFC Bank’s top job?,https://www.moneycontrol.com/news/business/what-worked-in-favour-of-sashidhar-jagdishan-to-get-hdfc-banks-top-job-5643081.html
401,Aditya Puri on HDFC Bank stake sale: ‘Nothing to do with bank; need money for retirement’,https://www.moneycontrol.com/news/business/aditya-puri-on-hdfc-bank-stake-sale-nothing-to-do-with-bank-need-money-for-retirement-5642761.html
402,HDFC Bank share price gains nearly 6% on approval of new CEO,https://www.moneycontrol.com/news/business/stocks/hdfc-bank-share-price-gains-nearly-5-on-approval-of-new-ceo-5642431.html
403,Aditya Puri: Delighted Sashidhar Jagdishan will succeed as HDFC Bank CEO; ‘best yet to come for bank’,https://www.moneycontrol.com/news/business/aditya-puri-delighted-sashidhar-jagdishan-will-succeed-as-hdfc-bank-ceo-best-yet-to-come-for-bank-5642711.html
404,"Who is Sashidhar Jagdishan, the new CEO of HDFC Bank?",https://www.moneycontrol.com/news/business/who-is-sashidhar-jagdishan-the-new-ceo-of-hdfc-bank-5642561.html
405,Here is how skewed the Indian market is,https://www.moneycontrol.com/news/opinion/here-is-how-skewed-the-indian-market-is-5611841.html
406,How investors should read Aditya Puri’s surprise stake sale in HDFC Bank,https://www.moneycontrol.com/news/business/how-investors-should-read-aditya-puris-surprise-stake-sale-in-hdfc-bank-5604191.html
407,HDFC Bank share price falls 2% after Aditya Puri sells 74.2 lakh shares,https://www.moneycontrol.com/news/business/stocks/hdfc-bank-share-price-falls-2-after-aditya-puri-sells-74-2-lakh-shares-5601681.html
408,Aditya Puri sells HDFC Bank shares worth Rs 843 crore,https://www.moneycontrol.com/news/business/aditya-puri-sells-hdfc-bank-shares-worth-rs-843-crore-5599911.html
409,"RBI seeks details of HDFC car loan probe, including info on remedial steps taken",https://www.moneycontrol.com/news/india/rbi-seeks-details-of-hdfc-car-loan-probe-including-info-on-remedial-steps-taken-5595361.html
410,Auto loan controversy in HDFC Bank could haunt Aditya Puri’s successor,https://www.moneycontrol.com/news/business/auto-loan-controversy-in-hdfc-bank-could-haunt-aditya-puris-successor-5587151.html
411,HDFC Bank’s CEO search has gone on for too long,https://www.moneycontrol.com/news/opinion/hdfc-banks-ceo-search-has-gone-on-for-too-long-5584891.html
412,HDFC Bank sacks six officials following internal probe: Five questions answered,https://www.moneycontrol.com/news/business/companies/hdfc-bank-sacks-six-officials-following-internal-probe-five-questions-answered-5576251.html
413,Buy HDFC Bank target; of Rs 1470: ICICI Securities,https://www.moneycontrol.com/news/business/stocks/buy-hdfc-bank-target-of-rs-1470-icici-securities-5572091.html
414,Buy HDFC Bank; target of Rs 1265: Prabhudas Lilladher,https://www.moneycontrol.com/news/business/stocks/buy-hdfc-bank-target-of-rs-1265-prabhudas-lilladher-5572101.html
415,Buy HDFC Bank; target of Rs 1470: YES Securities,https://www.moneycontrol.com/news/business/stocks/buy-hdfc-bank-target-of-rs-1470-yes-securities-5572141.html
416,Buy HDFC Bank; target of Rs 1280: Motilal Oswal,https://www.moneycontrol.com/news/business/stocks/buy-hdfc-bank-target-of-rs-1280-motilal-oswal-5572161.html
417,Accumulate HDFC Bank; target of Rs 1257: Arihant Capital,https://www.moneycontrol.com/news/business/stocks/accumulate-hdfc-bank-target-of-rs-1257-arihant-capital-5572171.html
418,HDFC Bank fires six employees for corrupt practices in vehicle loan business: Report,https://www.moneycontrol.com/news/business/hdfc-bank-fires-six-employees-for-corrupt-practices-in-vehicle-loan-business-report-5574621.html
419,"HDFC Bank Consolidated June 2020 Net Interest Income (NII) at Rs 16,743.12 crore, up  17.92% Y-o-Y",https://www.moneycontrol.com/news/business/earnings/hdfc-bank-consolidated-june-2020-net-interest-income-nii-at-rs-16743-12-crore-up-17-92-y-o-y-5574881.html
420,"HDFC Bank Standalone June 2020 Net Interest Income (NII) at Rs 15,665.42 crore, up  17.84% Y-o-Y",https://www.moneycontrol.com/news/business/earnings/hdfc-bank-standalone-june-2020-net-interest-income-nii-at-rs-15665-42-crore-up-17-84-y-o-y-5574771.html
421,Buy HDFC Bank target of Rs 1400: Sharekhan,https://www.moneycontrol.com/news/business/stocks/buy-hdfc-bank-target-of-rs-1400-sharekhan-5572221.html
422,Buy HDFC Bank; target of Rs 1300: Dolat Capital,https://www.moneycontrol.com/news/business/stocks/buy-hdfc-bank-target-of-rs-1300-dolat-capital-2-5567591.html
423,Aditya Puri says his preferred successor an internal candidate who has spent 25 years at HDFC Bank,https://www.moneycontrol.com/news/business/aditya-puri-says-his-preferred-successor-an-internal-candidate-who-has-spent-25-yrs-at-hdfc-bank-5569241.html
424,What should investors do with the HDFC Bank stock post Q1 results?,https://www.moneycontrol.com/news/business/stocks/what-should-investors-do-with-the-hdfc-bank-stock-post-q1-results-5568911.html
425,"HDFC Bank Q1: Business scales new highs, will its stock follow suit?",https://www.moneycontrol.com/news/business/moneycontrol-research/hdfc-bank-q1-business-scales-new-highs-will-its-stock-follow-suit-5568861.html
426,"Few auto loans executives indulged in personal misconduct, no conflict of interest: HDFC Bank's Aditya Puri",https://www.moneycontrol.com/news/business/few-auto-loans-executives-indulged-in-personal-misconduct-no-conflict-of-interest-hdfc-banks-aditya-puri-5565661.html
427,Analysis| HDFC Bank prepares for COVID-19 shock,https://www.moneycontrol.com/news/business/analysis-why-hdfc-bank-is-silent-on-loans-under-moratorium-5564811.html
428,RBI directs HDFC Bank to return Rs 210 crore taken from Altico Capital’s account to Mashreq Bank: Report,https://www.moneycontrol.com/news/business/rbi-directs-hdfc-bank-to-return-rs-210-crore-taken-from-altico-capitals-account-to-mashreq-bank-report-5563511.html
429,"HDFC Bank Q1 profit jumps 20% to Rs 6,658.6 crore, loan growth lifts NII 18%",https://www.moneycontrol.com/news/business/earnings/hdfc-bank-q1-profit-jumps-20-to-rs-6658-6-crore-loan-growth-lifts-nii-18-5564041.html
430,"HDFC Bank Q1 Preview: Double-digit growth seen in profit, NII, PPoP but provisions may remain elevated",https://www.moneycontrol.com/news/business/earnings/hdfc-bank-q1-preview-double-digit-growth-seen-in-profit-nii-ppop-but-provisions-may-remain-elevated-5563621.html
431,"Special fixed deposit scheme for senior citizens: SBI, ICICI Bank, HDFC Bank - comparative study",https://www.moneycontrol.com/news/business/special-fixed-deposit-scheme-for-senior-citizens-sbi-icici-bank-hdfc-bank-comparative-study-5563061.html
432,HDFC Bank: No impact on loan book due to alleged auto loan lending practices,https://www.moneycontrol.com/news/business/hdfc-bank-says-no-impact-on-loan-book-due-to-alleged-auto-loan-lending-practices-5544831.html
433,HDFC Bank probes auto loan practices; stock down 2%,https://www.moneycontrol.com/news/business/stocks/hdfc-bank-probes-auto-loan-practices-stock-down-2-5544471.html
434,HDFC Bank starts probe into auto loan practices following allegations,https://www.moneycontrol.com/news/business/hdfc-bank-starts-probe-into-auto-loan-practices-following-allegations-5543451.html
435,Slideshow | Top 10 companies by market cap last week; RIL biggest gainer,https://www.moneycontrol.com/news/photos/business/markets/slideshow-top-10-companies-by-market-cap-last-week-ril-biggest-gainer-5538121.html
436,Top five private banks stare at NPAs doubling to 5% in FY21,https://www.moneycontrol.com/news/india/top-5-private-banks-stare-at-npas-doubling-to-5-in-fy21-5533561.html
437,HDFC Bank annual report 2019-20: Here are 10 key highlights,https://www.moneycontrol.com/news/business/companies/hdfc-bank-annual-report-2019-20-here-are-10-key-highlights-5522851.html
438,Sterlite Power refinances Gurugram Palwal Transmission project,https://www.moneycontrol.com/news/india/sterlite-power-refinances-gurugram-palwal-transmission-project-5512751.html
439,HDFC Bank shares jump 3% on robust loan growth; CLSA retains overweight call,https://www.moneycontrol.com/news/business/stocks/hdfc-bank-shares-jump-3-on-robust-loan-growth-clsa-retains-overweight-call-5511811.html
440,"Slideshow | Top companies by market cap last week; TCS, RIL biggest gainer",https://www.moneycontrol.com/news/photos/business/markets/slideshow-top-companies-by-market-cap-last-week-tcs-ril-biggest-gainer-5509481.html
441,"HDFC Bank deposits rise 25% YoY in Q1 FY21, advances grow 21%",https://www.moneycontrol.com/news/business/markets/hdfc-bank-deposits-rise-25-yoy-in-q1-fy21-advances-grow-21-5509421.html
442,Buy HDFC Bank; target of Rs 1300: Dolat Capital,https://www.moneycontrol.com/news/business/stocks/buy-hdfc-bank-target-of-rs-1300-dolat-capital-5503141.html
443,Weekly Tactical Pick: HDFC Bank,https://www.moneycontrol.com/news/business/moneycontrol-research/weekly-tactical-pick-hdfc-bank-5502701.html
444,Buy HDFC Bank; target of Rs 1250: Motilal Oswal,https://www.moneycontrol.com/news/business/stocks/buy-hdfc-bank-target-of-rs-1250-motilal-oswal-5487001.html
445,"HDFC Bank plans to raise up to Rs 50,000 crore through bond issuances",https://www.moneycontrol.com/news/business/hdfc-bank-plans-to-raise-upto-rs-50000-crore-through-bond-issuances-5475831.html
446,Annual pay in FY20: HDFC Bank MD Aditya Puri’s Rs 18.9 crore vs SBI Chairman Rajnish Kumar’s Rs 31 lakh,https://www.moneycontrol.com/news/business/annual-pay-in-fy20-hdfc-bank-md-aditya-puris-rs-18-9-crore-vs-sbi-chairman-rajnish-kumars-rs-31-lakh-5455321.html
447,HDFC Bank well-placed to tide over COVID-19 crisis: Aditya Puri to stakeholders,https://www.moneycontrol.com/news/business/hdfc-bank-well-placed-to-tide-over-covid-19-crisis-aditya-puri-to-stakeholders-5452751.html
448,Slideshow | Top companies by market cap last week; RIL biggest gainer,https://www.moneycontrol.com/news/photos/business/markets/slideshow-top-companies-by-market-cap-last-week-ril-biggest-gainer-2-5435081.html
449,Hyundai Motor India partners with HDFC Bank for vehicle finance,https://www.moneycontrol.com/news/technology/auto/hyundai-motor-india-partners-with-hdfc-bank-for-vehicle-finance-5430761.html
450,"Retail digital payments rose to 20% of GDP in FY20, grew 70% YoY: Report",https://www.moneycontrol.com/news/business/retail-digital-payments-rose-to-20-of-gdp-in-fy20-grew-70-year-on-year-report-5429531.html
451,Indian economy to recover very fast: HDFC Bank CEO Aditya Puri,https://www.moneycontrol.com/news/india/indian-economy-to-recover-very-fast-hdfc-bank-ceo-aditya-puri-5423711.html
452,"Total loan book under moratorium saw a decline; HDFC Bank, ICICI top picks: Macquarie",https://www.moneycontrol.com/news/business/markets/total-loan-book-under-moratorium-saw-a-decline-hdfc-bank-icici-top-picks-macquarie-5422281.html
453,Consumer loans disbursement back to pre-COVID level: HDFC Bank,https://www.moneycontrol.com/news/india/consumer-loans-disbursement-back-to-pre-covid-level-hdfc-bank-5419641.html
454,HDFC Bank boss Aditya Puri's record as India's longest-serving bank CEO likely to be unbroken,https://www.moneycontrol.com/news/business/hdfc-bank-boss-aditya-puris-record-as-indias-longest-serving-bank-ceo-likely-to-be-unbroken-5404151.html
455,"RBI approves re-appointment of Kaizad Bharucha as ED, says HDFC Bank",https://www.moneycontrol.com/news/business/companies/rbi-approves-re-appointment-of-kaizad-bharucha-as-ed-says-hdfc-bank-5401171.html
456,HDFC Bank nets 2.5 lakh new customers through instant account opening in lockdown,https://www.moneycontrol.com/news/business/hdfc-bank-nets-2-5-lakh-new-customers-through-instant-account-opening-in-lockdown-5371521.html
457,Top-10 firms add Rs 2.46 lakh crore in market cap; RIL biggest gainer,https://www.moneycontrol.com/news/business/markets/top-10-firms-add-rs-2-46-lakh-crore-in-market-cap-ril-biggest-gainer-5371571.html
458,"Business Insight | Moody's downgrades SBI, HDFC Bank; should investors worry?",https://www.moneycontrol.com/news/business/business-insight-moodys-downgrades-sbi-hdfc-bank-should-investors-worry-5355401.html
459,"Moody's downgrades SBI, HDFC Bank after sovereign rating cut, explained",https://www.moneycontrol.com/news/business/moodys-downgrades-sbi-hdfc-bank-after-sovereign-rating-cut-explained-5350211.html
460,SBI tops UPI transactions with over a billion in four months,https://www.moneycontrol.com/news/business/sbi-tops-upi-transactions-with-over-a-billion-in-four-months-5344211.html
461,Seven of top-10 companies add Rs 1.76 lakh crore in m-cap; HDFC Bank shines,https://www.moneycontrol.com/news/business/seven-of-top-10-cos-add-rs-1-76-lakh-crore-in-m-cap-hdfc-bank-shines-5338251.html
462,"Maruti Suzuki, HDFC Bank to offer flexible car EMI schemes starting from Rs 899 per month",https://www.moneycontrol.com/news/business/maruti-suzuki-hdfc-bank-to-offer-flexible-car-emi-schemes-starting-from-rs-899-per-month-5326311.html
463,10-15% moderation in salaries not to impact lending practice: HDFC Bank,https://www.moneycontrol.com/news/india/10-15-moderation-in-salaries-not-to-impact-lending-practice-hdfc-bank-5323231.html
464,'Expect markets to be volatile amid uncertain global sentiment; these 3 stocks can give double-digit returns',https://www.moneycontrol.com/news/business/markets/expect-markets-to-be-volatile-amid-uncertain-global-sentiment-these-3-stocks-can-give-double-digit-returns-5277701.html
465,Slideshow | Top companies by market cap last week; Bharti Airtel biggest gainer,https://www.moneycontrol.com/news/photos/business/markets/slideshow-top-companies-by-market-cap-last-week-bharti-airtel-biggest-gainer-5278171.html
466,These 4 stocks could benefit from asset allocation shift in households post COVID-19 world,https://www.moneycontrol.com/news/business/markets/these-4-stocks-could-benefit-from-asset-allocation-shift-in-households-post-covid-19-world-5271581.html
467,Opinion | Why is popcorn so expensive at the movies?,https://www.moneycontrol.com/news/opinion/opinion-why-is-popcorn-so-expensive-at-the-movies-3386901.html
468,HDFC Bank's HDB Financial Services fires many amid lockdown: Report,https://www.moneycontrol.com/news/business/hdfc-banks-hdb-financial-services-fires-many-amid-lockdown-report-5249881.html
469,Buy HDFC Bank; target of Rs 1200: Motilal Oswal,https://www.moneycontrol.com/news/business/stocks/buy-hdfc-bank-target-of-rs-1200-motilal-oswal-5230441.html
470,Buy HDFC Bank; target of Rs 1100: ICICI Direct,https://www.moneycontrol.com/news/business/stocks/buy-hdfc-bank-target-of-rs-1100-icici-direct-5223541.html
471,"ABCD Harmonic, Inverse Head and Shoulder patterns signal Nifty may march towards 9,650",https://www.moneycontrol.com/news/business/markets/abcd-harmonic-inverse-head-and-shoulder-patterns-signal-nifty-may-march-towards-9650-5190241.html
472,Nifty Bank gains 1% as Jefferies assumes coverage on financial stocks,https://www.moneycontrol.com/news/business/markets/nifty-bank-gains-1-as-jefferies-assumes-coverage-on-financial-stocks-5180501.html
473,Trying to keep out Chinese investors can turn out to be counterproductive,https://www.moneycontrol.com/news/opinion/trying-to-keep-out-chinese-investors-can-turn-out-to-be-counterproductive-5176901.html
474,Ideas For Profit | Decoding the impact of COVID-19 on HDFC Bank's growth,https://www.moneycontrol.com/news/business/companies/ideas-for-profit-decoding-the-impact-of-covid-19-on-hdfc-banks-growth-5168591.html
475,HDFC Bank posts decent earnings in Q4 despite higher provisions; key highlights from analysts call,https://www.moneycontrol.com/news/business/earnings/hdfc-bank-posts-decent-earnings-in-q4-despite-higher-provisions-key-highlights-from-analysts-call-5165781.html
476,"HDFC Bank Q4 strong, but will COVID-19 derail bank’s upward journey?",https://www.moneycontrol.com/news/business/moneycontrol-research/hdfc-bank-q4-strong-but-will-covid-19-derail-banks-upward-journey-5164941.html
477,"What should investors do with HDFC Bank stock post Q4: buy, sell or hold?",https://www.moneycontrol.com/news/business/stocks/hdfc-bank-share-price-rises-5-after-reporting-q4-numbers-5165121.html
478,"HDFC Bank board finalises Aditya Puri's successor, waits for RBI nod",https://www.moneycontrol.com/news/india/hdfc-bank-board-finalises-aditya-puris-successor-waits-for-rbi-nod-5163171.html
479,India's sovereign rating restricting upgrade on HDFC Bank's ratings: S&P global ratings,https://www.moneycontrol.com/news/india/indias-sovereign-rating-restricting-upgrade-on-hdfc-banks-ratings-sp-global-ratings-5163051.html
480,"HDFC Bank Q4: Good show, but the COVID-19 shock is likely to weigh heavily beginning June quarter",https://www.moneycontrol.com/news/business/hdfc-bank-q4-good-show-but-the-covid-19-shock-is-likely-to-weigh-heavily-beginning-june-quarter-5162951.html
481,HDFC Bank earnings review: Here are 10 key takeaways from its Q4 show,https://www.moneycontrol.com/news/business/markets/hdfc-bank-earnings-review-here-are-10-key-takeaways-from-its-q4-show-5162911.html
482,"HDFC Bank Q4 profit rises 18% to Rs 6,928 cr, NII growth at 16%",https://www.moneycontrol.com/news/business/earnings/hdfc-bank-q4-profit-rises-18-at-rs-6928-cr-asset-quality-improves-5162471.html
483,"HDFC Bank Q4 profit growth expected to be over 20%, gross NPAs may inch up",https://www.moneycontrol.com/news/business/earnings/hdfc-bank-q4-profit-growth-expected-to-be-over-20-gross-npas-may-inch-up-5160131.html
484,Top 10 firms add over Rs 4 lakh cr in m-cap; RIL sparkles,https://www.moneycontrol.com/news/business/companies/top-10-firms-add-over-rs-4-lakh-cr-in-m-cap-ril-sparkles-5135861.html
