,Headlines,Links
485,"RBI holds off key additions to HDFC Bank board, fuels buzz of in-house successor to Puri",https://www.moneycontrol.com/news/business/rbi-holding-off-key-appointments-to-hdfc-bank-board-fuels-speculations-of-an-internal-candidate-succeeding-puri-5125031.html
486,HDFC Bank cuts lending rate by 0.20%,https://www.moneycontrol.com/news/business/hdfc-bank-cuts-lending-rate-by-0-20-5124171.html
487,RBI asks HDFC Bank to submit proposal on two appointments after new CEO takes over,https://www.moneycontrol.com/news/business/rbi-asks-hdfc-bank-to-submit-proposal-on-two-appointments-after-new-ceo-takes-over-5124041.html
488,SBI cuts deposit rate to 2.75%: Check out the banks offering highest interest rates for your money,https://www.moneycontrol.com/news/business/sbi-savings-rate-now-2-75-check-out-which-bank-offers-highest-interest-5120231.html
489,EMI moratorium: ICICI Bank vs HDFC Bank vs Axis Bank - all you need to know,https://www.moneycontrol.com/news/business/emi-moratorium-icici-bank-vs-hdfc-bank-vs-axis-bank-all-you-need-to-know-5114621.html
490,"HDFC Bank bucks trend, reports 7.4% rise in deposits in March-qtr",https://www.moneycontrol.com/news/business/coronavirus-lockdown-hdfc-bank-bucks-trend-reports-7-4-rise-in-deposits-in-march-qtr-5109851.html
491,Coronavirus pandemic | HDFC Bank offers loan deferment option to customers,https://www.moneycontrol.com/news/india/coronavirus-pandemic-hdfc-bank-offers-loan-deferment-option-to-customers-5098151.html
492,Theleme Master Fund picks up HDFC Bank shares worth Rs 280cr,https://www.moneycontrol.com/news/business/markets/theleme-master-fund-picks-up-hdfc-bank-shares-worth-rs-280cr-5088751.html
493,Watch: Ideas For Profit | Decoding the impact of COVID-19 on HDFC Bank's performance,https://www.moneycontrol.com/news/opinion/watch-ideas-for-profit-decoding-the-impact-of-covid-19-on-hdfc-banks-performance-5080821.html
494,Diamonds in the Dust: COVID-19 speed breaker unlikely to derail this private bank’s ascent,https://www.moneycontrol.com/news/business/moneycontrol-research/diamonds-in-the-dust-covid-19-speed-breaker-unlikely-to-derail-this-private-banks-ascent-5078861.html
495,HDFC Bank shares surge 12%; Morgan Stanley says the stock is well positioned in uncertain times,https://www.moneycontrol.com/news/business/markets/hdfc-bank-shares-surge-12-morgan-stanley-says-the-stock-well-positioned-in-uncertain-times-5071931.html
496,"India Inc facing cash flow problems, need a non-scheduled rate cut, says HDFC Bank’s Aditya Puri",https://www.moneycontrol.com/news/business/india-inc-facing-cash-flow-problems-need-a-non-scheduled-rate-cut-says-hdfc-banks-aditya-puri-5061331.html
497,Ideas for Profit | Why the sharp correction in ICICI Bank’s stock is an exaggeration?,https://www.moneycontrol.com/news/eye-on-india/videos/ideas-for-profit-why-the-sharp-correction-in-icici-banks-stock-is-an-exaggeration-5055751.html
498,Why analysts are sharply divided over HDFC Bank's unsecured retail loan book,https://www.moneycontrol.com/news/business/why-analysts-are-sharply-divided-over-hdfc-banks-unsecured-retail-loan-book-5054091.html
499,"UBS maintains ‘buy’ on HDFC Bank, 4 highlights of conference call",https://www.moneycontrol.com/news/business/markets/ubs-maintains-buy-on-hdfc-bank-4-highlights-of-conference-call-5053761.html
500,HDFC Bank share price slips further; tough times ahead?,https://www.moneycontrol.com/news/business/markets/hdfc-bank-share-price-slips-further-tough-times-ahead-5053561.html
501,Axis Bank to invest Rs 600 crore in Yes Bank via equity,https://www.moneycontrol.com/news/business/axis-bank-to-invest-rs-600-crore-in-yes-bank-via-equity-5031411.html
502,"Six of top-10 firms lose Rs 95,432 cr in m-cap; RIL takes biggest hit",https://www.moneycontrol.com/news/business/six-of-top-10-firms-lose-rs-95432-cr-in-m-cap-ril-takes-biggest-hit-5014011.html
503,"HDFC Bank share price rises as Citi maintains buy, target at Rs 1,600",https://www.moneycontrol.com/news/business/stocks/hdfc-bank-share-price-rises-as-citi-maintains-buy-target-at-rs-1600-5003321.html
504,The unenviable job of Aditya Puri's successor at HDFC Bank,https://www.moneycontrol.com/news/business/companies/the-unenviable-job-of-aditya-puris-successor-at-hdfc-bank-5002111.html
505,"Aditya Puri successor: HDFC Bank recasts search panel, Keki Mistry replaced by Renu Karnad",https://www.moneycontrol.com/news/business/aditya-puri-successor-hdfc-bank-recasts-search-panel-keki-mistry-replaced-by-renu-karnad-5002051.html
506,HDFC Bank launches co-branded credit card with IndiGo,https://www.moneycontrol.com/news/business/hdfc-bank-launches-co-branded-credit-card-with-indigo-4985471.html
507,"Worry on my succession is overblown, says HDFC Bank's Aditya Puri",https://www.moneycontrol.com/news/business/worry-on-my-succession-is-overblown-says-hdfc-banks-aditya-puri-4983311.html
508,Aditya Puri denies rumours of differences with Deepak Parekh over successor,https://www.moneycontrol.com/news/business/aditya-puri-denies-rumours-of-differences-with-deepak-parekh-4981631.html
509,HDFC Bank aims to be go-to bank for start-ups,https://www.moneycontrol.com/news/business/hdfc-bank-eyes-to-become-go-to-bank-for-start-ups-4976001.html
510,HDFC Bank SME book doubles to Rs 1.48 lakh cr in under 3 years,https://www.moneycontrol.com/news/business/hdfc-bank-sme-book-doubles-to-rs-1-48-lakh-cr-in-under-3-years-4963381.html
511,HDFC Bank completes 25 years of operations,https://www.moneycontrol.com/news/business/hdfc-bank-completes-25-years-of-operations-4957411.html
512,"HDFC Bank, Mastercard, SAP Concur join hands to manage spending in corporate sector",https://www.moneycontrol.com/news/business/hdfc-bank-mastercard-sap-concor-join-hands-to-manage-spending-in-corporate-sector-4957071.html
513,Aditya Puri sells holding worth Rs 156 crore in HDFC Bank,https://www.moneycontrol.com/news/business/aditya-puri-sells-holding-worth-rs-156-crore-in-hdfc-bank-4950301.html
514,Eight of top-10 companies add over Rs 1 lakh cr in m-cap; RIL leads,https://www.moneycontrol.com/news/business/eight-of-top-10-companies-add-over-rs-1-lakh-cr-in-m-cap-ril-leads-4949201.html
515,HDFC Bank appoints Anjani Rathor chief digital officer,https://www.moneycontrol.com/news/business/hdfc-bank-appoints-anjani-rathor-chief-digital-officer-4924501.html
516,RBI will have to do heavy lifting to boost growth by cutting rates: HDFC Bank,https://www.moneycontrol.com/news/business/economy/rbi-will-have-to-do-heavy-lifting-to-boost-growth-by-cutting-rates-hdfc-bank-4910621.html
517,Two-day PSU bank strike impacts services,https://www.moneycontrol.com/news/business/two-day-psu-bank-strike-impacts-services-4884911.html
518,"Q3 earnings: Private lenders deliver on profitability, but slippages a concern",https://www.moneycontrol.com/news/business/companies/q3-earnings-private-lenders-deliver-on-profitability-but-slippages-a-concern-4876161.html
519,"6 of top-10 companies lose Rs 81,148cr in m-cap",https://www.moneycontrol.com/news/business/6-of-top-10-companies-lose-rs-81148cr-in-m-cap-4859211.html
520,HDFC to tap Egon Zehnder to identify Aditya Puri's successor: Sources,https://www.moneycontrol.com/news/business/hdfc-to-tap-egon-zehnder-to-identify-aditya-puris-successor-sources-4849641.html
521,Buy HDFC Bank; target of Rs 1406: Prabhudas Lilladher,https://www.moneycontrol.com/news/business/stocks/buy-hdfc-bank-target-of-rs-1406-prabhudas-lilladher-4848531.html
522,Buy HDFC Bank; target of Rs 1550: ICICI Direct,https://www.moneycontrol.com/news/business/stocks/buy-hdfc-bank-target-of-rs-1550-icici-direct-2-4843771.html
523,Bad loan hit banks wary of corporate loans; what it means for a struggling economy?,https://www.moneycontrol.com/news/business/companies/bad-loan-hit-banks-wary-of-corporate-loans-what-it-means-for-a-struggling-economy-4837451.html
524,Buy HDFC Bank; target of Rs 1550: ICICI Direct,https://www.moneycontrol.com/news/business/stocks/buy-hdfc-bank-target-of-rs-1550-icici-direct-4839651.html
525,"HDFC Bank clarifies why its mobile, online services were recently disrupted",https://www.moneycontrol.com/news/business/hdfc-bank-clarifies-why-its-mobile-online-services-were-recently-disrupted-4833081.html
526,"HDFC Bank Q3: Mixed numbers; should investors buy, sell or hold?",https://www.moneycontrol.com/news/business/markets/hdfc-bank-q3-mixed-numbers-should-investors-buy-sell-or-hold-4834081.html
527,"HDFC Bank Consolidated December 2019 Net Interest Income (NII) at Rs 15,127.65 crore, up  13.13% Y-o-Y",https://www.moneycontrol.com/news/business/earnings/hdfc-bank-consolidated-december-2019-net-interest-income-nii-at-rs-15127-65-crore-up-13-13-y-o-y-4833281.html
528,"HDFC Bank Standalone December 2019 Net Interest Income (NII) at Rs 14,172.90 crore, up  12.69% Y-o-Y",https://www.moneycontrol.com/news/business/earnings/hdfc-bank-standalone-december-2019-net-interest-income-nii-at-rs-14172-90-crore-up-12-69-y-o-y-4833491.html
529,Q3FY20 review: HDFC Bank shows no signs of slowdown,https://www.moneycontrol.com/news/business/moneycontrol-research/q3fy20-review-hdfc-bank-shows-no-signs-of-slowdown-4832501.html
530,Banking wrap: HDFC Bank Q3 profit jumps 33%; Michael Patra takes over as RBI Dy Guv,https://www.moneycontrol.com/news/business/banking-wrap-hdfc-bank-q3-profit-jumps-33-michael-patra-takes-over-as-rbi-dy-guv-4831431.html
531,"6 of top-10 most valued firms add Rs 62,773 cr in market cap; HUL, RIL show the way",https://www.moneycontrol.com/news/business/6-of-top-10-most-valued-firms-add-rs-62773-cr-in-market-cap-hul-ril-show-the-way-4831181.html
532,"HDFC Bank Q3 profit jumps 33%, but asset quality weakens, provisions spike",https://www.moneycontrol.com/news/business/earnings/hdfc-bank-q3-profit-jumps-33-but-asset-quality-weakens-provisions-spike-4830641.html
533,"HDFC Bank Q3 profit likely to grow over 20%, but slow loan growth may limit NII",https://www.moneycontrol.com/news/business/earnings/hdfc-bank-q3-profit-likely-to-grow-over-20-but-slow-loan-growth-may-limit-nii-4827611.html
534,HDFC Bank credit card services to be temporarily unavailable on January 18,https://www.moneycontrol.com/news/business/hdfc-bank-credit-card-services-to-be-temporarily-unavailable-on-january-18-4821021.html
535,"Seven of top-10 companies add Rs 32,020 cr in m-cap; HDFC Bank, RIL lead",https://www.moneycontrol.com/news/business/seven-of-top-10-companies-add-rs-32020-cr-in-m-cap-hdfc-bank-ril-lead-4807961.html
536,"HDFC Bank launches service for religious bodies, societies and clubs",https://www.moneycontrol.com/news/business/hdfc-bank-launches-service-for-religious-bodies-societies-and-clubs-4801321.html
537,"HDFC Bank share price rises 2% on strong loan, deposits growth",https://www.moneycontrol.com/news/business/markets/hdfc-bank-share-price-rises-2-on-strong-loan-deposits-growth-4792271.html
538,In pics | Take a look at some of the world's longest-serving CEOs,https://www.moneycontrol.com/news/photos/business/in-pics-a-look-at-some-of-the-longest-serving-ceos-4760161.html
539,"Non-banking PSU stocks, private banks, metals likely to hog limelight in 2020",https://www.moneycontrol.com/news/business/markets/non-banking-psu-stocks-private-banks-metals-likely-to-hog-limelight-in-2020-4760191.html
540,Top 20 stocks where the ultra-rich are parking their money; do you own any?,https://www.moneycontrol.com/news/business/markets/top-20-stocks-where-the-ultra-rich-are-parking-their-money-do-you-own-any-4753431.html
541,"'Invest 65% portfolio capital in equities in 2020; RIL, HDFC Bank among top buys'",https://www.moneycontrol.com/news/business/markets/invest-65-portfolio-capital-in-equities-in-2020-ril-hdfc-bank-among-top-buys-4748421.html
542,"TCS, RIL, HDFC Bank can notch Rs 20 lakh cr in m-cap over next few years: Raamdeo Agrawal",https://www.moneycontrol.com/news/business/markets/tcs-ril-hdfc-bank-can-notch-rs-20-lakh-cr-in-m-cap-over-next-few-years-raamdeo-agrawal-4741081.html
543,"HDFC Bank, Mastek top short-term picks for up to 14% return",https://www.moneycontrol.com/news/business/markets/hdfc-bank-mastek-top-short-term-picks-for-up-to-14-return-4740561.html
544,How much upside can HDB create for HDFC Bank’s stock price?,https://www.moneycontrol.com/news/business/moneycontrol-research/how-much-upside-can-hdb-create-for-hdfc-banks-stock-price-4739861.html
545,Are India’s Consistent Compounders maxed out?,https://www.moneycontrol.com/news/opinion/are-indias-consistent-compounders-maxed-out-4714851.html
546,Sebi is right in favouring clients over Karvy’s lenders,https://www.moneycontrol.com/news/opinion/sebi-is-right-in-favouring-clients-over-karvys-lenders-4714311.html
547,"Morgan Stanley bullish on ICICI Bank, Grasim among 5 stocks",https://www.moneycontrol.com/news/business/markets/morgan-stanley-bullish-on-icici-bank-grasim-among-5-stocks-4711031.html
548,RBI team looking at HDFC Bank online banking glitches: Deputy Governor MK Jain,https://www.moneycontrol.com/news/business/rbi-team-looking-at-hdfc-bank-online-banking-glitches-deputy-governor-mk-jain-4703651.html
549,CIC issues show-cause notice to RBI for casual approach to its notice,https://www.moneycontrol.com/news/india/cic-issues-show-cause-notice-to-rbi-for-casual-approach-to-its-notice-4703511.html
550,"D-Street Buzz: Bank Nifty slips 300 points dragged by PNB, BoB; HDFC Bank top negative contributor",https://www.moneycontrol.com/news/business/markets/d-street-buzz-bank-nifty-slips-300-points-dragged-by-pnb-bob-hdfc-bank-top-negative-contributor-4695631.html
551,Karvy case: SAT halts further transfer of client securities after lenders challenge SEBI decision,https://www.moneycontrol.com/news/business/markets/karvy-case-sat-directs-nsdl-to-halt-further-transfer-of-client-shares-4695151.html
552,HDFC Bank customers still unable to access online banking services,https://www.moneycontrol.com/news/business/companies/hdfc-bank-customers-unable-to-access-online-banking-services-4693061.html
553,Banking wrap: Private lenders tap capital markets for equity; Yes Bank decides to raise $2 bn via preferential allotment,https://www.moneycontrol.com/news/business/banking-wrap-private-lenders-tap-capital-markets-for-equity-yes-bank-decides-to-raise-2-billion-via-preferential-allotment-4689351.html
554,HDFC Bank sets up panel to identify Aditya Puri's successor,https://www.moneycontrol.com/news/business/hdfc-bank-sets-up-panel-to-identify-aditya-puris-successor-4683351.html
555,In Detail | Strong lenders will gain from the ongoing crisis,https://www.moneycontrol.com/news/opinion/in-detail-strong-lenders-will-gain-from-the-ongoing-crisis-4679451.html
556,"HDFC Bank to have 200 branches in north-east, hire 2,000 people",https://www.moneycontrol.com/news/business/hdfc-bank-to-have-200-branches-in-north-east-hire-2000-people-4635871.html
557,"Buy HDFC Bank, target Rs 1,410: Anand Rathi",https://www.moneycontrol.com/news/business/markets/buy-hdfc-bank-target-rs-1410-anand-rathi-4630141.html
558,"Top private banks scale up on branches, deposit mobilisation",https://www.moneycontrol.com/news/business/companies/top-private-banks-scale-up-on-branches-deposit-mobilisation-4583791.html
559,Record high in Samvat 2076: Top 10 high-quality stocks for your portfolio  ,https://www.moneycontrol.com/news/business/markets/record-high-in-samvat-2076-top-10-high-quality-stocks-for-your-portfolio-4578921.html
560,Half a dozen research ideas for a rewarding and safe investment journey in Samvat 2076,https://www.moneycontrol.com/news/business/moneycontrol-research/half-a-dozen-research-ideas-for-a-rewarding-and-safe-investment-journey-in-samvat-2076-4573601.html
561,"HDFC Bank Consolidated September 2019 Net Interest Income (NII) at Rs 14,458.44 crore, up  0% Y-o-Y",https://www.moneycontrol.com/news/business/earnings/hdfc-bank-consolidated-september-2019-net-interest-income-nii-at-rs-14458-44-crore-up-0-y-o-y-3-4571851.html
562,Buy HDFC Bank target of Rs 1510: Sharekhan,https://www.moneycontrol.com/news/business/stocks/buy-hdfc-bank-target-of-rs-1510-sharekhan-2-4562821.html
563,"HDFC Bank Consolidated September 2019 Net Interest Income (NII) at Rs 14,458.44 crore",https://www.moneycontrol.com/news/business/earnings/hdfc-bank-consolidated-september-2019-net-interest-income-nii-at-rs-14458-44-crore-up-0-y-o-y-2-4558261.html
564,Buy HDFC Bank; target of Rs 1440: ICICI Direct,https://www.moneycontrol.com/news/business/stocks/buy-hdfc-bank-target-of-rs-1440-icici-direct-4557711.html
565,Consistent performer! Brokerages raise target price for HDFC Bank post Q2 results,https://www.moneycontrol.com/news/business/markets/consistent-performer-brokerages-raise-target-price-for-hdfc-bank-post-q2-results-4556431.html
566,"Market Headstart: Nifty50 seen opening lower; Infosys, RIL eyed",https://www.moneycontrol.com/news/business/markets/market-headstart-nifty50-seen-opening-lower-infosys-ril-eyed-4555831.html
567,Happy to sacrifice margins in lieu of deposits: HDFC Bank,https://www.moneycontrol.com/news/business/companies/happy-to-sacrifice-margins-in-lieu-of-deposits-hdfc-bank-4554581.html
568,HDFC Bank’s Q2 show is stellar. Can it continue?,https://www.moneycontrol.com/news/business/moneycontrol-research/hdfc-banks-q2-show-is-stellar-can-it-continue-4552161.html
569,"HDFC Bank Standalone September 2019 Net Interest Income (NII) at Rs 13,515.04 crore, up  14.89% Y-o-Y",https://www.moneycontrol.com/news/business/earnings/hdfc-bank-standalone-september-2019-net-interest-income-nii-at-rs-13515-04-crore-up-14-89-y-o-y-4551521.html
570,Banking wrap: RBI MPC minutes signal more rate cuts; PMC Bank raises withdrawal limit,https://www.moneycontrol.com/news/business/banking-wrap-rbi-mpc-minutes-signal-more-rate-cuts-pmc-bank-raises-withdrawal-limit-4551321.html
571,"HDFC Bank Q2 profit jumps 27% to Rs 6,345 cr, asset quality stable",https://www.moneycontrol.com/news/business/markets/hdfc-bank-q2-profit-jumps-27-to-rs-6345-cr-asset-quality-stable-4550361.html
572,"HDFC Bank Q2 profit, PPoP could grow over 20% with stable asset quality",https://www.moneycontrol.com/news/business/markets/hdfc-bank-q2-profit-ppop-could-grow-over-20-with-stable-asset-quality-4549291.html
573,HDFC Bank clarifies deposit insurance cover stamp on passbooks only to comply with RBI guidelines,https://www.moneycontrol.com/news/business/hdfc-bank-clarifies-deposit-insurance-cover-stamp-on-passbooks-only-to-comply-with-rbi-guidelines-4549431.html
574,"'Credibility of banking sector badly hit; invest in SBI, ICICI, Axis & HDFC Bank'",https://www.moneycontrol.com/news/business/markets/credibility-of-banking-sector-badly-hit-invest-in-sbi-icici-axis-hdfc-bank-4528391.html
575,"HDFC Bank Q2 Net Profit seen up 9.2% YoY to Rs. 5,466 cr: KR Choksey",https://www.moneycontrol.com/news/business/earnings/hdfc-bank-q2-net-profit-seen-up-9-2-yoy-to-rs-5466-cr-kr-choksey-4525601.html
576,HDFC Bank takes its 'Festive Treats' to rural India,https://www.moneycontrol.com/news/business/companies/hdfc-bank-takes-its-festive-treats-to-rural-india-4516231.html
577,"HDFC Bank Q2 Net Profit seen up 29.8% YoY to Rs. 6,496.2 cr: ICICI Direct",https://www.moneycontrol.com/news/business/earnings/hdfc-bank-q2-net-profit-seen-up-29-8-yoy-to-rs-6496-2-cr-icici-direct-4515021.html
578,HDFC Bank climbs 3% as Motilal Oswal remains bullish after Q2 loan growth,https://www.moneycontrol.com/news/business/markets/hdfc-bank-climbs-3-as-motilal-oswal-remains-bullish-after-q2-loan-growth-4508311.html
579,"What is brewing in Nifty Service Index? HDFC Ltd, Infosys, Bajaj Finserv top buys",https://www.moneycontrol.com/news/business/markets/what-is-brewing-in-nifty-service-index-hdfc-ltd-infosys-bajaj-finserv-top-buys-4508041.html
580,RBI slashes repo rate by 25 bps: Top 17 stocks likely to benefit from the cut,https://www.moneycontrol.com/news/business/markets/rbi-slashes-repo-rate-by-25-bps-top-17-stocks-likely-to-benefit-from-the-cut-4499201.html
581,Customers from various banks unable to use net banking services; technical glitch suspected,https://www.moneycontrol.com/news/business/simultaneous-issue-in-netbanking-services-of-several-banks-reported-by-customers-4494431.html
582,Demand uptick seen in semi-urban and rural India: Aditya Puri,https://www.moneycontrol.com/news/business/economy/demand-uptick-seen-in-semi-urban-and-rural-india-aditya-puri-4489461.html
583,"HDFC Bank takes on e-commerce majors, launches three-month-long discount campaign",https://www.moneycontrol.com/news/business/companies/hdfc-bank-takes-on-e-commerce-majors-launches-three-month-long-discount-campaign-4489801.html
584,Buy HDFC Bank; target of Rs 1510: Sharekhan,https://www.moneycontrol.com/news/business/stocks/buy-hdfc-bank-target-of-rs-1510-sharekhan-4465101.html
585,"HDFC Bank to hold 1,000 grameen loan melas over next 6 months",https://www.moneycontrol.com/news/business/companies/hdfc-bank-to-hold-1000-grameen-loan-melas-over-next-6-months-4462401.html
586,Altico Capital seeks time to restructure debt,https://www.moneycontrol.com/news/business/altico-capital-seeks-time-to-restructure-debt-4462301.html
587,These 20 Nifty 50 companies pay more than 30% tax rate; time to buy?,https://www.moneycontrol.com/news/business/markets/these-20-nifty-50-companies-pay-more-than-30-tax-rate-time-to-buy-4458601.html
588,Altico default crisis: SBI chief’s remarks miss the point,https://www.moneycontrol.com/news/opinion/altico-default-crisis-sbi-chiefs-remarks-miss-the-point-4447771.html
589,"Market Headstart: Nifty seen opening higher; HDFC Bank, Castrol top buys",https://www.moneycontrol.com/news/business/markets/market-headstart-nifty-seen-opening-higher-hdfc-bank-castrol-top-buys-4432441.html
590,HDFC Bank doubles mid-corporate loan book in 3 years; may cross Rs 1L cr mark by Sept-end,https://www.moneycontrol.com/news/business/hdfc-bank-doubles-mid-corporate-loan-book-in-3-years-may-cross-rs-1l-cr-mark-by-sept-end-4427861.html
591,"Market Headstart: Nifty likely to open higher; SBI, HDFC Bank top buys",https://www.moneycontrol.com/news/business/markets/market-headstart-nifty-likely-to-open-higher-sbi-hdfc-bank-top-buys-4409101.html
592,"Market Headstart: Nifty likely to open flat; SBI, Supreme Industries top buys",https://www.moneycontrol.com/news/business/markets/market-headstart-nifty-likely-to-open-flat-sbi-supreme-industries-top-buys-4388471.html
593,HDFC Bank says no risks to consumption story yet,https://www.moneycontrol.com/news/business/companies/hdfc-bank-says-no-risks-to-consumption-story-yet-4370081.html
594,HDFC Bank falls 2% amid management rejig; Srinivasan Vaidyanathan new CFO,https://www.moneycontrol.com/news/business/markets/hdfc-bank-falls-2-amid-management-rejig-srinivasan-vaidyanathan-new-cfo-4364911.html
595,HDFC Banks CSR spend rises 20% to Rs 444 cr in FY19,https://www.moneycontrol.com/news/business/hdfc-banks-csr-spend-rises-20-to-rs-444-cr-in-fy19-4338101.html
596,SWIFT may run trials for instant cross-border payments in India,https://www.moneycontrol.com/news/business/swift-may-run-trials-for-instant-cross-border-payments-in-india-4335911.html
597,Bank of India cuts MCLR by 25 basis points from August 10,https://www.moneycontrol.com/news/business/bank-of-india-cuts-mclr-by-25-basis-points-from-august-10-4317251.html
598,‘Bajaj Twins more susceptible to further correction compared to HDFC twins’,https://www.moneycontrol.com/news/business/markets/bajaj-twins-more-susceptible-to-further-correction-compared-to-hdfc-twins-4300801.html
599,HDFC Bank reduces lending rates by 10 bps,https://www.moneycontrol.com/news/business/markets/hdfc-bank-reduces-lending-rates-by-10-bps-4298901.html
600,"Banks suggest auto, home loans in 1 hour to spur growth",https://www.moneycontrol.com/news/business/banks-suggest-auto-home-loans-in-1-hour-to-spur-growth-4294651.html
601,"Buy HDFC Bank, target Rs 2,820: Anand Rathi",https://www.moneycontrol.com/news/business/markets/buy-hdfc-bank-target-rs-2820-anand-rathi-3-4290641.html
602,Market loses momentum as investors book profits in HRITHIK stocks; more pain ahead?,https://www.moneycontrol.com/news/business/markets/market-loses-momentum-as-investors-book-profits-in-hrithik-stocks-more-pain-ahead-4259051.html
603,Hold HDFC Bank; target of Rs 2400: ICICI Direct,https://www.moneycontrol.com/news/business/stocks/hold-hdfc-bank-target-of-rs-2400-icici-direct-4235851.html
604,Buy HDFC Bank; target of Rs 2750: Sharekhan,https://www.moneycontrol.com/news/business/stocks/buy-hdfc-bank-target-of-rs-2750-sharekhan-2-4234291.html
605,Buy HDFC Bank; target of Rs 2683: KR Choksey,https://www.moneycontrol.com/news/business/stocks/buy-hdfc-bank-target-of-rs-2683-kr-choksey-2-4234881.html
606,Buy HDFC Bank; target of Rs 2700: Prabhudas Lilladher,https://www.moneycontrol.com/news/business/stocks/buy-hdfc-bank-target-of-rs-2700-prabhudas-lilladher-2-4229921.html
607,Buy HDFC Bank; target of Rs 2750: Motilal Oswal,https://www.moneycontrol.com/news/business/stocks/buy-hdfc-bank-target-of-rs-2750-motilal-oswal-4231871.html
608,"D-Street Buzz: 500 stocks hit 52-week low on BSE; HDFC Bank falls 3%, VIX spikes",https://www.moneycontrol.com/news/business/markets/d-street-buzz-500-stocks-hit-52-week-low-on-bse-hdfc-bank-falls-3-vix-spikes-4229841.html
609,"HDFC Bank Consolidated June 2019 Net Interest Income (NII) at Rs 14,199.30 crore, up  22.78% Y-o-Y",https://www.moneycontrol.com/news/business/earnings/hdfc-bank-consolidated-june-2019-net-interest-income-nii-at-rs-14199-30-crore-up-22-78-y-o-y-4230021.html
610,"HDFC Bank Standalone June 2019 Net Interest Income (NII) at Rs 13,294.25 crore, up  22.94% Y-o-Y",https://www.moneycontrol.com/news/business/earnings/hdfc-bank-standalone-june-2019-net-interest-income-nii-at-rs-13294-25-crore-up-22-94-y-o-y-4229951.html
