,Headlines,Links
243,Reserve Bank of India imposes Rs 10 crore penalty on HDFC Bank,https://www.moneycontrol.com/news/business/auto-loan-irregularity-reserve-bank-of-india-imposes-rs-10-crore-monetary-penalty-on-hdfc-bank-6957591.html
244,HDFC bank deploys Mobile ATM in Bengaluru,https://www.moneycontrol.com/news/trends/hdfc-bank-deploys-mobile-atm-in-bengaluru-6940801.html
245,Not able to use your debit card for online transactions? Here's why your bank may have blocked it,https://www.moneycontrol.com/news/business/personal-finance/not-able-to-use-your-debit-card-for-online-transactions-heres-why-your-bank-may-have-blocked-it-6917011.html
246,HDFC Bank announces top management rejig under new CEO Sashidhar Jagdishan,https://www.moneycontrol.com/news/business/hdfc-bank-announces-top-management-rejig-under-new-ceo-sashidhar-jagdishan-6840451.html
247,Race For Citi India assets: HDFC Bank may join long list of suitors,https://www.moneycontrol.com/news/business/companies/race-for-citi-india-assets-hdfc-bank-may-join-long-list-of-suitors-6813571.html
248,HDFC Bank deploys mobile ATMs in 19 cities to help customers withdraw cash amid COVID-19 restrictions,https://www.moneycontrol.com/news/india/hdfc-bank-deploys-mobile-atms-in-19-cities-to-help-customers-withdraw-cash-amid-covid-19-restrictions-6810941.html
249,RBI approves Atanu Chakraborty as HDFC Bank's part-time chairman,https://www.moneycontrol.com/news/business/rbi-approves-atanu-chakraborty-as-hdfc-banks-part-time-chairman-6805751.html
250,Buy HDFC Bank; target of Rs 1653: Geojit,https://www.moneycontrol.com/news/business/stocks/buy-hdfc-bank-target-of-rs-1653-geojit-6802601.html
251,"HDFC Bank Consolidated March 2021 Net Interest Income (NII) at Rs 18,523.68 crore, up  13.88% Y-o-Y",https://www.moneycontrol.com/news/business/earnings/hdfc-bank-consolidated-march-2021-net-interest-income-nii-at-rs-18523-68-crore-up-13-88-y-o-y-2-6797991.html
252,Buy HDFC Bank; target of Rs 1720: KR Choksey,https://www.moneycontrol.com/news/business/stocks/buy-hdfc-bank-target-of-rs-1720-kr-choksey-6797081.html
253,"HDFC Bank Standalone March 2021 Net Interest Income (NII) at Rs 17,120.15 crore, up  12.6% Y-o-Y",https://www.moneycontrol.com/news/business/earnings/hdfc-bank-standalone-march-2021-net-interest-income-nii-at-rs-17120-15-crore-up-12-6-y-o-y-2-6797431.html
254,Buy HDFC Bank; target of Rs 1850: Emkay Global Financial,https://www.moneycontrol.com/news/business/stocks/buy-hdfc-bank-target-of-rs-1850-emkay-global-financial-6787771.html
255,Accumulate HDFC Bank; target of Rs 1683: Arihant Capital,https://www.moneycontrol.com/news/business/stocks/accumulate-hdfc-bank-target-of-rs-1683-arihant-capital-6787781.html
256,Buy HDFC Bank; target of Rs 1800: Dolat Capital Market,https://www.moneycontrol.com/news/business/stocks/buy-hdfc-bank-target-of-rs-1800-dolat-capital-market-6787801.html
257,"Four months after ban, HDFC Bank still awaits RBI's green signal for new digital launches",https://www.moneycontrol.com/news/business/four-months-after-ban-hdfc-bank-still-awaits-rbis-green-signal-for-new-digital-launches-6793521.html
258,Buy HDFC Bank target of Rs 1735: Prabhudas Lilladher,https://www.moneycontrol.com/news/business/stocks/buy-hdfc-bank-target-of-rs-1735-prabhudas-lilladher-6787821.html
259,Buy HDFC Bank; target of Rs 1800: Motilal Oswal,https://www.moneycontrol.com/news/business/earnings/buy-hdfc-bank-target-of-rs-1800-motilal-oswal-6787841.html
260,Buy HDFC Bank: target of Rs 1810: Sharekhan,https://www.moneycontrol.com/news/business/stocks/buy-hdfc-bank-target-of-rs-1810-sharekhan-2-6787851.html
261,Buy HDFC Bank; target of Rs 1700: ICICI Direct,https://www.moneycontrol.com/news/business/buy-hdfc-bank-target-of-rs-1700-icici-direct-2-6792431.html
262,"HDFC Bank CEO Sashidhar Jagdishan writes to staff on tech issues, says working with regulator to overcome “the current situation”",https://www.moneycontrol.com/news/business/hdfc-bank-ceo-sashidhar-jagdishan-writes-to-staff-on-tech-issues-says-working-with-regulator-to-overcome-the-current-situation-6788521.html
263,"HDFC Bank Standalone March 2021 Net Interest Income (NII) at Rs 17,120.15 crore, up  12.6% Y-o-Y",https://www.moneycontrol.com/news/business/earnings/hdfc-bank-standalone-march-2021-net-interest-income-nii-at-rs-17120-15-crore-up-12-6-y-o-y-6786811.html
264,"HDFC Bank Consolidated March 2021 Net Interest Income (NII) at Rs 18,523.68 crore, up  13.88% Y-o-Y",https://www.moneycontrol.com/news/business/earnings/hdfc-bank-consolidated-march-2021-net-interest-income-nii-at-rs-18523-68-crore-up-13-88-y-o-y-6786831.html
265,"What should investors do with HDFC Bank post Q4 result: Buy, sell or hold?",https://www.moneycontrol.com/news/business/stocks/what-should-investors-do-with-hdfc-bank-post-q4-result-buy-sell-or-hold-6785471.html
266,HDFC Bank FY21 earnings confirm that the strong has become stronger,https://www.moneycontrol.com/news/business/moneycontrol-research/hdfc-bank-fy21-earnings-confirm-that-the-strong-has-become-stronger-6785831.html
267,HDFC Bank provides Rs 500 crore to refund interest-on-interest on moratorium loans,https://www.moneycontrol.com/news/business/hdfc-bank-provides-rs-500-crore-to-refund-interest-on-interest-on-moratorium-loans-6782981.html
268,"HDFC Bank Q4 profit jumps 18% to Rs 8,186.5 crore, net interest income rises 13%",https://www.moneycontrol.com/news/business/earnings/hdfc-bank-q4-profit-jumps-18-to-rs-8186-5-crore-net-interest-income-rises-13-6782321.html
269,"HDFC Bank Q4 Results Preview: Profit could rise 25%, net interest income may grow over 10%",https://www.moneycontrol.com/news/business/earnings/hdfc-bank-q4-results-preview-profit-could-rise-25-net-interest-income-may-grow-over-10-6779491.html
270,"HDFC Bank Q4 Net Profit seen up 25.4% YoY to Rs 8,689 cr: Sharekhan",https://www.moneycontrol.com/news/business/hdfc-bank-q4-net-profit-seen-up-25-4-yoy-to-rs-8689-cr-sharekhan-6773551.html
271,"HDFC Bank proposes to raise Rs 50,000 crore via perpetual debt instruments",https://www.moneycontrol.com/news/business/hdfc-bank-proposes-to-raise-rs-50000-crore-via-perpetual-debt-instruments-6770151.html
272,"Ideas For Profit | Amid the scare of second wave of COVID, which bank stocks should investors bet on?",https://www.moneycontrol.com/news/business/technicals/ideas-for-profit-amid-the-scare-of-second-wave-of-covid-which-bank-stocks-should-investors-bet-on-6768531.html
273,Which bank stocks to bet on amid the scare of second wave of COVID?,https://www.moneycontrol.com/news/business/moneycontrol-research/which-bank-stocks-to-bet-on-amid-the-scare-of-second-wave-of-covid-6766871.html
274,Deepak Parekh’s wife buys luxury property in Mumbai for Rs 50 crore,https://www.moneycontrol.com/news/business/deepak-parekhs-wife-buys-luxury-property-in-mumbai-for-rs-50-crore-6754981.html
275,"Fixed deposit interest rates: Latest FD rates of SBI, HDFC Bank, ICICI Bank, Axis Bank",https://www.moneycontrol.com/news/business/personal-finance/fixed-deposit-interest-rates-latest-fd-rates-of-sbi-hdfc-bank-icici-bank-axis-bank-6738241.html
276,"HDFC Bank Q4 Net Profit seen up 25.4% YoY to Rs. 8,684.7 cr: Prabhudas Lilladher",https://www.moneycontrol.com/news/business/earnings/hdfc-bank-q4-net-profit-seen-up-25-4-yoy-to-rs-8684-7-cr-prabhudas-lilladher-6737111.html
277,"What do pre-earnings business updates of HDFC Bank, Bajaj Finance and CSB Bank say?",https://www.moneycontrol.com/news/business/moneycontrol-research/what-do-pre-earnings-business-updates-of-hdfc-bank-bajaj-finance-and-csb-bank-say-6735571.html
278,"Analysis | Banks’ quarterly business update: Good deposit growth, focus on cheaper CASA but smaller banks struggle on loans",https://www.moneycontrol.com/news/business/analysis-banks-quarterly-business-update-good-deposit-growth-focus-on-cheaper-casa-but-smaller-banks-struggle-on-loans-6735461.html
279,"HDFC Bank advances up 14%, deposits rise 16% at end of March 2021",https://www.moneycontrol.com/news/business/hdfc-bank-advances-up-14-deposits-rise-16-at-end-of-march-2021-6731691.html
280,"RBI postpones auto debit rules till September 30: Impact on you, what changes for banks and other questions answered",https://www.moneycontrol.com/news/business/new-auto-debit-payment-rules-from-april-1-impact-on-you-what-changes-for-banks-and-other-questions-answered-6713891.html
281,HDFC Bank says technical glitch resolved but why is the problem recurring?,https://www.moneycontrol.com/news/business/hdfc-bank-says-technical-glitch-resolved-but-why-the-problem-is-recurring-6710621.html
282,"HDFC Bank says some customers unable to use their netbanking accounts, working on quick resolution",https://www.moneycontrol.com/news/business/hdfc-internet-banking-glitch-bank-says-working-on-it-6708791.html
283,HDFC Bank special fixed deposit scheme for senior citizens extended till June 30,https://www.moneycontrol.com/news/business/personal-finance/hdfc-bank-special-fixed-deposit-scheme-for-senior-citizens-extended-till-june-30-6704941.html
284,HDFC Bank responds to RBI’s show-cause notice over allegations of car loan-GPS bundling: Report,https://www.moneycontrol.com/news/business/hdfc-bank-responds-to-rbis-show-cause-notice-over-allegations-of-car-loan-gps-bundling-report-6665611.html
285,"After Infosys, Accenture, HDFC Bank says it will cover COVID-19 vaccination cost for its employees",https://www.moneycontrol.com/news/business/after-infosys-accenture-hdfc-bank-says-it-will-cover-covid-19-vaccination-cost-for-its-employees-6638931.html
286,HDFC Bank exploring sale of controlling stake in Syska Led Lights,https://www.moneycontrol.com/news/business/hdfc-bank-exploring-sale-of-controlling-stake-in-syska-led-lights-6610111.html
287,"ICICI, HDFC, SBI will have to offload Rs 1.2 lakh crore if RBI caps stake in insurance arms: Report",https://www.moneycontrol.com/news/business/icici-hdfc-sbi-will-have-to-offload-rs-1-2-lakh-crore-if-rbi-caps-stake-in-insurance-arms-report-6605431.html
288,"Kotak Mahindra Bank, HDFC Bank to acquire 9.99% each in Ferbine",https://www.moneycontrol.com/news/business/markets/kotak-mahindra-bank-hdfc-bank-to-acquire-9-99-each-in-ferbine-private-ltd-6578201.html
289,Nifty Bank surges 4% after FM said private banks can now participate in government business,https://www.moneycontrol.com/news/business/markets/nifty-bank-surges-4-after-fm-said-private-banks-can-now-participate-in-government-business-6567871.html
290,SAT stays Sebi's order against HDFC Bank in BRH Wealth Kreators case,https://www.moneycontrol.com/news/business/markets/sat-stays-sebis-order-against-hdfc-bank-in-brh-wealth-kreators-case-6556311.html
291,"Exclusive interview | HDFC Bank doesn’t expect wholesale NPAs to deviate from past trend, says wholesale banking head",https://www.moneycontrol.com/news/business/exclusive-interview-hdfc-bank-doesnt-expect-wholesale-npas-to-deviate-from-past-trend-says-corporate-banking-head-6459161.html
292,Buy HDFC Bank; target of Rs 1720: Motilal Oswal,https://www.moneycontrol.com/news/business/buy-hdfc-bank-target-of-rs-1720-motilal-oswal-6441811.html
293,Accumulate HDFC Bank; target of Rs 1671: KR Choksey,https://www.moneycontrol.com/news/business/stocks/accumulate-hdfc-bank-target-of-rs-1671-kr-choksey-6432121.html
294,RBI appoints an external firm to audit HDFC Bank’s IT Infrastructure,https://www.moneycontrol.com/news/business/companies/rbi-appoints-an-external-firm-to-audit-hdfc-banks-it-infrastructure-6432021.html
295,Accumulate HDFC Bank; target of Rs 1647: Arihant Capital,https://www.moneycontrol.com/news/business/stocks/accumulate-hdfc-bank-target-of-rs-1647-arihant-capital-6425391.html
296,Buy HDFC Bank; target of Rs 1690: Prabhudas Lilladher,https://www.moneycontrol.com/news/business/buy-hdfc-bank-target-of-rs-1690-prabhudas-lilladher-6393051.html
297,Assam Microfinance Bill may give a bigger jolt to banks than pure-play MFIs,https://www.moneycontrol.com/news/business/assam-microfinance-bill-may-give-a-bigger-jolt-to-banks-than-pure-play-mfis-6385641.html
298,BRH Wealth case: HDFC Bank says Sebi orders depositing over Rs 158 crore in escrow account,https://www.moneycontrol.com/news/business/brh-wealth-case-hdfc-bank-says-sebi-orders-depositing-over-rs-158-crore-in-escrow-account-6382581.html
299,HDFC Bank shares fall after Sebi imposes monetary penalty,https://www.moneycontrol.com/news/business/stocks/hdfc-bank-shares-fall-after-sebi-imposes-monetary-penalty-6381821.html
300,SEBI slaps Rs 1 crore fine on HDFC Bank in BRH Wealth Kreators case,https://www.moneycontrol.com/news/business/sebi-slaps-rs-1-crore-fine-on-hdfc-bank-in-brh-wealth-kreators-case-6381191.html
301,Buy HDFC Bank: target of Rs 1810: Sharekhan,https://www.moneycontrol.com/news/business/stocks/buy-hdfc-bank-target-of-rs-1810-sharekhan-6378491.html
302,"SBI, HDFC Bank and ICICI Bank in 2020 list of 'too-big-to-fail' lenders, says RBI",https://www.moneycontrol.com/news/business/sbi-hdfc-bank-and-icici-bank-in-2020-list-of-too-big-to-fail-lenders-says-rbi-6367311.html
303,Buy HDFC Bank; target of Rs 1870: YES Securities,https://www.moneycontrol.com/news/business/stocks/buy-hdfc-bank-target-of-rs-1870-yes-securities-6365481.html
304,Buy HDFC Bank; target of Rs 1750: Dolat Capital Market,https://www.moneycontrol.com/news/business/stocks/buy-hdfc-bank-target-of-rs-1750-dolat-capital-market-6365461.html
305,HDFC Bank plans two-pronged approach to fix digital outage,https://www.moneycontrol.com/news/business/hdfc-bank-plans-two-pronged-approach-to-fix-digital-outage-6363781.html
306,"HDFC Bank Standalone December 2020 Net Interest Income (NII) at Rs 16,317.61 crore, up  15.13% Y-o-Y",https://www.moneycontrol.com/news/business/earnings/hdfc-bank-standalone-december-2020-net-interest-income-nii-at-rs-16317-61-crore-up-15-13-y-o-y-6363891.html
307,"HDFC Bank Consolidated December 2020 Net Interest Income (NII) at Rs 17,328.92 crore, up  14.55% Y-o-Y",https://www.moneycontrol.com/news/business/earnings/hdfc-bank-consolidated-december-2020-net-interest-income-nii-at-rs-17328-92-crore-up-14-55-y-o-y-6364061.html
308,HDFC Bank’s Q3 earnings show why it is among the top 10 valued banks globally,https://www.moneycontrol.com/news/business/moneycontrol-research/hdfc-banks-q3-earnings-show-why-it-is-among-the-top-10-valued-banks-globally-6358971.html
309,"What should investors do with HDFC Bank after Q3 result: buy, sell or hold?",https://www.moneycontrol.com/news/business/stocks/what-should-investors-do-with-hdfc-bank-after-q3-result-buy-sell-or-hold-6356601.html
310,HDFC Bank penalises its executive for inadvertently selling shares,https://www.moneycontrol.com/news/business/markets/hdfc-bank-penalises-its-executive-for-inadvertently-selling-shares-6356721.html
311,HDFC Bank Q3 profit beats estimates; here are 10 key highlights of earnings,https://www.moneycontrol.com/news/business/earnings/hdfc-bank-q3-profit-beats-estimates-here-are-10-key-highlights-of-earnings-6355511.html
312,Analysis | HDFC Bank presents a good set of Q3 numbers but asset quality pressure visible,https://www.moneycontrol.com/news/business/analysis-hdfc-bank-presents-a-good-set-of-q3-numbers-but-asset-quality-pressure-visible-6355451.html
313,"HDFC Bank Q3 profit jumps 18% to Rs 8,758 crore, asset quality improves sequentially",https://www.moneycontrol.com/news/business/earnings/hdfc-bank-q3-profit-jumps-18-to-rs-8758-crore-nii-increases-15-to-rs-16318-crore-6351491.html
314,HDFC Bank to report Q3 numbers today; here's what to expect,https://www.moneycontrol.com/news/business/earnings/hdfc-bank-to-report-q3-numbers-today-heres-what-to-expect-6351311.html
315,In case you missed it | HDFC-HDFC Bank merger: A financial giant in the making?,https://www.moneycontrol.com/news/business/moneycontrol-research/in-case-you-missed-it-hdfc-hdfc-bank-merger-a-financial-giant-in-the-making-6318971.html
316,"Pre-earnings business update: Bajaj Finance’s loan growth crawls, HDFC Bank's defying slowdown",https://www.moneycontrol.com/news/business/moneycontrol-research/pre-earnings-business-update-bajaj-finances-loan-growth-crawls-hdfc-banks-defying-slowdown-6308771.html
317,HDFC Bank proposes Atanu Chakraborty as next part-time chairperson,https://www.moneycontrol.com/news/business/hdfc-bank-proposes-atanu-chakraborty-as-next-part-time-chairperson-6282191.html
318,"Senior citizens' special fixed deposit (FD) scheme of HDFC Bank, ICICI Bank, Bank of Baroda: Check details",https://www.moneycontrol.com/news/business/personal-finance/senior-citizens-special-fixed-deposit-fd-scheme-of-hdfc-bank-icici-bank-bank-of-baroda-check-details-6262161.html
319,Will HDFC Bank’s brake on credit card sourcing translate into business gains for SBI Cards?,https://www.moneycontrol.com/news/business/moneycontrol-research/will-hdfc-banks-brake-on-credit-card-sourcing-translate-into-business-gains-for-sbi-cards-6210741.html
320,Mumbai businessman buys premium property worth nearly Rs 28 crore,https://www.moneycontrol.com/news/business/real-estate/mumbai-businessman-buys-premium-property-worth-nearly-rs-28-crore-6209461.html
321,HDFC Bank invests in fintech startup smallcase,https://www.moneycontrol.com/news/business/startup/hdfc-bank-invests-in-fintech-startup-smallcase-6203141.html
322,What the outages in the IT systems of HDFC Bank and SBI show,https://www.moneycontrol.com/news/business/what-could-have-led-to-the-recent-outages-in-hdfc-bank-and-sbis-it-systems-6198551.html
323,HDFC Bank shares fall 2% after Moody’s terms bank's digital outages as credit negative,https://www.moneycontrol.com/news/business/markets/hdfc-bank-shares-fall-2-after-moodys-terms-banks-digital-outages-as-credit-negative-6197991.html
324,HDFC Bank's multiple digital outages credit negative: Moody’s,https://www.moneycontrol.com/news/business/companies/hdfc-banks-multiple-digital-outages-credit-negative-moodys-6197781.html
325,Ex-HDFC Bank boss Aditya Puri's family buys Rs 50-crore home at Mumbai’s Malabar Hill,https://www.moneycontrol.com/news/business/real-estate/ex-hdfc-bank-boss-aditya-puris-family-buys-rs-50-crore-home-at-mumbais-malabar-hill-6191461.html
326,Brokerages maintain 'buy' call on HDFC Bank after RBI notice; share price rises,https://www.moneycontrol.com/news/business/markets/brokerages-maintain-buy-call-on-hdfc-bank-after-rbi-notice-share-price-rises-2-6188231.html
327,RBI’s order is a blip in HDFC bank’s digital journey,https://www.moneycontrol.com/news/business/moneycontrol-research/rbis-order-is-a-blip-in-hdfc-banks-digital-journey-6187361.html
328,"Trade Spotlight: Tata Chemicals, Maruti Suzuki & HDFC Bank in focus",https://www.moneycontrol.com/news/business/markets/trade-spotlight-tata-chemicals-maruti-suzuki-hdfc-bank-in-focus-6185971.html
329,"RBI asks HDFC Bank to halt anything new under Digital 2.0, but what is Digital 2.0?",https://www.moneycontrol.com/news/business/rbi-asks-hdfc-bank-to-halt-anything-new-under-digital-2-0-but-what-is-digital-2-0-6185961.html
330,"HDFC Bank outage | Working on war footing to strengthen IT infrastructure, will comply with RBI requirements: CEO Sashidhar Jagdishan",https://www.moneycontrol.com/news/business/hdfc-bank-outage-working-on-war-footing-to-strengthen-it-infrastructure-will-comply-with-rbi-requirements-ceo-sashidhar-jagdishan-6185291.html
331,RBI’s diktat on HDFC Bank: What should existing customers and fresh credit card applicants do?,https://www.moneycontrol.com/news/business/personal-finance/rbis-diktat-on-hdfc-bank-what-should-existing-customers-and-fresh-credit-card-applicants-do-6185301.html
332,RBI asks HDFC Bank to halt all launches around its Digital 2.0 initiative,https://www.moneycontrol.com/news/business/rbi-asks-hdfc-bank-to-halt-all-launches-around-its-digital-2-0-initiative-6185041.html
333,HDFC Bank's digital outages: 7 key takeaways from RBI action,https://www.moneycontrol.com/news/business/hdfc-banks-digital-outages-7-key-takeaways-from-rbi-action-6184161.html
334,HDFC Bank outage: A timeline of the bank’s run-ins with digital disruptions and what RBI has done,https://www.moneycontrol.com/news/business/hdfc-bank-outage-a-timeline-of-the-banks-run-ins-with-digital-glitches-and-what-rbi-has-done-6183751.html
335,"HDFC Bank share price falls after RBI halts new credit card customers, digital 2.0 programme",https://www.moneycontrol.com/news/business/markets/hdfc-bank-share-price-falls-after-rbi-halts-new-credit-card-customers-digital-2-0-programme-6183731.html
336,"RBI asks HDFC Bank to halt issue of new credit cards, planned activities under Digital 2.0",https://www.moneycontrol.com/news/business/rbi-halts-hdfc-bank-digital-activities-asks-bank-to-stop-sourcing-new-credit-card-customers-after-multiple-digital-failures-6183521.html
337,Tata Digital invests Rs 10 crore in Centre’s Grameen e-Store: Report,https://www.moneycontrol.com/news/business/tata-digital-invests-rs-10-crore-in-centres-grameen-e-store-report-6177961.html
338,"DHFL promoter Kapil Wadhawan moves NCLT seeking participation in CoC meeting, access to data",https://www.moneycontrol.com/news/business/kapil-wadhawan-moves-nclt-seeking-participation-in-coc-meeting-access-to-dhfl-data-6161421.html
339,"HDFC Bank hits Rs 8 lakh crore market cap for first time, shares at record high",https://www.moneycontrol.com/news/business/markets/hdfc-bank-hits-rs-8-lakh-crore-market-cap-for-first-time-shares-at-record-high-6154581.html
340,"HDFC Bank share price up 2%, hits record high after CLSA retains 'buy'",https://www.moneycontrol.com/news/business/stocks/hdfc-bank-share-price-up-2-hits-record-high-after-clsa-retains-buy-6150151.html
341,"HDFC Bank's entire payment stack goes down due to technical glitch, restored",https://www.moneycontrol.com/news/business/hdfc-banks-entire-payment-stack-goes-down-due-to-technical-glitch-restored-6144481.html
342,Axis Bank revises fixed deposit rates; check latest rates here,https://www.moneycontrol.com/news/business/axis-bank-revises-fixed-deposit-rates-check-latest-rates-here-6124561.html
343,HDFC Bank revises interest rates for fixed deposit,https://www.moneycontrol.com/news/business/personal-finance/hdfc-bank-revises-interest-rates-for-fixed-deposit-6124181.html
344,HDFC Bank names Ramesh Lakshminarayanan as CIO,https://www.moneycontrol.com/news/business/hdfc-bank-appoints-ramesh-lakshminarayanan-as-its-new-chief-information-officer-6072821.html
345,Buy HDFC Bank; target of Rs 1500: Motilal Oswal,https://www.moneycontrol.com/news/business/stocks/buy-hdfc-bank-target-of-rs-1500-motilal-oswal-6049751.html
346,Former HDFC Bank CEO Aditya Puri joins Carlyle as senior adviser,https://www.moneycontrol.com/news/business/former-hdfc-bank-ceo-adity-puri-joins-carlyle-as-senior-adviser-6048311.html
347,Can HDFC Bank join Rs 10 lakh crore market-cap club during the new MD's tenure?,https://www.moneycontrol.com/news/business/markets/can-hdfc-bank-join-rs-10-lakh-crore-market-cap-club-during-the-new-mds-tenure-6027511.html
348,"Jagdishan takes over from Puri: A favourite pick, mutual funds bet Rs 78,597.2 crore on HDFC Bank",https://www.moneycontrol.com/news/business/markets/jagdishan-takes-over-from-puri-a-favourite-pick-mutual-funds-bet-rs-78597-2-crore-on-hdfc-bank-6015791.html
349,"From listing to Rs 7 lakh crore m-cap, 5 HDFC Bank milestones on Aditya Puri's watch",https://www.moneycontrol.com/news/business/markets/from-listing-to-rs-7-lakh-crore-m-cap-5-hdfc-bank-milestones-on-aditya-puris-watch-6016131.html
350,"HDFC Bank gave 303-fold return during Aditya Puri's tenure, will the good run continue under Sashidhar Jagdishan?",https://www.moneycontrol.com/news/business/markets/hdfc-bank-gave-303-fold-return-during-aditya-puris-tenure-will-the-good-run-continue-under-sashidhar-jagdishan-6018601.html
351,Thank you for 25 glorious years: HDFC Bank bids adieu to MD and CEO Aditya Puri,https://www.moneycontrol.com/news/business/thank-you-for-25-glorious-years-hdfc-bank-bids-adieu-to-md-and-ceo-aditya-puri-6008121.html
352,Bajaj Finance: What should investors do after weak Q2 performance and muted guidance?,https://www.moneycontrol.com/news/business/moneycontrol-research/bajaj-finance-what-should-investors-do-on-the-back-of-weak-q2-performance-and-muted-guidance-5997261.html
353,Buy HDFC Bank; target of Rs 1420: Geojit,https://www.moneycontrol.com/news/business/stocks/buy-hdfc-bank-target-of-rs-1420-geojit-5995191.html
354,Why HDFC Bank’s investors need to look beyond the Aditya Puri factor,https://www.moneycontrol.com/news/business/why-hdfc-banks-investors-need-to-look-beyond-the-aditya-puri-factor-5994191.html
355,Buy HDFC Bank; target of Rs 1427: KRChoksey,https://www.moneycontrol.com/news/business/stocks/buy-hdfc-bank-target-of-rs-1427-krchoksey-5990461.html
356,"Aditya Puri says some slowdown inevitable, but we will get our mojo back",https://www.moneycontrol.com/news/business/economy/hdfc-banks-aditya-puri-says-some-slowdown-inevitable-but-we-will-get-our-mojo-back-5991801.html
357,Aditya Puri says Deepak Parekh gave him a free hand to build HDFC Bank,https://www.moneycontrol.com/news/business/aditya-puri-says-deepak-parekh-gave-him-a-free-hand-to-build-hdfc-bank-5991881.html
358,Buy HDFC Bank; target of Rs 1385: Prabhudas Lilladher,https://www.moneycontrol.com/news/business/stocks/buy-hdfc-bank-target-of-rs-1385-prabhudas-lilladher-5983891.html
359,Buy HDFC Bank; target of Rs 1450: ICICI Direct,https://www.moneycontrol.com/news/business/stocks/buy-hdfc-bank-target-of-rs-1450-icici-direct-5984111.html
360,Buy HDFC Bank; target of Rs 1500: Sharekhan,https://www.moneycontrol.com/news/business/stocks/buy-hdfc-bank-target-of-rs-1500-sharekhan-5983361.html
361,Buy HDFC Bank; target of Rs 1450: Dolat Capital Market,https://www.moneycontrol.com/news/business/stocks/buy-hdfc-bank-target-of-rs-1450-dolat-capital-market-5983291.html
362,Accumulate HDFC Bank; target of Rs 1345: Arihant Capital,https://www.moneycontrol.com/news/business/stocks/accumulate-hdfc-bank-target-of-rs-1345-arihant-capital-5983071.html
