,Headlines,Links
129,Nestle touts new technology to reduce sugar in chocolate,https://www.moneycontrol.com/news/world/nestle-touts-new-technology-to-reduce-sugarchocolate-919788.html
130,"Nestle Q3 net seen at Rs 249 cr, Maggi sales may be at Rs 400 cr",https://www.moneycontrol.com/news/business/earnings/nestle-q3-net-seen-at-rs-249-cr-maggi-sales-may-be-at-rs-400-cr-933238.html
131,"Nov series may see weak start; Eicher, Bajaj Auto in focus",https://www.moneycontrol.com/news/business/markets/nov-series-may-see-weak-start-eicher-bajaj-autofocus-953620.html
132,Nestle cuts sales outlook as 9-month organic growth disappoints,https://www.moneycontrol.com/news/world/nestle-cuts-sales-outlook-as-9-month-organic-growth-disappoints-955679.html
133,Gut feeling: New CEO to steer Nestle down uncharted health path,https://www.moneycontrol.com/news/world/gut-feeling-new-ceo-to-steer-nestle-down-uncharted-health-path-960486.html
134,Best of Maggi growth yet to come: Nestle India,https://www.moneycontrol.com/news/business/companies/bestmaggi-growth-yet-to-come-nestle-india-970766.html
135,Nestle poaches CEO from Fresenius in health and wellness drive,https://www.moneycontrol.com/news/world/nestle-poaches-ceofreseniushealthwellness-drive-986660.html
136,"Nestle, on health kick, moves into milk allergy testing",https://www.moneycontrol.com/news/world/nestlehealth-kick-moves-into-milk-allergy-testing-993912.html
137,Flexible Packaging Major Uflex Rolls Out Natural Resource Conservation Initiatives,https://www.moneycontrol.com/news/business/wire-news/flexible-packaging-major-uflex-rolls-out-natural-resource-conservation-initiatives-996829.html
138,Flexible Packaging Major Uflex Rolls Out Natural Resource Conservation Initiatives,https://www.moneycontrol.com/news/business/wire-news/flexible-packaging-major-uflex-rolls-out-natural-resource-conservation-initiatives-996830.html
139,Maggi effect: FSSAI plans specific regulations for noodles,https://www.moneycontrol.com/news/business/economy/maggi-effect-fssai-plans-specific-regulations-for-noodles-998504.html
140,"Sensex surges 193 pts, Nifty ends at 7900; DRL up 3%, banks lead",https://www.moneycontrol.com/news/business/markets/sensex-surges-193-pts-nifty-ends-at-7900-drl3-banks-lead-1000336.html
141,"Nifty, Sensex continue to surge; banks & IT climb, HUL falls 1%",https://www.moneycontrol.com/news/business/markets/nifty-sensex-continue-to-surge-banksit-climb-hul-falls-1-1000711.html
142,And the Power Brand Rising Star Award 2016 goes to `Flexible Packaging Major Uflex`,https://www.moneycontrol.com/news/business/wire-news/andpower-brand-rising-star-award-2016-goes-to-`flexible-packaging-major-uflex`-1028352.html
143,And the Power Brand Rising Star Award 2016 goes to `Flexible Packaging Major Uflex`,https://www.moneycontrol.com/news/business/wire-news/andpower-brand-rising-star-award-2016-goes-to-`flexible-packaging-major-uflex`-1028364.html
144,And the Power Brand Rising Star Award 2016 goes to `Flexible Packaging Major Uflex`,https://www.moneycontrol.com/news/business/wire-news/andpower-brand-rising-star-award-2016-goes-to-`flexible-packaging-major-uflex`-1028365.html
145,Nestle sees 'softer' pricing in 2016 after FY profit miss,https://www.moneycontrol.com/news/world/nestle-sees-softer-pricing2016-after-fy-profit-miss-1038106.html
146,Bad publicity leads Nestle to end IAAF partnership,https://www.moneycontrol.com/news/world/bad-publicity-leads-nestle-to-end-iaaf-partnership-1041650.html
147,"ITC Q3 net seen up 5%, cigarette volumes may decline moderately",https://www.moneycontrol.com/news/business/earnings/itc-q3-net-seen5-cigarette-volumes-may-decline-moderately-1048320.html
148,Rewind 2015: The Maggi noodles saga,https://www.moneycontrol.com/news/business/companies/rewind-2015-the-maggi-noodles-saga-1053787.html
149,"Patanjali launches noodles, plans six manufacturing units",https://www.moneycontrol.com/news/business/companies/patanjali-launches-noodles-plans-six-manufacturing-units-1430219.html
150,Maggi may face 'Maha' hurdle; state likely to reinforce ban,https://www.moneycontrol.com/news/business/cnbc-tv18-comments/maggi-may-face-maha-hurdle-state-likely-to-reinforce-ban-1501657.html
151,Sell Nestle; target of Rs 5500: Religare,https://www.moneycontrol.com/news/business/stocks/sell-nestle-targetrs-5500-religare-1291779.html
152,We have been cleaned again; Maggi was always safe: Nestle,https://www.moneycontrol.com/news/business/earnings/we-have-been-cleaned-again-maggi-was-always-safe-nestle-1277879.html
153,Nestle cuts full-year outlook after sales miss,https://www.moneycontrol.com/news/world/nestle-cuts-full-year-outlook-after-sales-miss-1299639.html
154,"Sensex up 204 pts, Nifty ends above 8200; SBI, Nestle gain",https://www.moneycontrol.com/news/business/markets/sensex204-pts-nifty-ends-above-8200-sbi-nestle-gain-1300375.html
155,Karnataka likely to lift ban on Maggi,https://www.moneycontrol.com/news/trends/current-affairs-trends/karnataka-likely-to-lift-banmaggi-1331243.html
156,Maggi ban: Nestle claims it is being 'singled out',https://www.moneycontrol.com/news/business/companies/maggi-ban-nestle-claims-it-is-being-singled-out-1358963.html
157,Abbott tangles with Indian regulators over syrup complaint,https://www.moneycontrol.com/news/business/companies/abbott-tanglesindian-regulators-over-syrup-complaint-1436057.html
158,"Nestle, ITC execs spar over latter's 'safe noodles' ad",https://www.moneycontrol.com/news/business/companies/nestle-itc-execs-spar-over-latters-safe-noodles-ad-1439757.html
159,"FSSAI product approval advisory illegal, SC rules",https://www.moneycontrol.com/news/business/cnbc-tv18-comments/fssai-product-approval-advisory-illegal-sc-rules-1502575.html
160,"Sensex, Nifty off day's high; rupee hits 65/&#36;, metals down",https://www.moneycontrol.com/news/business/markets/sensex-nifty-off-days-high-rupee-hits-6536-metals-down-1426899.html
161,How can Nestle jump Maggi ban? Compromise is only solution,https://www.moneycontrol.com/news/business/companies/how-can-nestle-jump-maggi-ban-compromise-is-only-solution-1428965.html
162,Maintain decorum on Maggi row: PM to Consumer Affairs Min,https://www.moneycontrol.com/news/trends/current-affairs-trends/maintain-decorummaggi-row-pm-to-consumer-affairs-min-1449239.html
163,Six in Sixty: Stocks you should keep on your radar,https://www.moneycontrol.com/news/business/stocks/sixsixty-stocks-you-should-keepyour-radar-1457007.html
164,Ashish Bahuguna new chief of food regulator FSSAI,https://www.moneycontrol.com/news/business/companies/ashish-bahuguna-new-chieffood-regulator-fssai-1485647.html
165,States urge shifting of FSSAI to Consumer Affairs Ministry,https://www.moneycontrol.com/news/business/companies/states-urge-shiftingfssai-to-consumer-affairs-ministry-1435177.html
166,Several top leaders not in favour of Maggi ban: Sources,https://www.moneycontrol.com/news/trends/current-affairs-trends/several-top-leaders-notfavourmaggi-ban-sources-1530183.html
167,"Nestle approaches Bombay HC against FSSAI, Maha FDA order",https://www.moneycontrol.com/news/business/companies/nestle-approaches-bombay-hc-against-fssai-maha-fda-order-1543539.html
168,"Nifty holds 8K amid selling pressure; Nestle, NALCO gain",https://www.moneycontrol.com/news/business/markets/nifty-holds-8k-amid-selling-pressure-nestle-nalco-gain-1544703.html
169,CAIT Traders seek refund from Nestle for recalled Maggi,https://www.moneycontrol.com/news/business/companies/cait-traders-seek-refundnestle-for-recalled-maggi-1547189.html
170,"Sensex ends marginally lower, down 4% in week; ICICI drags",https://www.moneycontrol.com/news/business/markets/sensex-ends-marginally-lower-down-4week-icici-drags-1553855.html
171,"Maggi fiasco overblown, Nestle-govt talks crucial: Experts",https://www.moneycontrol.com/news/business/companies/maggi-fiasco-overblown-nestle-govt-talks-crucial-experts-1554739.html
172,Maggi row: Centre to take action after getting test reports,https://www.moneycontrol.com/news/trends/current-affairs-trends/maggi-row-centre-to-take-action-after-getting-test-reports-1555737.html
173,Govt takes 'serious' note of Maggi issue; FSSAI to examine,https://www.moneycontrol.com/news/trends/current-affairs-trends/govt-takes-serious-notemaggi-issue-fssai-to-examine-1427457.html
174,Would you like to be paid to borrow money?,https://www.moneycontrol.com/news/business/personal-finance/would-you-like-to-be-paid-to-borrow-money--1159915.html
175,All eyes on chocolate maker Ferrero's next generation,https://www.moneycontrol.com/news/world/all-eyeschocolate-maker-ferreros-next-generation-1223219.html
176,FMCG - Elephant trails moving towards Urban paths: Emkay,https://www.moneycontrol.com/news/business/stocks/fmcg-elephant-trails-moving-towards-urban-paths-emkay-1381057.html
177,"Weekly wrap: Sensex, Nifty hail FII return, BoJ, Fed moves",https://www.moneycontrol.com/news/business/markets/weekly-wrap-sensex-nifty-hail-fii-return-boj-fed-moves-1576437.html
178,'Young Turks' introduces Agnitio Education Systems,https://www.moneycontrol.com/news/business/companies/young-turks-introduces-agnitio-education-systems-1065913.html
179,Stock in focus: Nestle,https://www.moneycontrol.com/news/trends/special-videos-trends/stockfocus-nestle-1333441.html
180,Nestle may invest up to &#36;1bn to hike stake in India arm,https://www.moneycontrol.com/news/business/cnbc-tv18-comments/nestle-may-investto-361bn-to-hike-stakeindia-arm-1331877.html
181,"Are Kellogg's, HUL victim of multinational ego in India?",https://www.moneycontrol.com/news/business/companies/are-kelloggs-hul-victimmultinational-egoindia-1373313.html
182,"The FMCG dilemma: FIIs, DIIs divided on investments",https://www.moneycontrol.com/news/business/markets/the-fmcg-dilemma-fiis-diis-dividedinvestments-1382079.html
183,Tata Global Beverage value pick in largecap: Ashish Chugh,https://www.moneycontrol.com/news/business/stocks/tata-global-beverage-value-picklargecap-ashish-chugh-1387383.html
184,Oodles from noodles in Nepal,https://www.moneycontrol.com/news/trends/features/oodlesnoodlesnepal-1548903.html
185,"Nestle standalone Sep '13 sales at Rs 2,360.02 crore",https://www.moneycontrol.com/news/business/earnings/nestle-standalone-sep-13-sales-at-rs-236002-crore-1623743.html
186,Stock market prediction for Oct 28-Nov 1: Satish Gupta,https://www.moneycontrol.com/news/business/markets/stock-market-prediction-for-oct-28-nov-1-satish-gupta-1635595.html
187,Govt to probe claims of MNCs breaking baby milk law,https://www.moneycontrol.com/news/business/companies/-1629869.html
188,"Stocks in news: ICICI, HCL Tech, Bharti, JSPL, NFL, Neyveli",https://www.moneycontrol.com/news/business/stocks/-1639963.html
189,"Stocks in news: Wipro, Natco, Jet Airways, Godrej Prop",https://www.moneycontrol.com/news/business/stocks/-1654721.html
190,Nestle Q2 net profit rises 10% to Rs 271 crore,https://www.moneycontrol.com/news/business/earnings/nestle-q2-net-profit-rises-10-to-rs-271-crore-1663089.html
191,"Stocks in news: HUL, Wipro, Ambuja, Sterlite, DLF, SKS",https://www.moneycontrol.com/news/business/stocks/-1669409.html
192,"Fundamentals don't warrant HUL, Nestle jump: ICICI Direct",https://www.moneycontrol.com/news/business/markets/-1696555.html
193,"In China, Nestle and Danone play it by the book",https://www.moneycontrol.com/news/world/-1756411.html
194,Best investment opportunities maybe cloaked in fear,https://www.moneycontrol.com/news/trends/features/-1762477.html
195,See muted response to HUL open offer: ICICI Direct,https://www.moneycontrol.com/news/business/markets/-1818191.html
196,"Positive on Dabur, says Sanjay Manyal",https://www.moneycontrol.com/news/business/stocks/-1817983.html
197,Selling your used car? Do keep these things in mind,https://www.moneycontrol.com/news/business/personal-finance/-1727703.html
198,Nestle to boost study of harmful food infections,https://www.moneycontrol.com/news/business/companies/-1760903.html
199,How FMCG pack looks after Q4 earnings: Nomura analyses,https://www.moneycontrol.com/news/business/markets/-1782505.html
200,Etienne Benet to be Nestle India Managing Director,https://www.moneycontrol.com/news/business/companies/-1809397.html
201,FMCG sector becoming increasingly expensive: ICICI Direct,https://www.moneycontrol.com/news/business/markets/-1675801.html
202,Multinationals bank on HSBC for big deals,https://www.moneycontrol.com/news/business/cnbc-tv18-comments/-1770613.html
203,IATA sees modest financial growth in airline industry,https://www.moneycontrol.com/news/business/companies/-1169869.html
204,"Nestle standalone Dec '12 sales at Rs 2,161.12 crore",https://www.moneycontrol.com/news/business/earnings/-1339055.html
205,"Stocks in news: Shriram Transport, Nestle, Maruti, R Power",https://www.moneycontrol.com/news/business/stocks/-1340465.html
206,Have foreign brands really helped FMCG companies?,https://www.moneycontrol.com/news/business/stocks/-1649089.html
207,FMCG stocks scale new highs despite high valuations in 2012,https://www.moneycontrol.com/news/business/companies/-1758509.html
208,FMCG companies bogged down by inflation,https://www.moneycontrol.com/news/business/stocks/-1687819.html
209,"Nestle Sep '12 sales at Rs 2,124.14 crore",https://www.moneycontrol.com/news/business/earnings/-1735623.html
210,Emerging mkts to be positive for long time: Nestle's Bulcke,https://www.moneycontrol.com/news/business/companies/-1754705.html
211,India has all characteristics of growth: Nestle,https://www.moneycontrol.com/news/business/companies/-1792295.html
212,Nestle to cut sugar and salt in breakfast cereals,https://www.moneycontrol.com/news/world/-1996465.html
213,MOST expects steady qtr for consumer sector; 18% PAT growth,https://www.moneycontrol.com/news/business/earnings/-1991465.html
214,"Despite tame sales, FMCG firms seen in profits in Q2",https://www.moneycontrol.com/news/business/earnings/-1822197.html
215,Investors seek bigger bite of pet foods,https://www.moneycontrol.com/news/trends/features/-1895485.html
216,FMCG shrs hit new high; Is a correction around the corner?,https://www.moneycontrol.com/news/business/markets/-1926203.html
217,What is fuelling the FMCG rally?,https://www.moneycontrol.com/news/business/personal-finance/-1962157.html
218,Nestle chairman sees worse food crisis than 2008,https://www.moneycontrol.com/news/world/-1082521.html
219,Foreign investors hiked stake in FMCG cos in Apr-Jun,https://www.moneycontrol.com/news/business/markets/-1104369.html
220,CCI okays Nestle's acquisition of Pfizer nutrition biz,https://www.moneycontrol.com/news/business/companies/-1106537.html
221,"Nestle Jun '12 sales at Rs 1,993.40 crore",https://www.moneycontrol.com/news/business/earnings/-1181757.html
222,Emerging markets help Unilever avoid rivals' pain,https://www.moneycontrol.com/news/business/companies/-1193999.html
223,FMCG cos Q1 growth seen strong; low rains cloud outlook,https://www.moneycontrol.com/news/business/earnings/-1292095.html
224,Abbott nutrition takes slow-and-steady route to wellness,https://www.moneycontrol.com/news/trends/features/-1355535.html
225,Chart of the day: Coffee prices at 2-year low; What's brewing?,https://www.moneycontrol.com/news/business/markets/-1408235.html
226,FIIs raise stake in big FMCG stocks in Jan-Mar,https://www.moneycontrol.com/news/business/markets/-1707087.html
227,"Bull's Eye: Short Bombay Dyeing, ABB; buy RIL, Glenmark",https://www.moneycontrol.com/news/business/stocks/-1871933.html
228,Social media stress? There's an app for that,https://www.moneycontrol.com/news/trends/features/-1910425.html
229,"Nestle Mar '12 sales at Rs 2,055.87 crore",https://www.moneycontrol.com/news/business/earnings/-2009785.html
230,Pfizer India unit up after global sale of nutrition biz,https://www.moneycontrol.com/news/business/stocks/-1835373.html
231,Pfizer to divest nutrition biz to Nestle; stks react,https://www.moneycontrol.com/news/business/stocks/-1841109.html
232,Nestle to buy Pfizer Nutrition for &#36;11.9bn,https://www.moneycontrol.com/news/world/-1839129.html
233,Nestle near buying Pfizer's baby formula,https://www.moneycontrol.com/news/business/companies/-1870725.html
234,The real benefits of capitalism,https://www.moneycontrol.com/news/trends/features/-1877141.html
235,"FMCG stocks hit new high, is it still a good time to buy?",https://www.moneycontrol.com/news/business/markets/-1923889.html
236,Bata India has target of Rs 860-870: Mohindar,https://www.moneycontrol.com/news/business/stocks/-1942245.html
237,Consumers sector results preview for Q4FY12: Emkay,https://www.moneycontrol.com/news/business/earnings/-1959235.html
238,"Nestle Dec '11 sales at Rs 1,962.70 crore",https://www.moneycontrol.com/news/business/earnings/-1990331.html
239,Nestle optimistic on India growth story,https://www.moneycontrol.com/news/business/companies/-1908351.html
240,"For Nestle, India a great flavour to bet on for the future!",https://www.moneycontrol.com/news/business/cnbc-tv18-comments/-1996255.html
241,"Emkay prefers Nestle over Glaxo, Colgate",https://www.moneycontrol.com/news/business/stocks/-2044795.html
242,Will FMCG stocks continue to rally in 2012?,https://www.moneycontrol.com/news/business/markets/-1094951.html
243,"New packaging norm to have adverse impact on Britannia, HUL",https://www.moneycontrol.com/news/business/stocks/-1187129.html
244,Nestle rebrands milk product in India,https://www.moneycontrol.com/news/business/companies/-1245997.html
245,Top 15 companies you should keep an eye on: PINC Research,https://www.moneycontrol.com/news/business/stocks/-1388823.html
246,"Nestle Sep '11 sales at Rs 1,969.27 crore",https://www.moneycontrol.com/news/business/earnings/-1874739.html
247,HUL may rally further: Sukhani,https://www.moneycontrol.com/news/business/stocks/-1938091.html
248,Nestle cautions on margins as it raises sales goal,https://www.moneycontrol.com/news/world/-2045725.html
249,Nestle Sept qtr PAT seen up 25% at Rs 243 cr: KRChoksey,https://www.moneycontrol.com/news/business/earnings/-2084291.html
250,Nestle Sep qtr PAT seen at Rs 263.1 cr: Angel Broking,https://www.moneycontrol.com/news/business/earnings/-2118559.html
251,Nestle ad first to pitch at canine customers,https://www.moneycontrol.com/news/world/-2041177.html
252,"10 yrs after failed bid, Damani's VST stake worth Rs 520 cr",https://www.moneycontrol.com/news/business/companies/-2137153.html
253,"Buy ITC, says Anu Jain",https://www.moneycontrol.com/news/business/stocks/-2037943.html
254,Litmus test is for Nifty to hold 4850-4900: Anu Jain,https://www.moneycontrol.com/news/business/technicals/-2037291.html
255,Nestle ups outlook as price hikes offset higher costs,https://www.moneycontrol.com/news/business/companies/-2122933.html
256,"Nestle Jun '11 sales at Rs 1,768.06 crore",https://www.moneycontrol.com/news/business/earnings/-2042473.html
257,PINC power picks for the month of July 2011,https://www.moneycontrol.com/news/business/stocks/-2109771.html
258,Nestle buys 60% of Chinese candymaker for &#36;1.7 bn,https://www.moneycontrol.com/news/business/companies/-2126183.html
259,Nestle to buy 60% of Chinese candy maker for USD1.7bn,https://www.moneycontrol.com/news/world/-2129521.html
260,Nestle Jun qtr PAT seen up 25% at Rs 243cr: KRChoksey,https://www.moneycontrol.com/news/business/earnings/-2131285.html
261,Check out: 8 stocks on brokerages' radar,https://www.moneycontrol.com/news/business/markets/-2142219.html
262,Nestle has target of Rs 4600: Rajesh Jain,https://www.moneycontrol.com/news/business/stocks/-2143291.html
263,Bull's Eye: 12 trading strategies for exciting gains,https://www.moneycontrol.com/news/business/stocks/-2143671.html
264,"Prefer Nestle, Dabur: Saurabh Mukherjea",https://www.moneycontrol.com/news/business/stocks/-2146107.html
265,Sensex to touch 19000 but earnings may be a spoiler: Ambit,https://www.moneycontrol.com/news/business/markets/-2145985.html
266,Why is KRChoksey bullish on FMCG giants HUL and ITC?,https://www.moneycontrol.com/news/business/stocks/-2104879.html
267,Buy ITC on dip: Anu Jain,https://www.moneycontrol.com/news/business/stocks/-2065761.html
268,Unilever needs 4-5 years growth to catch peers,https://www.moneycontrol.com/news/world/-2065959.html
269,Check out: Stock that lost over 25% in three days,https://www.moneycontrol.com/news/business/markets/-2067629.html
270,Angel Broking sees HUL's margin expansion at 13% in FY12,https://www.moneycontrol.com/news/business/markets/-2073353.html
271,"Future Ventures IPO a high risk, high reward offer: Udayan",https://www.moneycontrol.com/news/business/ipo/-2083895.html
272,"Nestle Mar '11 sales at Rs 1,814.43 crore",https://www.moneycontrol.com/news/business/earnings/-2116555.html
273,Nestle boosted by emerging markets and price hikes,https://www.moneycontrol.com/news/world/-2135499.html
274,ITC can touch Rs 205: Salil Sharma,https://www.moneycontrol.com/news/business/stocks/-2143085.html
275,Nestle prefers investments over payouts - paper,https://www.moneycontrol.com/news/world/-1131635.html
276,"Nestle Dec '10 sales at Rs 1,675.52 crore",https://www.moneycontrol.com/news/business/earnings/-1148775.html
277,Nomura neutral on Nestle,https://www.moneycontrol.com/news/business/stocks/-1151215.html
278,"Why is Nomura India positive on GSK Health, ITC?",https://www.moneycontrol.com/news/business/markets/-1151291.html
279,Nestle confirms outlook as Q4 growth accelerates,https://www.moneycontrol.com/news/world/international-results/-1161771.html
280,"Nifty changes: The good, bad and the ugly",https://www.moneycontrol.com/news/business/markets/-1178585.html
281,Consumption growth to spawn many M&As in the FMCG space,https://www.moneycontrol.com/news/business/companies/-1219005.html
282,Food price rise may be lasting: Nestle chairman,https://www.moneycontrol.com/news/world/-1249733.html
