,Headlines,Links
0,Storyboard18 | Leaders of the future have to be outstanding human beings: Nestle MD,https://www.moneycontrol.com/news/business/storyboard18-leaders-of-the-future-have-to-be-outstanding-human-beings-nestle-md-8665401.html
1,500 kg cocaine found at Nespresso factory in Switzerland,https://www.moneycontrol.com/news/world/500kg-cocaine-found-at-nespresso-factory-in-switzerland-8464041.html
2,Storyboard18 x The English Nut: How to pronounce these 10 brand names,https://www.moneycontrol.com/news/trends/features/storyboard18-x-the-english-nut-how-to-pronounce-these-10-brand-names-8446851.html
3,"From spreads to shampoo, palm oil is part of everyday life",https://www.moneycontrol.com/news/business/from-spreads-to-shampoo-palm-oil-is-part-of-everyday-life-8399021.html
4,"Nestle Standalone March 2022 Net Sales at Rs 3,980.70 crore, up 10.24% Y-o-Y",https://www.moneycontrol.com/news/business/earnings/nestle-standalone-march-2022-net-sales-at-rs-3980-70-crore-up-10-24-y-o-y-8393251.html
5,"Saurabh Mukherjea dismisses concerns around HDFC merger; extremely bullish on Nestle, Asian Paints",https://www.moneycontrol.com/news/business/earnings/saurabh-mukherjea-dismisses-concerns-around-hdfc-merger-extremely-bullish-on-nestle-asian-paints-8392871.html
6,Nestlé India blames 10 year high input inflation for disappointing report card,https://www.moneycontrol.com/news/business/earnings/nestle-india-blames-10-year-high-input-inflation-for-disappointing-report-card-8388751.html
7,"Mondelez, Nestle, Pepsi face pressure from European employees over Russia",https://www.moneycontrol.com/news/business/mondelez-nestle-pepsi-face-pressure-from-european-employees-over-russia-8364991.html
8,Nestle Q4 PAT may dip 1.2% YoY to Rs 595.1 cr: Motilal Oswal,https://www.moneycontrol.com/news/business/nestle-q4-pat-may-dip-1-2-yoy-to-rs-595-1-cr-motilal-oswal-8333681.html
9,Inputs prices expected to extend surge: Nestle India’s annual report,https://www.moneycontrol.com/news/business/companies/inputs-prices-expected-to-extend-surge-nestle-indias-annual-report-8243681.html
10,"HUL, Nestle hike prices: Check what gets costlier",https://www.moneycontrol.com/news/business/companies/hul-nestle-hike-prices-check-what-gets-costlier-8228951.html
11,"Nestle Standalone December 2021 Net Sales at Rs 3,739.32 crore, up 8.94% Y-o-Y",https://www.moneycontrol.com/news/business/earnings/nestle-standalone-december-2021-net-sales-at-rs-3739-32-crore-up-8-94-y-o-y-8125441.html
12,"Nestlé Q4 Results | Profit falls 20 percent to Rs 386.6 crore, revenue increases to Rs 3,739 crore",https://www.moneycontrol.com/news/business/earnings/nestle-q4-results-profit-falls-20-percent-to-rs-386-6-crore-revenue-increases-to-rs-3739-crore-8117691.html
13,"Storyboard18 | Nestle’s global CMO: ""I don't see why your shampoo can’t have an impact on society""",https://www.moneycontrol.com/news/business/storyboard18-nestle-global-cmo-aude-gandon-interview-maggi-nescafe-kitkat-social-media-strategy-marketing-lessons-data-privacy-8073101.html
14,Investing in quality stocks may be the best hedge against inflation,https://www.moneycontrol.com/news/business/personal-finance/investing-in-quality-stocks-may-be-the-best-hedge-against-inflation-7926341.html
15,"Mars Wrigley begins making Galaxy chocolates in India, price brought down to Rs 10",https://www.moneycontrol.com/news/business/mars-wrigley-begins-making-galaxy-chocolates-in-india-price-brought-down-to-rs-10-7694141.html
16,"Nestle Standalone September 2021 Net Sales at Rs 3,882.57 crore, up 9.62% Y-o-Y",https://www.moneycontrol.com/news/business/earnings/nestle-standalone-september-2021-net-sales-at-rs-3882-57-crore-up-9-62-y-o-y-7602201.html
17,Nestle Q2 PAT may dip 3% YoY to Rs 584.6 cr: Motilal Oswal,https://www.moneycontrol.com/news/business/nestle-q2-pat-may-dip-3-yoy-to-rs-584-6-cr-motilal-oswal-7570001.html
18,Nestle India increasing number of female employees; 42% of new hires in 2020 were women,https://www.moneycontrol.com/news/business/companies/nestle-india-increasing-number-of-female-employees-42-of-new-hires-in-2020-were-women-7488971.html
19,Highest-paid FMCG CEO: Check who takes home Rs 17.19 crore,https://www.moneycontrol.com/news/business/companies/highest-paid-fmcg-ceo-check-who-takes-home-rs-17-19-crore-7448781.html
20,"Nestle Standalone June 2021 Net Sales at Rs 3,476.70 crore, up 13.97% Y-o-Y",https://www.moneycontrol.com/news/business/earnings/nestle-standalone-june-2021-net-sales-at-rs-3476-70-crore-up-13-97-y-o-y-7241941.html
21,Q1 Nifty Earnings | Maruti Suzuki & Nestle results preview,https://www.moneycontrol.com/news/business/earnings/q1-nifty-earnings-maruti-suzuki-nestle-results-preview-7234121.html
22,Nestle partners with Israeli startup to make plant-based meat: Report,https://www.moneycontrol.com/news/business/companies/nestle-partners-with-israeli-startup-to-make-plant-based-meat-report-7168831.html
23,FMCG CEO Salaries: Who took a cut and who got a hike in FY21,https://www.moneycontrol.com/news/business/companies/fmcg-ceo-salaries-who-took-a-cut-and-who-got-a-hike-in-fy21-7002081.html
24,"Nestle India’s Suresh Narayanan says hard work, compassion and teamwork matter more than qualification",https://www.moneycontrol.com/news/business/nestle-indias-suresh-narayanan-says-hard-work-compassion-and-teamwork-matter-more-than-qualification-7001731.html
25,"Nestle swings into damage-control mode, launches ad campaign on 'healthfulness' of products",https://www.moneycontrol.com/news/business/companies/nestle-swings-into-damage-control-mode-launches-ad-campaign-on-healthfulness-of-products-6996751.html
26,"This week in FMCG: Amul and PETA slug it out, Nestle in ‘unhealthy’ food row and ITC’s Q4 earnings",https://www.moneycontrol.com/news/business/companies/this-week-in-fmcg-amul-and-peta-slug-it-out-nestle-in-unhealthy-food-row-and-itcs-q4-earnings-6991651.html
27,Nestle ‘unhealthy’ food row: 4 questions answered,https://www.moneycontrol.com/news/business/nestle-unhealthy-food-row-4-questions-answered-6970481.html
28,"Nestle, under fire over unhealthy products, working on new strategy",https://www.moneycontrol.com/news/business/nestle-under-fire-over-unhealthy-products-working-on-new-strategy-6965641.html
29,Tech Mahindra joins league of 1.5°C supply chain leaders to reduce greenhouse gas emissions,https://www.moneycontrol.com/news/business/tech-mahindra-joins-league-of-1-5c-supply-chain-leaders-to-reduce-greenhouse-gas-emissions-6802521.html
30,"Nestle Standalone March 2021 Net Sales at Rs 3,610.82 crore, up 8.59% Y-o-Y",https://www.moneycontrol.com/news/business/earnings/nestle-standalone-march-2021-net-sales-at-rs-3610-82-crore-up-8-59-y-o-y-2-6799691.html
31,"Nestle Standalone March 2021 Net Sales at Rs 3,610.82 crore, up 8.59% Y-o-Y",https://www.moneycontrol.com/news/business/earnings/nestle-standalone-march-2021-net-sales-at-rs-3610-82-crore-up-8-59-y-o-y-6797441.html
32,Nestle selling North American bottled-water brands for $4.3 billion,https://www.moneycontrol.com/news/world/nestle-selling-north-american-bottled-water-brands-for-4-3-billion-6542871.html
33,"Nestle Standalone December 2020 Net Sales at Rs 3,432.58 crore, up 9% Y-o-Y",https://www.moneycontrol.com/news/business/earnings/nestle-standalone-december-2020-net-sales-at-rs-3432-58-crore-up-9-y-o-y-6531191.html
34,Nestle to invest 3.2 billion Swiss francs to cut carbon emissions,https://www.moneycontrol.com/news/business/nestle-to-invest-3-2-billion-swiss-francs-to-cut-carbon-emissions-6186201.html
35,"Consumer companies pitch discounts, bargain products as economic malaise looms",https://www.moneycontrol.com/news/world/consumer-companies-pitch-discounts-bargain-products-as-economic-malaise-looms-6023951.html
36,"Nestle Standalone September 2020 Net Sales at Rs 3,541.70 crore, up 10.13% Y-o-Y",https://www.moneycontrol.com/news/business/earnings/nestle-standalone-september-2020-net-sales-at-rs-3541-70-crore-up-10-13-y-o-y-2-6019911.html
37,"Nestle Standalone September 2020 Net Sales at Rs 3,541.70 crore, up 10.13% Y-o-Y",https://www.moneycontrol.com/news/business/earnings/nestle-standalone-september-2020-net-sales-at-rs-3541-70-crore-up-10-13-y-o-y-6017371.html
38,Nestle India: Benefiting from in-home consumption,https://www.moneycontrol.com/news/business/earnings/nestle-india-benefiting-from-in-home-consumption-6012941.html
39,Touchless lattes and self-service kiosks: Office break rooms go coronavirus-proof,https://www.moneycontrol.com/news/business/touchless-lattes-and-self-service-kiosks-office-break-rooms-go-coronavirus-proof-5900471.html
40,"Nestle to buy Aimmune Therapeutics, valuing allergy treatment maker at $2.6 billion",https://www.moneycontrol.com/news/business/nestle-to-buy-aimmune-therapeutics-valuing-allergy-treatment-maker-at-2-6-billion-5776881.html
41,"What should investors do with Nestle India: buy, sell or hold post Q1?",https://www.moneycontrol.com/news/business/stocks/what-should-investors-do-with-nestle-india-buy-sell-or-hold-post-q1-5612231.html
42,Nestle: Strong cash flows help it combat headwinds,https://www.moneycontrol.com/news/business/moneycontrol-research/nestle-strong-cash-flows-help-it-combat-headwinds-5612631.html
43,"Nestle Standalone June 2020 Net Sales at Rs 3,050.48 crore, up 1.65% Y-o-Y",https://www.moneycontrol.com/news/business/earnings/nestle-standalone-june-2020-net-sales-at-rs-3050-48-crore-up-1-65-y-o-y-5612921.html
44,Nestle Q1 PAT seen up 16.4% YoY to Rs. 510 cr: HDFC Securities,https://www.moneycontrol.com/news/business/earnings/nestle-q1-pat-seen-up-16-4-yoy-to-rs-510-cr-hdfc-securities-5605561.html
45,Can Nestlé find its next ‘Maggi moment’ in the 4-minute upma and poha?,https://www.moneycontrol.com/news/india/can-nestle-find-its-next-maggi-moment-in-the-4-minute-upma-and-poha-5499841.html
46,Nestle Q1: Domestic growth sustains despite COVID-19 hiccups,https://www.moneycontrol.com/news/business/companies/nestle-q4-domestic-growth-sustains-despite-covid-19-hiccups-5258811.html
47,Coronavirus pandemic | Nestle's all plants operational but production scaled down,https://www.moneycontrol.com/news/india/coronavirus-pandemic-nestles-all-plants-operational-but-production-scaled-down-5174351.html
48,Coronavirus pandemic | Nestle announces Rs 15 cr grant,https://www.moneycontrol.com/news/india/coronavirus-pandemic-nestle-announces-rs-15-cr-grant-5107671.html
49,COVID-19: FMCG sector sees gains in pockets,https://www.moneycontrol.com/news/business/moneycontrol-research/covid-19-fmcg-sector-sees-gains-in-pockets-5069621.html
50,Nestle tells staff to get ready for coronavirus storm,https://www.moneycontrol.com/news/business/nestle-tells-staff-to-get-ready-for-coronavirus-storm-5062751.html
51,"HUL, Nestle ranked first in nutrition index",https://www.moneycontrol.com/news/business/hul-nestle-ranked-first-in-nutrition-index-4984711.html
52,FMCG Wrap: A round-up of FMCG bigwigs performance during Oct-Dec quarter,https://www.moneycontrol.com/news/business/fmcg-wrap-a-round-up-of-fmcg-bigwigs-performance-during-oct-dec-quarter-4948601.html
53,Nestle boss Schneider eyes more deals to bolster growth ambitions,https://www.moneycontrol.com/news/business/nestle-boss-schneider-eyes-more-deals-to-bolster-growth-ambitions-4942721.html
54,"D-Street Buzz: Nifty MNC outshines led by HUL, Nestle; ITC hits 52-week low, IT drags",https://www.moneycontrol.com/news/business/markets/d-street-buzz-nifty-mnc-outshines-led-by-hul-nestle-itc-hits-52-week-low-it-drags-4897291.html
55,Nestle buys Allergan business to expand in medical nutrition,https://www.moneycontrol.com/news/business/nestle-buys-allergan-business-to-expand-in-medical-nutrition-4862961.html
56,Nestle buys Allergan's Zenpep to expand in medical nutrition,https://www.moneycontrol.com/news/business/nestle-buys-allergans-zenpep-to-expand-in-medical-nutrition-4861941.html
57,Nestle to invest $2.1 bn Swiss francs in recycled plastics,https://www.moneycontrol.com/news/world/nestle-to-invest-2-1-bn-swiss-francs-in-recycled-plastics-4824491.html
58,FMCG companies aim for 100% recyclable plastic packaging by 2025,https://www.moneycontrol.com/news/business/companies/fmcg-companies-aim-for-100-recyclable-plastic-packaging-by-2025-4683531.html
59,ASCI upholds complaints against 344 misleading advertisements,https://www.moneycontrol.com/news/business/companies/asci-upholds-complaints-against-344-misleading-advertisements-4683061.html
60,"Nestle Standalone September 2019 Net Sales at Rs 3,215.81 crore, up 9.41% Y-o-Y",https://www.moneycontrol.com/news/business/earnings/nestle-standalone-september-2019-net-sales-at-rs-3215-81-crore-up-9-41-y-o-y-4629251.html
61,"Nestle posts slightly slower sales growth, revamps waters business",https://www.moneycontrol.com/news/world/nestle-posts-slightly-slower-sales-growth-revamps-waters-business-4542331.html
62,Accenture collaborates with SAP to build advanced capabilities for the SAP Recipe Development application,https://www.moneycontrol.com/news/technology/accenture-collaborates-with-sap-to-build-advanced-capabilities-for-the-sap-recipe-development-application-4431311.html
63,Nestle’s recipe for riding out the FMCG slowdown | Corporate Corridor,https://www.moneycontrol.com/news/opinion/nestles-recipe-for-riding-out-the-fmcg-slowdown-corporate-corridor-4330541.html
64,"Nestle Standalone June 2019 Net Sales at Rs 3,000.85 crore, up 11.21% Y-o-Y",https://www.moneycontrol.com/news/business/earnings/nestle-standalone-june-2019-net-sales-at-rs-3000-85-crore-up-11-21-y-o-y-4289191.html
65,Nestle to invest Rs 700 cr to open a new plant in Sanand for Maggi,https://www.moneycontrol.com/news/business/nestle-to-invest-rs-700-cr-to-open-a-new-plant-in-sanand-for-maggi-4284741.html
66,Nestle posts first-half organic growth of 3.6%,https://www.moneycontrol.com/news/business/companies/nestle-posts-first-half-organic-growth-of-3-6-4250391.html
67,No meat please! Nestle may extend plant-based burger partnerships,https://www.moneycontrol.com/news/business/no-meat-please-nestle-may-extend-plant-based-burger-partnerships-4090971.html
68,Nestle to enter organic food segment in India with Nestle Ceregrow,https://www.moneycontrol.com/news/business/nestle-to-enter-organic-food-segment-in-india-with-nestle-ceregrow-3987231.html
69,Nestle makeover advances with $10 billion sale of skin health unit,https://www.moneycontrol.com/news/business/nestle-makeover-advances-with-10-billion-sale-of-skin-health-unit-3984121.html
70,"Nestle in talks with EQT, ADIA for $10 billion skin health deal",https://www.moneycontrol.com/news/business/companies/nestle-in-talks-with-eqt-adia-for-10-billion-skin-health-deal-3980971.html
71,"Nestle Standalone March 2019 Net Sales at Rs 3,002.95 crore, up 8.91% Y-o-Y",https://www.moneycontrol.com/news/business/earnings/nestle-standalone-march-2019-net-sales-at-rs-3002-95-crore-up-8-91-y-o-y-3980731.html
72,Nestle India plans to seek shareholders' nod every 5 years on royalty to parent firm,https://www.moneycontrol.com/news/business/nestle-india-plans-to-seek-shareholders-nod-every-5-years-on-royalty-to-parent-firm-3837541.html
73,Nestle Q4 PAT seen up 19.3% YoY to Rs. 505.9 cr: Kotak,https://www.moneycontrol.com/news/business/earnings/nestle-q4-pat-seen-up-19-3-yoy-to-rs-505-9-cr-kotak-3784141.html
74,Nestle goes vegan with meat-free burger range,https://www.moneycontrol.com/news/business/nestle-goes-vegan-with-meat-free-burger-range-3749311.html
75,Vidhi Specialty: Beneficiary of strong entry barriers in food colour industry,https://www.moneycontrol.com/news/business/moneycontrol-research/vidhi-specialty-beneficiary-of-strong-entry-barriers-in-food-colour-industry-3635141.html
76,An investment opportunity in the highly regulated food colour business,https://www.moneycontrol.com/news/business/stocks/an-investment-opportunity-in-the-highly-regulated-food-colour-business-3610031.html
77,Do not intend to increase royalty payout beyond 4.5%: Nestle India,https://www.moneycontrol.com/news/business/do-not-intend-to-increase-royalty-payout-beyond-4-5-nestle-india-3607981.html
78,"Nestle India plans up to 3-dozen product launches in 2019, eyes higher exports",https://www.moneycontrol.com/news/business/nestle-india-plans-up-to-3-dozen-product-launches-in-2019-eyes-higher-exports-3554301.html
79,"3 Point Analysis | Nestle Q4 profit up 10%, margins hit",https://www.moneycontrol.com/news/eye-on-india/videos/3-point-analysis-nestle-q4-profit-up-10-margins-hit-3549541.html
80,"Nestle Standalone December 2018 Net Sales at Rs 2,897.27 crore, up 11.37% Y-o-Y",https://www.moneycontrol.com/news/business/earnings/nestle-standalone-december-2018-net-sales-at-rs-2897-27-crore-up-11-37-y-o-y-3542061.html
81,Nestle expects sales to grow this year,https://www.moneycontrol.com/news/business/companies/nestle-expects-sales-to-grow-this-year-3536111.html
82,Nestle set to sell first Starbucks coffee under $7.15 billion deal,https://www.moneycontrol.com/news/business/nestle-set-to-sell-first-starbucks-coffee-under-7-15-billion-deal-3533041.html
83,Quick Take | Does Danone’s investment in Epigamia make sense?,https://www.moneycontrol.com/news/opinion/quick-take-does-danones-investment-in-epigamia-make-sense-3401821.html
84,Nestle Q3 PAT seen up 22.9% YoY to Rs. 383.3 cr: Kotak,https://www.moneycontrol.com/news/business/earnings/nestle-q3-pat-seen-up-22-9-yoy-to-rs-383-3-cr-kotak-3373691.html
85,Nestle to tap inorganic growth through meaningful opportunities: CEO Mark Schneider,https://www.moneycontrol.com/news/business/companies/nestle-to-tap-inorganic-growth-through-meaningful-opportunities-ceo-mark-schneider-3209781.html
86,"Important to address concerns quickly in cyber era, Nestle CEO on Maggi crisis learning",https://www.moneycontrol.com/news/business/important-to-address-concerns-quickly-in-cyber-era-nestle-ceo-on-maggi-crisis-learning-3201321.html
87,Big consumer brands pledge to turn tide on global plastic waste,https://www.moneycontrol.com/news/business/big-consumer-brands-pledge-to-turn-tide-on-global-plastic-waste-3097031.html
88,"DGAP finds Nestle profiteered Rs 100 cr, company deposits money in fund",https://www.moneycontrol.com/news/business/dgap-finds-nestle-profiteered-rs-100-cr-company-deposits-money-in-fund-3072291.html
89,"Coca-Cola, Nestle & Unilever shortlisted by GSK for Horlicks sale: Report",https://www.moneycontrol.com/news/business/coca-cola-nestle-unilever-shortlisted-by-gsk-for-horlicks-sale-report-3001761.html
90,"Nestle considers 'minimum' price hike due to rise in commodity, oil prices",https://www.moneycontrol.com/news/business/nestle-considers-minimum-price-hike-due-to-rise-in-commodity-oil-prices-2990471.html
91,Nestle to cut fewer tech workers in Switzerland,https://www.moneycontrol.com/news/world/nestle-to-cut-fewer-tech-workers-in-switzerland-2898601.html
92,Nestle seals deal to market Starbucks coffee,https://www.moneycontrol.com/news/world/nestle-seals-deal-to-market-starbucks-coffee-2889121.html
93,"Nestle standalone Jun-2018 sales at Rs 2,698.40 crore",https://www.moneycontrol.com/news/business/earnings/nestle-standalone-jun-2018-sales-at-rs-2698-40-crore-2802221.html
94,EU judges offer no 'break' in Kit Kat trademark war,https://www.moneycontrol.com/news/business/companies/eu-judges-offer-no-break-in-kit-kat-trademark-war-2762181.html
95,Nestle Q1 PAT seen up 38.8% YoY to Rs. 341.3 cr: KR Choksey,https://www.moneycontrol.com/news/business/earnings/nestle-q1-pat-seen-up-38-8-yoy-to-rs-341-3-cr-kr-choksey-2744981.html
96,FMCG Preview: Revival in rural markets to boost profits in Q1FY19,https://www.moneycontrol.com/news/business/fmcg-preview-revival-in-rural-markets-to-boost-profits-in-q1fy19-2701581.html
97,Nestle suspended from 'sustainable' palm oil body,https://www.moneycontrol.com/news/world/nestle-suspended-from-sustainable-palm-oil-body-2649631.html
98,Horlicks: A potential nutrient fit for select FMCG giants,https://www.moneycontrol.com/news/business/moneycontrol-research/horlicks-a-potential-nutrient-fit-for-a-select-fmcg-giants-2641541.html
99,"Possible sale of Complan, Horlicks casts spell on Rs 7,000 crore malt-based health drinks market",https://www.moneycontrol.com/news/business/companies/possible-sale-of-complan-horlicks-casts-spell-on-rs-7000-crore-malt-based-health-drinks-market-2620951.html
100,Timely monsoon this year to help spur growth: Nestle India CMD,https://www.moneycontrol.com/news/business/timely-monsoon-this-year-to-help-spur-growth-nestle-india-cmd-2586729.html
101,Nestle pays $7.15 billion to sell Starbucks products,https://www.moneycontrol.com/news/world/nestle-pays-7-15-billion-to-sell-starbucks-products-2564129.html
102,Nestle Q4 PAT may dip 206.3% YoY to Rs. 344.5 cr: KR Choksey,https://www.moneycontrol.com/news/business/earnings/nestle-q4-pat-may-dip-206-3-yoy-to-rs-344-5-cr-kr-choksey-2553499.html
103,"Pick up in volume growth to persist in Q4, rural recovery key for FMCG pack",https://www.moneycontrol.com/news/business/pick-up-in-volume-growth-to-persist-in-q4-rural-recovery-key-for-fmcg-pack-2546509.html
104,Where do these popular brands come from? Find out the country-of-origin of these companies,https://www.moneycontrol.com/news/photos/business/where-do-these-popular-brands-come-from-find-out-the-country-of-origin-of-these-companies-2528975.html
105,Nestle opens the doors to Maggi's manufacturing unit,https://www.moneycontrol.com/news/business/nestle-opens-the-doors-to-maggis-manufacturing-unit-2524419.html
106,"Nestle disappoints in 2017, no plan to increase L'Oreal stake",https://www.moneycontrol.com/news/world/international-results/nestle-disappoints-in-2017-no-plan-to-increase-loreal-stake-2508725.html
107,Nestle to consider recommendation for dividend next week,https://www.moneycontrol.com/news/business/nestle-to-consider-recommendation-for-dividend-next-week-2501327.html
108,"Nestle, Cuba lay first stone for $55 million coffee and biscuit factory",https://www.moneycontrol.com/news/world/nestle-cuba-lay-first-stone-for-55-million-coffee-and-biscuit-factory-2449689.html
109,Will pass on GST rate cut benefits to consumers: Nestle,https://www.moneycontrol.com/news/business/economy/will-pass-on-gst-rate-cut-benefits-to-consumers-nestle-2436465.html
110,"Nestle sets formal margin goal, confirms growth target",https://www.moneycontrol.com/news/world/nestle-sets-formal-margin-goal-confirms-growth-target-2397817.html
111,"See upside of 10-15% in GAIL, Petronet, buy Havells at around Rs 500: Amit Gupta",https://www.moneycontrol.com/news/business/see-upside-of-10-15-in-gail-petronet-buy-havells-at-around-rs-500-amit-gupta-2392335.html
112,Nestle to buy Sweet Earth foods to boost healthier offering,https://www.moneycontrol.com/news/world/nestle-to-buy-sweet-earth-foods-to-boost-healthier-offering-2381823.html
113,Hold Nestle; target of Rs 7039: Edelweiss,https://www.moneycontrol.com/news/business/stocks/hold-nestle-target-of-rs-7039-edelweiss-2371891.html
114,Hold Nestle; target of Rs 6624: Reliance Securities,https://www.moneycontrol.com/news/business/stocks/hold-nestle-target-of-rs-6624-reliance-securities-2341699.html
115,Uflex Develops Speciality Polymeric Film to Replace Bi-axially Oriented Polyamide (Nylon) Film,https://www.moneycontrol.com/news/business/wire-news/uflex-develops-speciality-polymeric-film-to-replace-bi-axially-oriented-polyamide-(nylon)-film-2344153.html
116,Nestle CEO doesn't rule out larger buys in health ops: Manager Magazin,https://www.moneycontrol.com/news/india/nestle-ceo-doesnt-rule-out-larger-buys-in-health-ops-manager-magazin-2331431.html
117,"Buy Nestle, Colgate Palmolive, Shriram Transport, Power Grid: Amit Gupta",https://www.moneycontrol.com/news/business/buy-nestle-colgate-palmolive-shriram-transport-power-grid-amit-gupta-2319015.html
118,Nestle plans $20.8 billion share buyback amid Third Point pressure,https://www.moneycontrol.com/news/world/nestle-plans-20-8-billion-share-buyback-amid-third-point-pressure-2313271.html
119,Is Maggi worth its salt? Nestle claims health comes first,https://www.moneycontrol.com/news/business/is-maggi-worth-its-salt-nestle-claims-health-comes-first-2293525.html
120,Hold Nestle; target of Rs 7276: Edelweiss,https://www.moneycontrol.com/news/business/stocks/hold-nestle-target-of-rs-7276-edelweiss-2280537.html
121,"Stocks in the news: IOC, Cipla, Nestle, Indian Hume Pipe, Reliance Power",https://www.moneycontrol.com/news/business/stocks/stocks-in-news-ioc-cipla-nestle-indian-hume-pipe-reliance-power-2258853.html
122,GST rollout: Challenges and the road ahead for consumer firms,https://www.moneycontrol.com/news/business/economy/gst-rollout-challenges-and-the-road-ahead-for-consumer-firms-2251891.html
123,"Buy, sell, hold: 9 stocks & 2 sectors to focus as market hits record high",https://www.moneycontrol.com/news/business/stocks/buy-sell-hold-9-stocks-2-sectors-to-focus-as-market-hits-record-high-2241013.html
124,India biz grew strongly in 2016 despite demonetisation: Nestle,https://www.moneycontrol.com/news/business/companies/india-biz-grew-strongly2016-despite-demonetisation-nestle-1005953.html
125,Nestle scales back growth targets amid economic jitters,https://www.moneycontrol.com/news/world/international-results/nestle-scales-back-growth-targets-amid-economic-jitters-1006092.html
126,"Sensex extends losses, Midcap sinks over 1%; Nestle in focus",https://www.moneycontrol.com/news/business/markets/sensex-extends-losses-midcap-sinks-over-1-nestlefocus-1004105.html
127,FSSAI asks corporates to spread message of food safety,https://www.moneycontrol.com/news/trends/current-affairs-trends/fssai-asks-corporates-to-spread-messagefood-safety-950294.html
128,Uflex Transforms Tortilla Chips` Packaging for America`s Healthiest Grocery Store,https://www.moneycontrol.com/news/business/wire-news/uflex-transforms-tortilla-chips`-packaging-for-america`s-healthiest-grocery-store-940325.html
