,Headlines,Links
246,"Tech Mahindra Standalone June 2019 Net Sales at Rs 6,858.70 crore, up 9.1% Y-o-Y",https://www.moneycontrol.com/news/business/earnings/tech-mahindra-standalone-june-2019-net-sales-at-rs-6858-70-crore-up-9-1-y-o-y-4267761.html
247,"Tech Mahindra Q1 profit may fall over 15%, dollar revenue degrowth could be 1% QoQ",https://www.moneycontrol.com/news/business/markets/tech-mahindra-q1-profit-may-fall-over-15-dollar-revenue-degrowth-could-be-1-qoq-4265371.html
248,Tech Mahindra Q1 PAT may dip 16.9% QoQ to Rs. 940.6 cr: Prabhudas Lilladher,https://www.moneycontrol.com/news/business/earnings/tech-mahindra-q1-pat-may-dip-16-9-qoq-to-rs-940-6-cr-prabhudas-lilladher-4181571.html
249,Tech Mahindra Q1 PAT may dip 17.3% QoQ to Rs. 936 cr: Kotak,https://www.moneycontrol.com/news/business/earnings/tech-mahindra-q1-pat-may-dip-17-3-qoq-to-rs-936-cr-kotak-4181001.html
250,"Market Headstart: Nifty likely to open higher; SBI, Amara Raja top buys",https://www.moneycontrol.com/news/business/markets/market-headstart-nifty-likely-to-open-higher-sbi-amara-raja-top-buys-4167561.html
251,Hold Tech Mahindra; target of Rs 845: ICICI Direct,https://www.moneycontrol.com/news/business/stocks/hold-tech-mahindra-target-of-rs-845-icici-direct-4135201.html
252,"Tech Mahindra inks deal with Airbus for cabin, cargo design engineering",https://www.moneycontrol.com/news/business/tech-mahindra-inks-deal-with-airbus-for-cabin-cargo-design-engineering-4120871.html
253,Accumulate Tech Mahindra; target of Rs 880: Dolat Capital,https://www.moneycontrol.com/news/business/stocks/accumulate-tech-mahindra-target-of-rs-880-dolat-capital-4093201.html
254,Buy Tech Mahindra; target of Rs 900: Motilal Oswal,https://www.moneycontrol.com/news/business/stocks/buy-tech-mahindra-target-of-rs-900-motilal-oswal-2-4085041.html
255,Buy Tech Mahindra; target of Rs 900: Motilal Oswal,https://www.moneycontrol.com/news/business/stocks/buy-tech-mahindra-target-of-rs-900-motilal-oswal-4085371.html
256,"Tech Mahindra collaborates with Cisco, deploys solutions at Hyderabad campus",https://www.moneycontrol.com/news/business/tech-mahindra-collaborates-with-cisco-deploys-solutions-at-hyderabad-campus-4044931.html
257,Tech Mahindra and MKI collaborate to develop next-gen digital enterprise solutions for Japanese market,https://www.moneycontrol.com/news/business/tech-mahindra-and-mki-collaborate-to-develop-next-gen-digital-enterprise-solutions-for-japanese-market-4039451.html
258,Buy Tech Mahindra; target of Rs 847 Prabhudas Lilladher,https://www.moneycontrol.com/news/business/stocks/buy-tech-mahindra-target-of-rs-847-prabhudas-lilladher-4007611.html
259,"Tech Mahindra betting big on telecom sector's revival for growth, says CFO",https://www.moneycontrol.com/news/business/companies/tech-mahindra-betting-big-on-telecom-sectors-revival-for-growth-says-cfo-4005131.html
260,"What should investors do with Tech Mahindra post Q4: buy, sell or hold?",https://www.moneycontrol.com/news/business/markets/what-should-investors-do-with-tech-mahindra-post-q4-buy-sell-or-hold-4003261.html
261,"Tech Mahindra Consolidated March 2019 Net Sales at Rs 8,892.30 crore, up 10.4% Y-o-Y",https://www.moneycontrol.com/news/business/earnings/tech-mahindra-consolidated-march-2019-net-sales-at-rs-8892-30-crore-up-10-4-y-o-y-4001151.html
262,"Tech Mahindra Standalone March 2019 Net Sales at Rs 7,064.60 crore, up 17.34% Y-o-Y",https://www.moneycontrol.com/news/business/earnings/tech-mahindra-standalone-march-2019-net-sales-at-rs-7064-60-crore-up-17-34-y-o-y-4001121.html
263,Spectrum auction need to be commenced for 5G roll out: Tech Mahindra,https://www.moneycontrol.com/news/business/spectrum-auction-need-to-be-commenced-for-5g-roll-out-tech-mahindra-4000031.html
264,Tech Mahindra to post Q4 earnings today; here's what brokerages expect,https://www.moneycontrol.com/news/business/markets/q4-preview-brokerages-expect-tech-mahindras-profit-to-decline-qoq-ebitda-margins-to-slip-amid-rupee-appreciation-3994771.html
265,"Chart Check: Here’s what investors should do with Vodafone Idea, Tech Mahindra",https://www.moneycontrol.com/news/business/markets/chart-check-heres-what-investors-should-do-with-vodafone-idea-tech-mahindra-3972571.html
266,IT stocks trade lower as Cognizant cuts 2019 revenue guidance,https://www.moneycontrol.com/news/business/markets/it-stocks-trade-lower-as-cognizant-cuts-2019-revenue-guidance-3926961.html
267,"'Bet on TechM, Wipro and Mindtree for better return among IT stocks'",https://www.moneycontrol.com/news/business/markets/bet-on-techm-wipro-and-mindtree-for-better-return-among-it-stocks-3913911.html
268,"TechM to buy 18.1% stake each in lnfotek Software and Systems, Vitaran for up to Rs 13 cr",https://www.moneycontrol.com/news/business/techm-to-buy-18-1-stake-each-in-lnfotek-software-and-systems-vitaran-for-up-to-rs-13-cr-3790961.html
269,"Tech Mahindra Q4 PAT may dip 10.3% QoQ to Rs. 1,078.5 cr: Prabhudas Lilladher",https://www.moneycontrol.com/news/business/earnings/tech-mahindra-q4-pat-may-dip-10-3-qoq-to-rs-1078-5-cr-prabhudas-lilladher-3764171.html
270,"Tech Mahindra Q4 PAT may dip 5.7% QoQ to Rs. 1,134.3 cr: Kotak",https://www.moneycontrol.com/news/business/earnings/tech-mahindra-q4-pat-may-dip-5-7-qoq-to-rs-1134-3-cr-kotak-3763511.html
271,"Expect strong Q4 growth from Infosys, TCS and HCL Tech: Kotak Equities",https://www.moneycontrol.com/news/business/markets/expect-strong-q4-growth-from-infosys-tcs-and-hcl-tech-kotak-equities-3746291.html
272,"Ongoing trend of consolidation in IT sector: Manoj Bhat, CFO, Tech Mahindra",https://www.moneycontrol.com/news/business/ongoing-trend-of-consolidation-in-it-sector-manoj-bhat-cfo-tech-mahindra-3658031.html
273,Tech Mahindra to acquire K-Vision for $1.5 mn to expand 5G business,https://www.moneycontrol.com/news/business/tech-mahindra-to-acquire-k-vision-for-1-5-mn-to-expand-5g-business-3649081.html
274,Enterprises look to Digital Transformation to respond to exponential change: Report,https://www.moneycontrol.com/news/business/enterprises-look-to-digital-transformation-to-respond-to-exponential-change-report-3642511.html
275,Podcast | Editor’s pick of the day – What is a share buyback?,https://www.moneycontrol.com/news/podcast/podcast-editors-pick-of-the-day-what-is-a-share-buyback-3600511.html
276,"D-Street Buzz: Auto stocks extend rally led by Tata Motors, Eicher Motors; PNB jumps 8%, Tech Mahindra drags",https://www.moneycontrol.com/news/business/markets/d-street-buzz-auto-stocks-extend-rally-led-by-tata-motors-eicher-motors-pnb-jumps-8-tech-mahindra-drags-3609451.html
277,"Tech Mahindra's Rs 1,956-cr share buyback: Should you tender your shares?",https://www.moneycontrol.com/news/business/markets/tech-mahindras-rs-1956-cr-share-buyback-should-you-tender-your-shares-3582401.html
278,"Tech Mahindra to buyback 2.05 crore shares for Rs 1,956 crore",https://www.moneycontrol.com/news/business/tech-mahindra-to-buyback-2-05-crore-shares-for-rs-1956-crore-3566641.html
279,Tech Mahindra and Rakuten set up 5G Lab in Tokyo,https://www.moneycontrol.com/news/business/tech-mahindra-and-rakuten-set-up-5g-lab-in-tokyo-3565011.html
280,Expect some stresses and strains to ease off in FY20: Tech Mahindra,https://www.moneycontrol.com/news/business/expect-some-stresses-and-strains-to-ease-off-in-fy20-tech-mahindra-3562961.html
281,Buy Tech Mahindra; target of Rs 860: Motilal Oswal,https://www.moneycontrol.com/news/business/stocks/buy-tech-mahindra-target-of-rs-860-motilal-oswal-3561541.html
282,IT sector to see strong earnings growth in 2019; Infosys and HCL Tech top bets: CLSA,https://www.moneycontrol.com/news/business/markets/it-sector-to-see-strong-earnings-growth-in-2019-infosys-and-hcl-tech-top-bets-clsa-3555551.html
283,Tech Mahindra gains 3% ahead of board meeting to consider share buyback proposal,https://www.moneycontrol.com/news/business/markets/tech-mahindra-gains-3-ahead-of-board-meeting-to-consider-share-buyback-proposal-3549761.html
284,Market Headstart | Nifty likely to open higher on upbeat Asian market cues,https://www.moneycontrol.com/news/business/markets/market-headstart-nifty-likely-to-open-higher-on-upbeat-asian-market-cues-3549361.html
285,Tech Mahindra board to meet on February 21 to consider share buyback,https://www.moneycontrol.com/news/business/tech-mahindra-board-to-meet-on-february-21-to-consider-share-buyback-3547571.html
286,Buy Tech Mahindra; target of Rs 880: HDFC Securities,https://www.moneycontrol.com/news/business/stocks/buy-tech-mahindra-target-of-rs-880-hdfc-securities-3536041.html
287,Experts say some IT cos have potential to grow further; 4 stocks Kotak is betting on,https://www.moneycontrol.com/news/business/markets/experts-say-some-it-cos-have-potential-to-grow-further-4-stocks-kotak-is-betting-on-3529411.html
288,Market Headstart: Nifty likely to open higher; 3 stocks which could give 8-10% return,https://www.moneycontrol.com/news/business/markets/market-headstart-nifty-likely-to-open-higher-3-stocks-which-could-give-8-10-return-3525231.html
289,Buy Tech Mahindra; target of Rs 915: Prabhudas Lilladher,https://www.moneycontrol.com/news/business/stocks/buy-tech-mahindra-target-of-rs-915-prabhudas-lilladher-3519511.html
290,Buy Tech Mahindra; target of Rs 900: ICICI Direct,https://www.moneycontrol.com/news/business/stocks/buy-tech-mahindra-target-of-rs-900-icici-direct-3506221.html
291,Tech Mahindra commits to 22% reduction in greenhouse gas emissions by 2030,https://www.moneycontrol.com/news/business/tech-mahindra-commits-to-22-reduction-in-greenhouse-gas-emissions-by-2030-3512991.html
292,Buy Tech Mahindra; target of Rs 950: Dolat Capital,https://www.moneycontrol.com/news/business/stocks/buy-tech-mahindra-target-of-rs-950-dolat-capital-3503211.html
293,Q3 earnings scorecard: 10 stocks where global brokerages raised target price post results,https://www.moneycontrol.com/news/business/markets/q3-earnings-scorecard-10-stocks-where-global-brokerages-raised-target-price-post-results-3500931.html
294,3 Point Analysis | Tech Mahindra Q3 earning review,https://www.moneycontrol.com/news/eye-on-india/videos/3-point-analysis-tech-mahindra-q3-earning-review-3493431.html
295,"D-Street Buzz: Zee Entertainment, Tech Mahindra jump 6-7%; Infosys hits new 52-week high, midcaps drag",https://www.moneycontrol.com/news/business/markets/d-street-buzz-zee-entertainment-tech-mahindra-jump-6-7-infosys-hits-new-52-week-high-midcaps-drag-3491441.html
296,"D-Street Buzz: Nifty Media outshines led by Zee Entertainment; Tata Steel jumps 3%, Tech Mahindra rallies",https://www.moneycontrol.com/news/business/markets/d-street-buzz-nifty-media-outshines-led-by-zee-entertainment-tata-steel-jumps-3-tech-mahindra-rallies-3490881.html
297,Brokerage calls: Credit Suisse raises target price on Tech Mahindra to Rs 950,https://www.moneycontrol.com/news/business/markets/brokerage-calls-credit-suisse-raises-target-price-on-tech-mahindra-to-rs-950-3489181.html
298,"Tech Mahindra surges 4% after profit rises 13% to Rs 1,203 crore",https://www.moneycontrol.com/news/business/markets/tech-mahindra-surges-4-after-profit-rises-13-to-rs-1203-crore-3489281.html
299,"Tech Mahindra Consolidated December 2018 Net Sales at Rs 8,943.70 crore, up 15.02% Y-o-Y",https://www.moneycontrol.com/news/business/earnings/tech-mahindra-consolidated-december-2018-net-sales-at-rs-8943-70-crore-up-15-02-y-o-y-3487361.html
300,"Tech Mahindra Standalone December 2018 Net Sales at Rs 6,989.70 crore, up 17.13% Y-o-Y",https://www.moneycontrol.com/news/business/earnings/tech-mahindra-standalone-december-2018-net-sales-at-rs-6989-70-crore-up-17-13-y-o-y-3487141.html
301,"Tech Mahindra Q3 profit rises 13% QoQ, revenue surges 3.6%",https://www.moneycontrol.com/news/business/earnings/tech-mahindra-profit-rises-13-qoq-revenue-surges-3-6-3486631.html
302,"Tech Mahindra Q3 PAT seen up 8.7% QoQ to Rs. 1,157.2 cr: Dolat Capital",https://www.moneycontrol.com/news/business/earnings/tech-mahindra-q3-pat-seen-up-8-7-qoq-to-rs-1157-2-cr-dolat-capital-3388241.html
303,"Tech Mahindra Q3 PAT seen up 10.4% QoQ to Rs. 1,189.3 cr: Prabhudas Lilladher",https://www.moneycontrol.com/news/business/earnings/tech-mahindra-q3-pat-seen-up-10-4-qoq-to-rs-1189-3-cr-prabhudas-lilladher-3382611.html
304,10 years to Satyam: How India's Enron moment unfolded,https://www.moneycontrol.com/news/business/10-years-to-satyam-how-indias-enron-moment-unfolded-3359941.html
305,Tech Mahindra retains 8-10% enterprise growth guidance for next year,https://www.moneycontrol.com/news/business/tech-mahindra-retains-8-10-enterprise-growth-guidance-for-next-year-3354831.html
306,CIMB expects top 5 IT firms to report 1.5–4.8% QoQ revenue growth in constant currency in Q3,https://www.moneycontrol.com/news/business/earnings/cimb-expects-top-5-it-firms-to-report-1-5-4-8-qoq-revenue-growth-in-constant-currency-in-q3-3353541.html
307,Hyderabad HC sets aside ED order attaching Rs 822 cr fixed deposits of Tech Mahindra,https://www.moneycontrol.com/news/business/hyderabad-hc-sets-aside-ed-order-attaching-rs-822-cr-fixed-deposits-of-tech-mahindra-3339821.html
308,D-Street Buzz: Nifty Media falls 4% as Zee Entertainment plunges 8%; Sun Pharma gains,https://www.moneycontrol.com/news/business/markets/d-street-buzz-nifty-media-falls-4-as-zee-entertainment-plunges-8-sun-pharma-gains-3303561.html
309,"Nifty may face resistance around 10,970; these 3 stocks could return 14-15%",https://www.moneycontrol.com/news/business/markets/nifty-may-face-resistance-around-10970-these-3-stocks-could-return-14-15-3254021.html
310,Buy Tech Mahindra; target of Rs 885: Prabhudas Lilladher,https://www.moneycontrol.com/news/business/stocks/buy-tech-mahindra-target-of-rs-885-prabhudas-lilladher-3238321.html
311,Transcript| Tech Mahindra Q2FY19 Earnings Conference Call,https://www.moneycontrol.com/news/business/earnings/transcript-tech-mahindra-q2fy19-earnings-conference-call-3234631.html
312,"Some smallcaps double investor wealth, but are largecaps a better bet?",https://www.moneycontrol.com/news/business/markets/some-smallcaps-double-investor-wealth-but-are-largecaps-a-better-bet-3229711.html
313,Indian market too big and lucrative to miss out on: Tech Mahindra,https://www.moneycontrol.com/news/technology/indian-market-too-big-and-lucrative-to-miss-out-on-tech-mahindra-3225401.html
314,Tech Mahindra bags Rs 270 cr IT modernisation project from Coal India,https://www.moneycontrol.com/news/business/tech-mahindra-bags-rs-270-cr-it-modernisation-project-from-coal-india-3223661.html
315,Market Headstart: Nifty likely to open lower; 3 stocks which could give 8-10% return,https://www.moneycontrol.com/news/business/markets/market-headstart-nifty-likely-to-open-lower-3-stocks-which-could-give-8-10-return-3154841.html
316,Tech Mahindra looks at global 5G rollouts as huge opportunity,https://www.moneycontrol.com/news/business/tech-mahindra-looks-at-global-5g-rollouts-as-huge-opportunity-3147811.html
317,"IT wrap: IBM’s Red Hat acquisition steals limelight; Tech Mahindra, Cognizant report Q2 earnings",https://www.moneycontrol.com/news/technology/it-wrap-ibms-red-hat-acquisition-steals-limelight-tech-mahindra-cognizant-report-q2-earnings-3126581.html
318,"Tech Mahindra Standalone September 2018 Net Sales at Rs 6,870.86 crore, up 16.07% Q-o-Q",https://www.moneycontrol.com/news/business/earnings/tech-mahindra-standalone-september-2018-net-sales-at-rs-6870-86-crore-up-16-07-q-o-q-3105321.html
319,"Tech Mahindra Q2 profit beats estimates at Rs 1,064 crore; revenue at Rs 8,630 crore",https://www.moneycontrol.com/news/business/earnings/tech-mahindra-q2-profit-beats-estimates-at-rs-1064-crore-revenue-at-rs-8630-crore-3104711.html
320,"Tech Mahindra Q2 preview: Numbers likely steady, weak rupee to boost revenue",https://www.moneycontrol.com/news/business/earnings/tech-mahindra-q2-preview-numbers-likely-steady-weak-rupee-to-boost-revenue-3100461.html
321,"Tech Mahindra, Rakuten partner for building 5G, 4G labs in India, Japan",https://www.moneycontrol.com/news/business/tech-mahindra-rakuten-partner-for-building-5g-4g-labs-in-india-japan-3099901.html
322,"Tech Mahindra Q2 PAT seen up 21.6% QoQ to Rs. 1,106.6 cr: Prabhudas Lilladher",https://www.moneycontrol.com/news/business/earnings/tech-mahindra-q2-pat-seen-up-21-6-qoq-to-rs-1106-6-cr-prabhudas-lilladher-3036621.html
323,"Tech Mahindra Q2 PAT seen up 24.8% QoQ to Rs. 1,120.2 cr: Motilal Oswal",https://www.moneycontrol.com/news/business/earnings/tech-mahindra-q2-pat-seen-up-24-8-qoq-to-rs-1120-2-cr-motilal-oswal-3022991.html
324,Tech Mahindra expects 30-40% growth in cyber security biz,https://www.moneycontrol.com/news/business/tech-mahindra-expects-30-40-growth-in-cyber-security-biz-3021101.html
325,"Tech Mahindra, Israel Aerospace Industries team up for cybersecurity",https://www.moneycontrol.com/news/technology/tech-mahindra-israel-aerospace-industries-team-up-for-cybersecurity-3009091.html
326,"Tech Mahindra, Israel Aerospace tie up for advanced global cybersecurity",https://www.moneycontrol.com/news/business/tech-mahindra-israel-aerospace-tie-up-for-advanced-global-cybersecurity-3008881.html
327,Markets@Moneycontrol: Nifty likely to open higher; 3 stocks which could give 6-8%,https://www.moneycontrol.com/news/business/markets/marketsmoneycontrol-nifty-likely-to-open-higher-3-stocks-which-could-give-6-8-2972021.html
328,"A morning walk down Dalal Street | Bounce back may be on the cards, 11160 should be key level to watch out for",https://www.moneycontrol.com/news/business/markets/a-morning-walk-down-dalal-street-11160-key-level-to-watch-out-for-2969261.html
329,"Tech weekly wrap: iPhone launch, TechM fires employee and Infosys acquires Fluido",https://www.moneycontrol.com/news/technology/tech-weekly-wrap-iphone-launch-techm-fires-employee-and-infosys-acquires-fluido-2955301.html
330,Rupee depreciation vs the dollar not to materially impact IT services firms,https://www.moneycontrol.com/news/technology/rupee-depreciation-vs-the-dollar-not-to-materially-impact-it-services-firms-2945581.html
331,Axis Capital maintains 'buy' call on Tech Mahindra,https://www.moneycontrol.com/news/business/axis-capital-maintains-buy-call-on-tech-mahindra-2944951.html
332,"Tech Mahindra to set up 5G CoE in Washington, Bengaluru",https://www.moneycontrol.com/news/business/tech-mahindra-to-set-up-5g-coe-in-washington-bengaluru-2942461.html
333,"Tech Mahindra, Avaamo partner to develop conversational AI platform",https://www.moneycontrol.com/news/business/tech-mahindra-avaamo-partner-to-develop-conversational-ai-platform-2929381.html
334,RBI cancels licence of Tech Mahindra for issuing pre-paid cards,https://www.moneycontrol.com/news/business/rbi-cancels-licence-of-tech-mahindra-for-issuing-pre-paid-cards-2890851.html
335,"Tech Mahindra, Microsoft join hands to curb pesky calls",https://www.moneycontrol.com/news/trends/current-affairs-trends/tech-mahindra-microsoft-join-hands-to-curb-pesky-calls-2884471.html
336,Tech Mahindra to acquire Czech based engineering service firm for Rs 8 crore,https://www.moneycontrol.com/news/india/tech-mahindra-to-acquire-czech-based-engineering-service-firm-for-rs-8-crore-2869711.html
337,Tech Mahindra signs 4 year deal with US football team,https://www.moneycontrol.com/news/business/tech-mahindra-signs-4-year-deal-with-us-football-team-2851321.html
338,Buy Tech Mahindra; target of Rs 810: JM Financial,https://www.moneycontrol.com/news/business/stocks/buy-tech-mahindra-target-of-rs-810-jm-financial-2808951.html
339,"Tech Mahindra hints at hiring 4,000 freshers in next 3 quarters",https://www.moneycontrol.com/news/business/tech-mahindra-hints-at-hiring-4000-freshers-in-next-3-quarters-2806361.html
340,Tech Mahindra inks pact with Telangana for 'Blockchain district',https://www.moneycontrol.com/news/business/tech-mahindra-inks-pact-with-telangana-for-blockchain-district-2801791.html
341,Buy Tech Mahindra; target of Rs 760: Prabhudas Lilladher,https://www.moneycontrol.com/news/business/stocks/buy-tech-mahindra-target-of-rs-760-prabhudas-lilladher-2-2795991.html
342,Buy Tech Mahindra; target of Rs 740: HDFC Securities,https://www.moneycontrol.com/news/business/stocks/buy-tech-mahindra-target-of-rs-740-hdfc-securities-2792161.html
343,"Tech Mahindra consolidated Jun-2018 total income from operations at Rs 8,276.28 crore",https://www.moneycontrol.com/news/business/earnings/tech-mahindra-consolidated-jun-2018-total-income-from-operations-at-rs-8276-28-crore-2781411.html
344,"Tech Mahindra PAT falls to Rs 898 cr, CFO confident of 40% growth in digital revenue near term",https://www.moneycontrol.com/news/technology/tech-mahindra-q1-disappoints-with-consolidated-pat-at-rs-898-crore-2780111.html
345,"Tech Mahindra to report Q1 results today: Telecom, digital commentary eyed",https://www.moneycontrol.com/news/technology/tech-mahindra-to-report-q1-results-today-telecom-digital-commentary-eyed-2779111.html
346,Tech Mahindra Q1 PAT may dip 23.4% QoQ to Rs. 939.4 cr: Edelweiss,https://www.moneycontrol.com/news/business/earnings/tech-mahindra-q1-pat-may-dip-23-4-qoq-to-rs-939-4-cr-edelweiss-2704741.html
347,Tech Mahindra Q1 PAT may dip 23.7% QoQ to Rs. 933 cr: HDFC Securities,https://www.moneycontrol.com/news/business/earnings/tech-mahindra-q1-pat-may-dip-23-7-qoq-to-rs-933-cr-hdfc-securities-2703821.html
348,These 3 stocks could return up to 30% in 1 year,https://www.moneycontrol.com/news/business/markets/these-3-stocks-could-return-up-to-30-in-1-year-2657851.html
349,IT stocks rally smartly as rupee hits 19-month low of 68.53 to the dollar,https://www.moneycontrol.com/news/business/markets/it-stocks-rally-smartly-as-rupee-hits-19-month-low-of-68-53-to-the-dollar-2639191.html
350,"Markets@Moneycontrol: Nifty likely to open lower, may retest 10,700 levels",https://www.moneycontrol.com/news/business/markets/marketsmoneycontrol-nifty-likely-to-open-lower-may-retest-10700-levels-2633321.html
351,"Tech Mahindra sets up its R&D arm Maker's Lab in US, Germany",https://www.moneycontrol.com/news/business/tech-mahindra-sets-up-its-rd-arm-makers-lab-in-us-germany-2614141.html
352,"Labour union accuses Tech Mahindra of layoffs, unfair termination",https://www.moneycontrol.com/news/business/companies/labour-union-accuses-tech-mahindra-of-layoffs-unfair-termination-2589601.html
353,Tech Mahindra appoints Harshvendra Soin as Chief People Officer,https://www.moneycontrol.com/news/business/tech-mahindra-appoints-harshvendra-soin-as-chief-people-officer-2584411.html
354,Buy Tech Mahindra; target of Rs 817: KR Choksey,https://www.moneycontrol.com/news/business/stocks/buy-tech-mahindra-target-of-rs-817-kr-choksey-2583849.html
355,Hold Tech Mahindra; target of Rs 735: ICICI Direct,https://www.moneycontrol.com/news/business/stocks/hold-tech-mahindra-target-of-rs-735-icici-direct-2582083.html
356,Buy Tech Mahindra; target of Rs 760: Prabhudas Lilladher,https://www.moneycontrol.com/news/business/stocks/buy-tech-mahindra-target-of-rs-760-prabhudas-lilladher-2580663.html
357,"Market Update: Nifty IT outperforms led by Tech Mahindra; Rcom jumps 4%, PSU banks drag",https://www.moneycontrol.com/news/business/market-update-nifty-it-outperforms-led-by-tech-mahindra-rcom-jumps-4-psu-banks-drag-2577669.html
358,"Market Update: HPCL, BPCL along with pharma stocks propel Nifty higher; Tech Mahindra falls 4%",https://www.moneycontrol.com/news/business/market-update-hpcl-bpcl-along-with-pharma-stocks-propel-nifty-higher-tech-mahindra-falls-4-2577053.html
359,"Market Update: Oil & gas, pharma stocks rally as BPCL, Sun Pharma jump 5-6%; IT stocks drag",https://www.moneycontrol.com/news/business/market-update-oil-it-stocks-drag-2576837.html
360,What should investors do with Tech Mahindra post stellar Q4 results?,https://www.moneycontrol.com/news/business/stocks/what-should-investors-do-with-tech-mahindra-post-stellar-q4-results-2576849.html
361,"Buy Tech Mahindra, target Rs 770: Hadrien Mendonca",https://www.moneycontrol.com/news/business/buy-tech-mahindra-target-rs-770-hadrien-mendonca-2575817.html
362,Nifty entering consolidation phase; Bank Nifty should outperform in near-term,https://www.moneycontrol.com/news/business/nifty-entering-consolidation-phase-bank-nifty-should-outperform-in-near-term-2572045.html
363,"Buy or sell: Top stock trading ideas by Dinesh Rohira, Prakash Gaba & Rajesh Agarwal for May 21",https://www.moneycontrol.com/news/business/buy-or-sell-top-stock-trading-ideas-by-dinesh-rohira-prakash-gaba-rajesh-agarwal-for-may-21-2572047.html
364,"Market Update: Banks gain with ICICI Bank up 1%, Tech Mahindra top gainer; Federal Bank plunges 11%",https://www.moneycontrol.com/news/business/market-update-banks-gain-with-icici-bank-up-1-tech-mahindra-top-gainer-federal-bank-plunges-11-2565897.html
365,"Market Update: IT, metal stocks outshine led by Tech Mahindra, Hindalco; Sintex zooms 10%, HPCL, BPCL drag",https://www.moneycontrol.com/news/business/market-update-it-metal-stocks-outshine-led-by-tech-mahindra-hindalco-sintex-zooms-10-hpcl-bpcl-drag-2565207.html
366,Nifty may see intraday buying on dips ahead of F&O expiry; Buy Tech Mahindra for short term,https://www.moneycontrol.com/news/business/buy-nifty-on-dips-today-tech-mahindra-for-the-short-term-2557549.html
367,"Market Update: RIL gains 2%, keeps Nifty in green as metal stocks drag led by Hindalco, JSPL; GATI zooms 17%",https://www.moneycontrol.com/news/business/market-update-ril-gains-2-keeps-nifty-in-green-as-metal-stocks-drag-led-by-hindalco-jspl-gati-zooms-17-2555557.html
368,Tech Mahindra sets up'Cyber Security Operations Centre in Andhra Pradesh,https://www.moneycontrol.com/news/business/tech-mahindra-sets-upcyber-security-operations-centre-in-andhra-pradesh-2555223.html
369,Nifty could see pressure at higher levels; Top six stocks which are looking attractive,https://www.moneycontrol.com/news/business/nifty-could-see-pressure-at-higher-levels-top-six-stocks-which-are-looking-attractive-2548917.html
