,Headlines,Links
0,Tech Mahindra to acquire 26% stake in Huoban Energy for Rs 1.60 crore,https://www.moneycontrol.com/news/business/tech-mahindra-to-acquire-26-stake-in-huoban-energy-for-rs-1-60-crore-8661151.html
1,Top 10 trading ideas from experts for next 3-4 weeks as bulls lock horns with bears,https://www.moneycontrol.com/news/business/markets/top-10-trading-ideas-from-experts-for-next-3-4-weeks-as-bulls-lock-horns-with-bears-8601091.html
2,"Infosys CEO Salil Parekh to earn $10.2 million a year; how does his salary compare to chief executives at Accenture, Cognizant and IBM?",https://www.moneycontrol.com/news/trends/it/infosys-ceo-salil-parekh-to-earn-10-2-million-a-year-how-does-his-salary-compare-to-chief-executives-at-accenture-cognizant-and-ibm-8593091.html
3,Buy Tech Mahindra; target of Rs 1372: Geojit,https://www.moneycontrol.com/news/business/stocks/buy-tech-mahindra-target-of-rs-1372-geojit-8532281.html
4,JP Morgan downgrades Indian IT services sector to underweight,https://www.moneycontrol.com/news/business/earnings/jp-morgan-downgrades-indian-it-services-sector-to-underweight-8536201.html
5,Buy Tech Mahindra: target of Rs 1650: Sharekhan,https://www.moneycontrol.com/news/business/stocks/buy-tech-mahindra-target-of-rs-1650-sharekhan-2-8522791.html
6,Buy Tech Mahindra; target of Rs 1447: KR Choksey,https://www.moneycontrol.com/news/business/stocks/buy-tech-mahindra-target-of-rs-1447-kr-choksey-8522971.html
7,"After committing $955 million on buys, Tech Mahindra to focus on integrating companies",https://www.moneycontrol.com/news/business/after-committing-955-million-on-buys-tech-mahindra-to-focus-on-integrating-companies-8522831.html
8,Neutral Tech Mahindra; target of Rs 1250: Motilal Oswal,https://www.moneycontrol.com/news/business/stocks/neutral-tech-mahindra-target-of-rs-1250-motilal-oswal-8514431.html
9,Buy Tech Mahindra; target of Rs 1410: ICICI Direct,https://www.moneycontrol.com/news/business/stocks/buy-tech-mahindra-target-of-rs-1410-icici-direct-8517141.html
10,"Tech Mahindra Consolidated March 2022 Net Sales at Rs 12,116.28 crore, up 24.53% Y-o-Y",https://www.moneycontrol.com/news/business/earnings/tech-mahindra-consolidated-march-2022-net-sales-at-rs-12116-28-crore-up-24-53-y-o-y-8514541.html
11,"What should investors do with Tech Mahindra post Q4 earnings: Buy, sell or hold?",https://www.moneycontrol.com/news/business/stocks/what-should-investors-do-with-tech-mahindra-post-q4-earnings-buy-sell-or-hold-8511831.html
12,Tech Mahindra – Attractively valued with a great outlook,https://www.moneycontrol.com/news/business/stocks/tech-mahindra-attractively-valued-with-a-great-outlook-8512231.html
13,"Tech Mahindra Standalone March 2022 Net Sales at Rs 9,318.90 crore, up 24.14% Y-o-Y",https://www.moneycontrol.com/news/business/earnings/tech-mahindra-standalone-march-2022-net-sales-at-rs-9318-90-crore-up-24-14-y-o-y-8513481.html
14,Buy Tech Mahindra: target of Rs 1650: Sharekhan,https://www.moneycontrol.com/news/business/stocks/buy-tech-mahindra-target-of-rs-1650-sharekhan-8505751.html
15,"Tech Mahindra clocks best revenue growth in seven years, Gurnani reappointed CEO till December 2023",https://www.moneycontrol.com/news/business/companies/tech-mahindra-clocks-best-growth-in-seven-years-gurnani-reappointed-ceo-till-december-2023-8504991.html
16,"Trade Spotlight | What should you do with ABB India, Tech Mahindra, Dixon Technologies on Friday?",https://www.moneycontrol.com/news/business/markets/trade-spotlight-what-should-you-do-with-abb-india-tech-mahindra-dixon-technologies-on-friday-8459771.html
17,"Tech Mahindra to create 1,000 jobs in UK",https://www.moneycontrol.com/news/business/tech-mahindra-to-create-1000-jobs-in-uk-8397491.html
18,Storyboard18 | What’s common between HR & Marketing? TechM’s global CPO & marketing chief explains,https://www.moneycontrol.com/news/trends/features/storyboard18-whats-common-between-hr-marketing-techms-global-cpo-marketing-chief-explains-8377571.html
19,"Tech Mahindra Q4 PAT seen up 5.9% QoQ to Rs. 1,470.2 cr: Prabhudas Lilladher",https://www.moneycontrol.com/news/business/tech-mahindra-q4-pat-seen-up-5-9-qoq-to-rs-1470-2-cr-prabhudas-lilladher-8356141.html
20,"Bharti Airtel, Tech Mahindra team up for digital solutions across 5G, private networks, cloud",https://www.moneycontrol.com/news/business/bharti-airtel-tech-mahindra-team-up-for-digital-solutions-across-5g-private-networks-cloud-8301081.html
21,"Anand Mahindra is in metaverse, unveils 'SimpliCity'. Watch",https://www.moneycontrol.com/news/trends/anand-mahindra-is-in-metaverse-unveils-simplicity-watch-8296141.html
22,"Mahindra & Mahindra enters NFT universe, first tranche of tokens to be based on Thar SUV",https://www.moneycontrol.com/news/automobile/mahindra-mahindra-enters-nft-universe-first-tranche-of-tokens-to-be-based-on-thar-suv-8275661.html
23,Tech Mahindra to acquire 100% stake in Thirdware Solutions for $42 million,https://www.moneycontrol.com/news/business/mergers-acquisitions/tech-mahindra-to-acquire-100-stake-in-thirdware-solutions-for-42-million-8224601.html
24,"Hot Stocks | Here is why you should buy Tech Mahindra, sell Bajaj Finance in short term",https://www.moneycontrol.com/news/business/markets/hot-stocks-here-is-why-you-should-buy-tech-mahindra-sell-bajaj-finance-in-short-term-8195871.html
25,"Axis Securities picks 7 large-caps, 5 midcaps, 4 small-caps after Ukraine-Russia-led correction",https://www.moneycontrol.com/news/business/markets/axis-securities-picks-7-large-caps-5-midcaps-4-small-caps-after-ukraine-russia-led-correction-8189111.html
26,Tech Mahindra announces its entry into metaverse with the launch of TechMVerse,https://www.moneycontrol.com/news/business/tech-mahindra-announces-its-entry-into-metaverse-with-the-launch-of-techmverse-8174671.html
27,Top 10 trading ideas by experts for March series that start on positive note,https://www.moneycontrol.com/news/business/markets/top-10-trading-ideas-by-experts-for-march-series-that-start-on-positive-note-8171361.html
28,Permanent work from home roles emerge as a favourite with Indian jobseekers: Naukri,https://www.moneycontrol.com/news/business/companies/permanent-work-from-home-roles-emerge-as-a-favourite-with-indian-jobseekers-naukri-8098491.html
29,Buy Tech Mahindra target of Rs 1724: Geojit,https://www.moneycontrol.com/news/business/stocks/buy-tech-mahindra-target-of-rs-1724-geojit-8052641.html
30,Weekly Tactical Pick: Tech Mahindra,https://www.moneycontrol.com/news/trends/it/weekly-tactical-pick-tech-mahindra-3-8037921.html
31,Buy Tech Mahindra: target of Rs 2060: Sharekhan,https://www.moneycontrol.com/news/business/stocks/buy-tech-mahindra-target-of-rs-2060-sharekhan-3-8033771.html
32,Neutral Tech Mahindra; target of Rs 1600: Motilal Oswal,https://www.moneycontrol.com/news/business/stocks/neutral-tech-mahindra-target-of-rs-1600-motilal-oswal-8033901.html
33,Buy Tech Mahindra; target of Rs 1900: Emkay Global Financial,https://www.moneycontrol.com/news/business/stocks/buy-tech-mahindra-target-of-rs-1900-emkay-global-financial-8034341.html
34,Buy Tech Mahindra; target of Rs 1942: Prabhudas Lilladher,https://www.moneycontrol.com/news/business/stocks/buy-tech-mahindra-target-of-rs-1942-prabhudas-lilladher-8034831.html
35,Buy Tech Mahindra; target of Rs 1850: ICICI Direct,https://www.moneycontrol.com/news/business/buy-tech-mahindra-target-of-rs-1850-icici-direct-8033851.html
36,Ideas For Profit | Tech Mahindra: Soft Q3 provides opportunity to buy stock & ride tech super-cycle,https://www.moneycontrol.com/news/business/technicals/ideas-for-profit-tech-mahindra-soft-q3-provides-opportunity-to-buy-stock-ride-tech-super-cycle-8028421.html
37,"Tech Mahindra after Q3 results: Should investors buy, sell or hold the stock?",https://www.moneycontrol.com/news/business/stocks/tech-mahindra-after-q3-results-should-investors-buy-sell-or-hold-the-stock-8023901.html
38,"Tech Mahindra to hire 15,000 freshers in FY23",https://www.moneycontrol.com/news/business/tech-mahindra-to-hire-15000-freshers-in-fy23-8022411.html
39,"Tech Mahindra Consolidated December 2021 Net Sales at Rs 11,450.80 crore, up 18.7% Y-o-Y",https://www.moneycontrol.com/news/business/earnings/tech-mahindra-consolidated-december-2021-net-sales-at-rs-11450-80-crore-up-18-7-y-o-y-8023451.html
40,"Tech Mahindra Standalone December 2021 Net Sales at Rs 9,010.80 crore, up 19.11% Y-o-Y",https://www.moneycontrol.com/news/business/earnings/tech-mahindra-standalone-december-2021-net-sales-at-rs-9010-80-crore-up-19-11-y-o-y-8023231.html
41,"Tech Mahindra Q3 preview | M&A deals, strong demand to boost sales by 2.3% QoQ",https://www.moneycontrol.com/news/business/earnings/tech-mahindra-q3-preview-ma-deals-strong-demand-to-boost-sales-by-2-3-qoq-8010171.html
42,"TCS 2nd most valuable IT services brand globally, 5 others in top 25 tally: Brand Finance",https://www.moneycontrol.com/news/business/tcs-2nd-most-valuable-it-services-brand-globally-5-others-in-top-25-tally-brand-finance-7993331.html
43,Tech Mantra -- Tech Mahindra’s M&A spree: Careful or overzealous?,https://www.moneycontrol.com/news/opinion/tech-mantra-tech-mahindras-ma-spree-careful-or-overzealous-7990751.html
44,Top 10 trading ideas for next 3-4 weeks as bears tighten control over Dalal Street,https://www.moneycontrol.com/news/business/markets/top-10-trading-ideas-for-next-3-4-weeks-as-bears-tighten-control-over-dalal-street-7971591.html
45,Neutral Tech Mahindra; target of Rs 1910: Motilal Oswal,https://www.moneycontrol.com/news/business/stocks/neutral-tech-mahindra-target-of-rs-1910-motilal-oswal-7952091.html
46,Buy Tech Mahindra: target of Rs 2060: Sharekhan,https://www.moneycontrol.com/news/business/stocks/buy-tech-mahindra-target-of-rs-2060-sharekhan-2-7951981.html
47,Buy Tech Mahindra; target of Rs 1930: Emkay Global Financial,https://www.moneycontrol.com/news/business/stocks/buy-tech-mahindra-target-of-rs-1930-emkay-global-financial-7951701.html
48,Buy Tech Mahindra; target of Rs 1945: Prabhudas Lilladher,https://www.moneycontrol.com/news/business/stocks/buy-tech-mahindra-target-of-rs-1945-prabhudas-lilladher-7951511.html
49,Tech Mahindra share price gains on acquisition announcement; brokerages maintain 'buy',https://www.moneycontrol.com/news/business/stocks/tech-mahindra-share-price-gains-on-acquisition-announcement-brokerages-maintain-buy-7950131.html
50,CTC acquisition adds a feather to Tech Mahindra’s cap,https://www.moneycontrol.com/news/business/moneycontrol-research/ctc-acquisition-adds-a-feather-to-tech-mahindras-cap-7950301.html
51,Tech Mahindra acquires European tech firm for EUR 310 million,https://www.moneycontrol.com/news/business/tech-mahindra-acquires-european-tech-firm-for-eur-310-million-7948541.html
52,Tech Mahindra partners Pyze to provide enterprise modernization solutions,https://www.moneycontrol.com/news/business/tech-mahindra-and-pyze-partner-to-provide-enterprise-modernization-solutions-7919481.html
53,"Tech Mahindra Q3 PAT seen up 5% QoQ to Rs. 1,405.7 cr: ICICI Direct",https://www.moneycontrol.com/news/business/earnings/tech-mahindra-q3-pat-seen-up-5-qoq-to-rs-1405-7-cr-icici-direct-7905951.html
54,IT Q3 Preview | Healthy topline likely despite seasonal factor; midcaps may outperform largecaps,https://www.moneycontrol.com/news/business/earnings/it-q3-preview-healthy-revenue-growth-likely-despite-seasonal-factor-midcaps-to-outperform-large-caps-7894961.html
55,"Tech Mahindra to acquire 100% stake in Allyis India, Green Investments",https://www.moneycontrol.com/news/business/tech-mahindra-to-acquire-100-stake-in-allyis-india-green-investments-7886151.html
56,Buy Tech Mahindra; target of Rs 2150: ICICI Direct,https://www.moneycontrol.com/news/business/stocks/buy-tech-mahindra-target-of-rs-2150-icici-direct-7875081.html
57,Buy Tech Mahindra: target of Rs 2060: Sharekhan,https://www.moneycontrol.com/news/business/stocks/buy-tech-mahindra-target-of-rs-2060-sharekhan-7874471.html
58,"Hot Stocks | Double-digit returns likely in Tech Mahindra, HCL Technologies, MMTC in short term",https://www.moneycontrol.com/news/business/markets/hot-stocks-double-digit-returns-likely-in-tech-mahindra-hcl-technologies-mmtc-in-short-term-7859381.html
59,Tech Mahindra acquires 100% stake in Activus Connect,https://www.moneycontrol.com/news/business/tech-mahindra-acquires-100-stake-in-activus-connect-7790011.html
60,Brokerages expect up to 21% upside in Tech Mahindra despite concerns over rising hiring costs,https://www.moneycontrol.com/news/business/stocks/brokerages-expect-up-to-21-upside-in-tech-mahindra-despite-concerns-over-rising-hiring-costs-7783761.html
61,Dow Jones Sustainability World Index 2021: Tech Mahindra emerges as global IT leader,https://www.moneycontrol.com/news/business/dow-jones-sustainability-world-index-2021-tech-mahindra-emerges-as-global-it-leader-7732281.html
62,Buy Tech Mahindra; target of Rs 1862: Prabhudas Lilladher,https://www.moneycontrol.com/news/business/stocks/buy-tech-mahindra-target-of-rs-1862-prabhudas-lilladher-2-7721831.html
63,Buy Tech Mahindra; target of Rs 1870: Emkay Global Financial,https://www.moneycontrol.com/news/business/stocks/buy-tech-mahindra-target-of-rs-1870-emkay-global-financial-2-7721581.html
64,Neutral Tech Mahindra; target of Rs 1640: Motilal Oswal,https://www.moneycontrol.com/news/business/stocks/neutral-tech-mahindra-target-of-rs-1640-motilal-oswal-7720881.html
65,"Trade Spotlight | What should you do with InterGlobe, Sheela Foam, ICICI Prudential, Tech Mahindra stocks?",https://www.moneycontrol.com/news/business/markets/trade-spotlight-what-should-you-do-with-interglobe-sheela-foam-icici-prudential-tech-mahindra-stocks-7718241.html
66,Moneycontrol Pro Panorama | Numbers add up as TechM gets into reboot mode,https://www.moneycontrol.com/news/opinion/moneycontrol-pro-panorama-numbers-add-up-as-techm-gets-into-reboot-mode-7631381.html
67,Buy Tech Mahindra target of Rs 1862: Prabhudas Lilladher,https://www.moneycontrol.com/news/business/stocks/buy-tech-mahindra-target-of-rs-1862-prabhudas-lilladher-7631191.html
68,Buy Tech Mahindra; target of Rs 1870: Emkay Global Financial,https://www.moneycontrol.com/news/business/stocks/buy-tech-mahindra-target-of-rs-1870-emkay-global-financial-7630351.html
69,"Tech Mahindra Consolidated September 2021 Net Sales at Rs 10,881.35 crore, up 16.11% Y-o-Y",https://www.moneycontrol.com/news/business/earnings/tech-mahindra-consolidated-september-2021-net-sales-at-rs-10881-35-crore-up-16-11-y-o-y-2-7627631.html
70,"What should investors do with Tech Mahindra post Q2 earnings: Buy, sell or hold?",https://www.moneycontrol.com/news/business/stocks/what-should-investors-do-with-tech-mahindra-post-q2-earnings-buy-sell-or-hold-7626151.html
71,"Tech Mahindra Standalone September 2021 Net Sales at Rs 8,464.87 crore, up 14.32% Y-o-Y",https://www.moneycontrol.com/news/business/earnings/tech-mahindra-standalone-september-2021-net-sales-at-rs-8464-87-crore-up-14-32-y-o-y-2-7626801.html
72,"Tech Mahindra Consolidated September 2021 Net Sales at Rs 10,881.35 crore, up 16.11% Y-o-Y",https://www.moneycontrol.com/news/business/earnings/tech-mahindra-consolidated-september-2021-net-sales-at-rs-10881-35-crore-up-16-11-y-o-y-7625361.html
73,"Tech Mahindra Standalone September 2021 Net Sales at Rs 8,464.87 crore, up 14.32% Y-o-Y",https://www.moneycontrol.com/news/business/earnings/tech-mahindra-standalone-september-2021-net-sales-at-rs-8464-87-crore-up-14-32-y-o-y-7625251.html
74,"Tech Mahindra added 14,930 employees in Q2 FY22, attrition soared to 21%",https://www.moneycontrol.com/news/business/tech-mahindra-added-14930-employees-in-q2-fy22-attrition-soared-to-21-7624421.html
75,Tech Mahindra makes two acquisitions for $120 million to strengthen its digital portfolio,https://www.moneycontrol.com/news/business/tech-mahindra-makes-two-acquisitions-for-120-million-to-strengthen-its-digital-portfolio-7624271.html
76,"Tech Mahindra Q2 Result | Profit declines 1% QoQ to Rs 1,339 crore, revenue grows 6.7% to Rs 10,881 crore",https://www.moneycontrol.com/news/business/earnings/tech-mahindra-q2-result-profit-comes-in-at-rs-1338-7-crore-revenue-rs-10881-3-crore-7620511.html
77,Tech Mahindra shares trade lower ahead of Q2 earnings,https://www.moneycontrol.com/news/business/stocks/tech-mahindra-shares-trade-lower-ahead-of-q2-earnings-7621931.html
78,"Tech Mahindra Q2 Results Preview: Experts foresee 5% rise in topline, 3% in bottomline",https://www.moneycontrol.com/news/business/earnings/tech-mahindra-q2-results-preview-experts-foresee-5-rise-in-topline-3-in-bottomline-7620211.html
79,Results preview | What’s in store for ICICI Bank & Tech Mahindra’s Q2 report card?,https://www.moneycontrol.com/news/business/results-preview-whats-in-store-for-icici-bank-tech-mahindras-q2-report-card-7615031.html
80,"Tech Mahindra Q2 PAT may dip 1.3% QoQ to Rs. 1,335 cr: Prabhudas Lilladher",https://www.moneycontrol.com/news/business/tech-mahindra-q2-pat-may-dip-1-3-qoq-to-rs-1335-cr-prabhudas-lilladher-7546301.html
81,Tech Mahindra to acquire Beris Consulting for around Rs 60 crore,https://www.moneycontrol.com/news/business/tech-mahindra-to-acquire-beris-consulting-for-around-rs-60-crore-7533361.html
82,"Trade Spotlight: What should investors do with Zee Entertainment, NDTV, DLF, and Tech Mahindra?",https://www.moneycontrol.com/news/business/markets/trade-spotlight-what-should-investors-do-with-zee-entertainment-ndtv-dlf-and-tech-mahindra-7496441.html
83,"Bajar Gupshup | Benchmarks end at record closing highs; IT, telecom in the lead",https://www.moneycontrol.com/news/business/markets/bajar-gupshup-benchmarks-end-at-record-closing-highs-it-telecom-in-the-lead-7471451.html
84,Here is why IT firm Tech Mahindra is betting on the COVID-19 therapeutic drug,https://www.moneycontrol.com/news/business/here-is-why-it-firm-tech-mahindra-is-betting-on-the-covid-19-therapeutic-drug-7356931.html
85,Buy Tech Mahindra; target of Rs 1375: ICICI Direct,https://www.moneycontrol.com/news/business/earnings/buy-tech-mahindra-target-of-rs-1375-icici-direct-7281081.html
86,Buy Tech Mahindra: target of Rs 1300: Sharekhan,https://www.moneycontrol.com/news/business/earnings/buy-tech-mahindra-target-of-rs-1300-sharekhan-7261311.html
87,Ideas For Profit | Tech Mahindra,https://www.moneycontrol.com/news/business/earnings/ideas-for-profit-tech-mahindra-robust-outlook-undemanding-valuation-make-the-stock-attractive-7252981.html
88,"What should investors do with Tech Mahindra post Q1 results: buy, sell or hold?",https://www.moneycontrol.com/news/business/stocks/what-should-investors-do-with-tech-mahindra-post-q1-results-buy-sell-or-hold-7249521.html
89,"Tech Mahindra Standalone June 2021 Net Sales at Rs 7,931.50 crore, up 10.7% Y-o-Y",https://www.moneycontrol.com/news/business/earnings/tech-mahindra-standalone-june-2021-net-sales-at-rs-7931-50-crore-up-10-7-y-o-y-7248921.html
90,"Tech Mahindra Consolidated June 2021 Net Sales at Rs 10,197.60 crore, up 11.98% Y-o-Y",https://www.moneycontrol.com/news/business/earnings/tech-mahindra-consolidated-june-2021-net-sales-at-rs-10197-60-crore-up-11-98-y-o-y-7248941.html
91,"Tech Mahindra adds 5,200 employees in Q1 FY22, vaccinates 80% staff",https://www.moneycontrol.com/news/business/tech-mahindra-adds-5200-employees-in-q1-fy22-vaccinates-80-staff-7247211.html
92,"Tech Mahindra Q1 results: Net profit jumps 30.8% to Rs 1,353.2 crore; constant currency revenue growth at 3.9%",https://www.moneycontrol.com/news/business/earnings/tech-mahindra-q1-results-net-profit-jumps-30-8-to-rs-1353-2-crore-constant-currency-revenue-growth-at-3-9-7246621.html
93,Tech Mahindra share price edges higher ahead of Q1 results,https://www.moneycontrol.com/news/business/stocks/tech-mahindra-share-price-edges-higher-ahead-of-q1-results-7244501.html
94,Will Tech Mahindra underperform other IT giants in Q1FY22?,https://www.moneycontrol.com/news/business/companies/will-tech-mahindra-underperform-other-it-giants-in-q1-7238781.html
95,Buy Tech Mahindra target of Rs 1237: Prabhudas Lilladher,https://www.moneycontrol.com/news/business/stocks/buy-tech-mahindra-target-of-rs-1237-prabhudas-lilladher-7214361.html
96,"Bajar Gupshup | Markets bounce back aided by metal, power, IT & realty stocks",https://www.moneycontrol.com/news/business/markets/bajar-gupshup-markets-bounce-back-aided-by-metal-power-it-realty-stocks-7208891.html
97,"Bajar Gupshup | Benchmarks end nearly 1% lower; bank, metal & pharma top drags",https://www.moneycontrol.com/news/business/markets/bajar-gupshup-benchmarks-end-nearly-1-lower-bank-metal-pharma-top-drags-7146691.html
98,Tech Mahindra partners StaTwig for blockchain-based traceability solution for vaccine supply chain,https://www.moneycontrol.com/news/business/tech-mahindra-partners-statwig-for-blockchain-based-traceability-solution-for-vaccine-supply-chain-7129031.html
99,"IT Q1 FY22 earnings preview: Experts see robust revenue growth, but wage revision, tight labour market may dent margin",https://www.moneycontrol.com/news/business/earnings/it-q1-fy22-earnings-preview-experts-see-robust-revenue-growth-but-wage-revision-tight-labour-market-may-dent-margin-7126201.html
100,"Tech Mahindra plans acquisition in Europe, hire 250 people in Nordic region in 2 years",https://www.moneycontrol.com/news/business/tech-mahindra-plans-acquisition-in-europe-hire-250-people-in-nordic-region-in-2-yrs-7011591.html
101,"Tech Mahindra rolls out COVID-19 vaccination drive for employees, dependents aged above 18 years",https://www.moneycontrol.com/news/india/tech-mahindra-rolls-out-covid-19-vaccination-drive-for-employees-dependents-aged-above-18-years-6922511.html
102,Buy Tech Mahindra target of Rs 1132: Prabhudas Lilladher,https://www.moneycontrol.com/news/business/stocks/buy-tech-mahindra-target-of-rs-1132-prabhudas-lilladher-6919121.html
103,Buy Tech Mahindra; target of Rs 1120: ICICI Direct,https://www.moneycontrol.com/news/business/stocks/buy-tech-mahindra-target-of-rs-1120-icici-direct-2-6912811.html
104,Buy Tech Mahindra; target of Rs 1060: Dolat Capital Market,https://www.moneycontrol.com/news/business/stocks/buy-tech-mahindra-target-of-rs-1060-dolat-capital-market-6892501.html
105,Tech Mahindra sets up COVID care unit at Hinjewadi-Pune facility,https://www.moneycontrol.com/news/coronavirus/tech-mahindra-sets-up-covid-care-unit-in-hinjewadi-pune-facility-6889401.html
106,Buy Tech Mahindra: target of Rs 1150: Sharekhan,https://www.moneycontrol.com/news/business/stocks/buy-tech-mahindra-target-of-rs-1150-sharekhan-2-6887401.html
107,"Q4 revenue miss only a blip for IT industry, indicators point to a better future",https://www.moneycontrol.com/news/business/earnings/q4-revenue-miss-only-a-blip-for-it-industry-indicators-point-to-a-better-future-6880841.html
108,"Tech Mahindra Consolidated March 2021 Net Sales at Rs 9,729.90 crore, up 2.53% Y-o-Y",https://www.moneycontrol.com/news/business/earnings/tech-mahindra-consolidated-march-2021-net-sales-at-rs-9729-90-crore-up-2-53-y-o-y-6830271.html
109,"Tech Mahindra Standalone March 2021 Net Sales at Rs 7,506.80 crore, down 0.86% Y-o-Y",https://www.moneycontrol.com/news/business/earnings/tech-mahindra-standalone-march-2021-net-sales-at-rs-7506-80-crore-down-0-86-y-o-y-6829721.html
110,Tech Mahindra bucked IT sector hiring trends in FY21,https://www.moneycontrol.com/news/opinion/tech-mahindra-bucked-it-sector-hiring-trends-in-fy21-6824281.html
111,"Ideas For Profit | Robust outlook, attractive valuation position Tech Mahindra as a value buy",https://www.moneycontrol.com/news/business/earnings/ideas-for-profit-robust-outlook-attractive-valuation-position-tech-mahindra-as-a-value-buy-6823401.html
112,"What should investors do with Tech Mahindra after Q4 numbers: buy, sell or hold?",https://www.moneycontrol.com/news/business/stocks/what-should-investors-do-with-tech-mahindra-after-q4-numbers-buy-sell-or-hold-6819991.html
113,Tech Mahindra to acquire Eventus Solutions Group for up to $44 million,https://www.moneycontrol.com/news/business/tech-mahindra-to-acquire-eventus-solutions-group-for-up-to-44-million-6819491.html
114,"Tech Mahindra headcount declines by 4,000 in FY21, to accelerate pace of hiring in FY22",https://www.moneycontrol.com/news/business/tech-mahindra-headcount-decline-by-4000-in-fy21-to-accelerate-pace-of-hiring-in-fy22-6818711.html
115,"Tech Mahindra Q4 profit falls 17.4% to Rs 1,081.4 crore, revenue grows at 0.9%",https://www.moneycontrol.com/news/business/earnings/tech-mahindra-q4-profit-falls-17-4-to-rs-1081-4-crore-revenue-grows-at-0-9-6817951.html
116,Tech Mahindra Q4 Preview: Weaker deal wins than peers could impact revenue growth,https://www.moneycontrol.com/news/business/earnings/tech-mahindra-q4-preview-weaker-deal-wins-than-peers-could-impact-revenue-growth-6813371.html
117,Tech Mahindra joins league of 1.5°C supply chain leaders to reduce greenhouse gas emissions,https://www.moneycontrol.com/news/business/tech-mahindra-joins-league-of-1-5c-supply-chain-leaders-to-reduce-greenhouse-gas-emissions-6802521.html
118,Tech Mahindra acquires DigitalOnUs for $120 million,https://www.moneycontrol.com/news/business/tech-mahindra-acquires-digitalonus-for-120-million-6792721.html
119,Larsen & Toubro Infotech appoints Anil Rander as new CFO,https://www.moneycontrol.com/news/business/companies/larsen-toubro-infotech-appoints-anil-rander-as-new-cfo-6772831.html
120,"Rajasthan Royals collaborates with Tech Mahindra to monetise, build on fan loyalty",https://www.moneycontrol.com/news/technology/rajasthan-royals-collaborates-with-tech-mahindra-to-monetise-build-on-fan-loyalty-6763621.html
121,"Tech Mahindra Q4 PAT seen up 2.3% QoQ to Rs 1,340.4 cr: KRChoksey",https://www.moneycontrol.com/news/business/tech-mahindra-q4-pat-seen-up-2-3-qoq-to-rs-1340-4-cr-krchoksey-6741791.html
122,"Tech Mahindra Q4 PAT seen up 1.4% QoQ to Rs 9,782.3 cr: Prabhudas Lilladher",https://www.moneycontrol.com/news/business/tech-mahindra-q4-pat-seen-up-1-4-qoq-to-rs-9782-3-cr-prabhudas-lilladher-6739701.html
