,Headlines,Links
490,Buy Tech Mahindra; target of Rs 465: Motilal Oswal,https://www.moneycontrol.com/news/business/buy-tech-mahindra-target-of-rs-465-motilal-oswal-2315643.html
491,Nifty may remain volatile ahead of expiry; 4 stocks to pick today: Prakash Gaba,https://www.moneycontrol.com/news/business/nifty-may-remain-volatile-ahead-of-expiry-4-stocks-to-pick-today-prakash-gaba-2312205.html
492,Tech Mahindra unit to sell LLC Pak stake for $5.2 mn,https://www.moneycontrol.com/news/business/companies/tech-mahindra-unit-to-sell-llc-pak-stake-for-5-2-mn-2309493.html
493,Crucial support for Nifty at 9620; 4 stocks to buy today: Prakash Gaba,https://www.moneycontrol.com/news/business/crucial-support-for-nifty-at-9620-4-stocks-to-buy-today-prakash-gaba-2308813.html
494,Conviction Buys! Top 22 stocks where fund managers hold more than 2% in portfolio,https://www.moneycontrol.com/news/business/stocks/conviction-buys-top-22-stocks-where-fund-managers-hold-more-than-2-in-portfolio-2306501.html
495,"Buy Max Financial, BGR Energy, KEC Intl; hold Avenue Supermarts: Ashwani Gujral",https://www.moneycontrol.com/news/business/buy-max-financial-bgr-energy-kec-intl-hold-avenue-supermarts-ashwani-gujral-2306017.html
496,"Buy Balaji Telefilms on dips, says Ashwani Gujral",https://www.moneycontrol.com/news/business/stocks/buy-balaji-telefilms-on-dips-says-ashwani-gujral-2302791.html
497,IT cos look to allay fears as employees dread job loss,https://www.moneycontrol.com/news/trends/it/it-cos-look-to-allay-fears-as-employees-dread-job-loss-2302521.html
498,Six in Sixty: Stocks you should keep on your radar,https://www.moneycontrol.com/news/business/stocks/six-in-sixty-stocks-you-should-keep-on-your-radar-53-2302239.html
499,"Why tech companies like Microsoft, Bosch are rushing to open startup accelerators in India?",https://www.moneycontrol.com/news/business/startup/why-tech-companies-like-microsoft-bosch-are-rushing-to-open-startup-accelerators-in-india-2301181.html
500,Six in Sixty: Stocks you should keep on your radar,https://www.moneycontrol.com/news/business/stocks/six-in-sixty-stocks-you-should-keep-on-your-radar-52-2301043.html
501,"Buy RIL on dips, see tailwind in tyre stocks: Ashwani Gujral",https://www.moneycontrol.com/news/business/buy-ril-on-dips-see-tailwind-in-tyre-stocks-ashwani-gujral-2300775.html
502,Hold Tech Mahindra; target of Rs 431: Axis Direct,https://www.moneycontrol.com/news/business/stocks/hold-tech-mahindra-target-of-rs-431-axis-direct-2298947.html
503,"Indiabulls Housing can climb to Rs 1180, Tech Mahindra Rs 411: Prakash Gaba",https://www.moneycontrol.com/news/business/indiabulls-housing-can-climb-to-rs-1180-tech-mahindra-rs-411-prakash-gaba-2297275.html
504,Sun Pharma & Tech Mahindra: Should you be catching these falling knives?,https://www.moneycontrol.com/news/opinion/sun-pharma-tech-mahindra-should-you-be-catching-these-falling-knives-2294213.html
505,Buy Tech Mahindra; target of Rs 473: KR Choksey,https://www.moneycontrol.com/news/business/stocks/buy-tech-mahindra-target-of-rs-473-kr-choksey-2293591.html
506,FITE petitions Labour Commissioner over Tech Mahindra layoff,https://www.moneycontrol.com/news/business/fite-petitions-labour-commissioner-over-tech-mahindra-layoff-2293465.html
507,"Buy Motherson Sumi, HDFC; sell Reliance Power: Ashwani Gujral",https://www.moneycontrol.com/news/business/buy-motherson-sumi-hdfc-sell-reliance-power-ashwani-gujral-2292207.html
508,Buy Tech Mahindra; target of Rs 490: ICICI Direct,https://www.moneycontrol.com/news/business/stocks/buy-tech-mahindra-target-of-rs-490-icici-direct-2291827.html
509,Buy Tech Mahindra; target of Rs 563: Edelweiss,https://www.moneycontrol.com/news/business/stocks/buy-tech-mahindra-target-of-rs-563-edelweiss-2291463.html
510,"Tech Mahindra can see lower levels, says Prakash Gaba",https://www.moneycontrol.com/news/business/tech-mahindra-can-see-lower-levels-says-prakash-gaba-2291627.html
511,Six in Sixty: Stocks you should keep on your radar,https://www.moneycontrol.com/news/business/stocks/six-in-sixty-stocks-you-should-keep-on-your-radar-46-2291587.html
512,Sustainable margins for Tech Mahindra will be 12-14%: Elara's Ravi Menon,https://www.moneycontrol.com/news/business/stocks/sustainable-margins-for-tech-mahindra-will-be-12-14-elaras-ravi-menon-2291323.html
513,"Tech Mahindra at 43-month low, plummets 17% post poor Q4 results",https://www.moneycontrol.com/news/business/stocks/tech-mahindra-plummets-12-post-poor-q4-results-2291185.html
514,'Top Indian IT cos will lead in digital business',https://www.moneycontrol.com/news/business/top-indian-it-cos-will-lead-in-digital-business-2291135.html
515,"Buy Tata Consultancy Services, Tech Mahindra: Mitessh Thakkar",https://www.moneycontrol.com/news/business/buy-tata-consultancy-services-tech-mahindra-mitessh-thakkar-2288635.html
516,"Buy Tech Mahindra, Yes Bank; sell Tata Steel: Yogesh Mehta",https://www.moneycontrol.com/news/business/buy-tech-mahindra-yes-bank-sell-tata-steel-yogesh-mehta-2287543.html
517,"Infosys, TCS, Tech Mahindra, Wipro to get astrological support: Satish Gupta",https://www.moneycontrol.com/news/business/infosys-tcs-tech-mahindra-wipro-to-get-astrological-support-satish-gupta-2287385.html
518,"Buy Marico; sell Tech Mahindra, Crompton Greaves: Ashwani Gujral",https://www.moneycontrol.com/news/business/buy-marico-sell-tech-mahindra-crompton-greaves-ashwani-gujral-2285371.html
519,"Buy Fortis Healthcare; sell Tech Mahindra, Muthoot Finance: Ashwani Gujral",https://www.moneycontrol.com/news/business/buy-fortis-healthcare-sell-tech-mahindra-muthoot-finance-ashwani-gujral-2284089.html
520,"Buy Marico, ITC, bullish on Tata Steel, BoB; sell UPL: Sandeep Wagle",https://www.moneycontrol.com/news/business/buy-marico-itc-bullish-on-tata-steel-bob-sell-upl-sandeep-wagle-2283901.html
521,"Wipro, Hexaware, Infosys, TCS, HCL Tech to get astrological support: Satish Gupta",https://www.moneycontrol.com/news/business/wipro-hexaware-infosys-tcs-hcl-tech-to-get-astrological-support-satish-gupta-2282663.html
522,"Buy NIIT, HUL; sell Yes Bank, Tech Mahindra, Cummins India: Ashwani Gujral",https://www.moneycontrol.com/news/business/buy-niit-hul-sell-yes-bank-tech-mahindra-cummins-india-ashwani-gujral-2282423.html
523,"Buy Bharat Financial, Engineers India, ICICI Bank, Tech Mahindra: Mitessh Thakkar",https://www.moneycontrol.com/news/business/buy-bharat-financial-engineers-india-icici-bank-tech-mahindra-mitessh-thakkar-2278827.html
524,Entered into Top 20 global tech services brands: Tech Mahindra,https://www.moneycontrol.com/news/business/entered-into-top-20-global-tech-services-brands-tech-mahindra-2278815.html
525,"Resistance for bank Nifty at 22850; Tech Mahindra, Cipla bullish plays: Prakash Gaba",https://www.moneycontrol.com/news/business/resistance-for-bank-nifty-at-22850-tech-mahindra-cipla-bullish-plays-prakash-gaba-2278733.html
526,Bangalore techies in panic mode as IT companies shed workforce,https://www.moneycontrol.com/news/business/bangalore-techies-in-panic-mode-as-it-companies-shed-workforce-2277813.html
527,Buy Infosys; sell Asian Paints: Mitessh Thakkar,https://www.moneycontrol.com/news/business/buy-infosys-sell-asian-paints-mitessh-thakkar-2277443.html
528,Tech Mahindra to lay off 1500-2000 employees this quarter: Sources,https://www.moneycontrol.com/news/business/tech-mahindra-to-lay-off-1500-2000-employees-this-quarter-sources-2275903.html
529,Tech Mahindra Q4 PAT may dip 2% to Rs 841.4 cr: KR Choksey,https://www.moneycontrol.com/news/business/earnings/tech-mahindra-q4-pat-may-dip-2-to-rs-841-4-cr-kr-choksey-2262039.html
530,"Repurposing LCC as a software-defined network company, says TechM CEO",https://www.moneycontrol.com/news/business/acquisition-of-lcc-a-mistake-techm-to-prune-revenues-by-70-80-mn-2260211.html
531,TechM will try and grow faster than Nasscom growth rate: Gurnani,https://www.moneycontrol.com/news/business/techm-will-try-and-grow-faster-than-nasscom-growth-rate-gurnani-2260133.html
532,"Amid storm over Sikka's Panaya buy, TechM says self-developed similar solution cheaply",https://www.moneycontrol.com/news/business/amid-storm-over-sikkas-panaya-buy-techm-says-self-developed-similar-solution-cheaply-2260035.html
533,"Sell NMDC, Tech Mahindra; buy Muthoot Finance: Sudarshan Sukhani",https://www.moneycontrol.com/news/business/sell-nmdc-tech-mahindra-buy-muthoot-finance-sudarshan-sukhani-2258035.html
534,Six in Sixty: Stocks you should keep on your radar,https://www.moneycontrol.com/news/business/stocks/six-in-sixty-stocks-you-should-keep-on-your-radar-20-2257385.html
535,"Buy Jubilant Life, India Cements, PC Jeweller: Ashwani Gujral",https://www.moneycontrol.com/news/business/buy-jubilant-life-india-cements-pc-jeweller-ashwani-gujral-2248405.html
536,Six in Sixty: Stocks you should keep on your radar,https://www.moneycontrol.com/news/business/stocks/six-in-sixty-stocks-you-should-keep-on-your-radar-12-2248335.html
537,Correction likely to continue in the market. Here are top 4 stocks to buy this week,https://www.moneycontrol.com/news/business/stocks/correction-likely-to-continue-in-the-market-here-are-top-4-stocks-to-buy-this-week-2248019.html
538,Tech Mahindra may test Rs 445-447: Mitessh Thakkar,https://www.moneycontrol.com/news/business/tech-mahindra-may-test-rs-445-447-mitessh-thakkar-2247713.html
539,"Sell Tata Steel, Tech Mahindra; buy Petronet LNG: Ashwani Gujral",https://www.moneycontrol.com/news/business/sell-tata-steel-tech-mahindra-buy-petronet-lng-ashwani-gujral-2247711.html
540,"Rupee hits near 1-1/2 year high; bonds rally, shares fall",https://www.moneycontrol.com/news/business/markets/rupee-hits-near-1-12-year-high-bonds-rally-shares-fall-2247551.html
541,"Hold Tech Mahindra, may test Rs 600: Avinash Gorakshakar",https://www.moneycontrol.com/news/business/stocks/hold-tech-mahindra-may-test-rs-600-avinash-gorakshakar-2242283.html
542,"Buy Tech Mahindra, target Rs 650: Sandeep Wagle",https://www.moneycontrol.com/news/business/stocks/buy-tech-mahindra-target-rs-650-sandeep-wagle-2242249.html
543,Rupee getting strong but IT industry can face the challenge; AI major concern: Tech M,https://www.moneycontrol.com/news/business/rupee-getting-strong-but-it-industry-can-face-the-challenge-ai-major-concern-tech-m-2241119.html
544,Tech Mahindra sets up centre to showcase smart manufacturing,https://www.moneycontrol.com/news/business/companies/tech-mahindra-setscentre-to-showcase-smart-manufacturing-1057773.html
545,Tech Mahindra sets up 'Factory of the Future' lab in Bengaluru,https://www.moneycontrol.com/news/business/companies/tech-mahindra-setsfactorythe-future-labbengaluru-1058167.html
546,Tech Mahindra sets lab to showcase futuristic manufacturing tech,https://www.moneycontrol.com/news/business/companies/tech-mahindra-sets-lab-to-showcase-futuristic-manufacturing-tech-1057351.html
547,Buy Tech Mahindra; target of Rs 642: Edelweiss,https://www.moneycontrol.com/news/business/stocks/buy-tech-mahindra-targetrs-642-edelweiss-1058303.html
548,"Buy, sell, hold: 10 stocks that you can focus today",https://www.moneycontrol.com/news/business/stocks/buy-sell-hold-10-stocks-that-you-can-focus-today-1058175.html
549,Analysts upbeat on Tech Mahindra's latest acquisition,https://www.moneycontrol.com/news/business/stocks/analysts-upbeattech-mahindras-latest-acquisition-1058347.html
550,"Sensex, Nifty may open in the green; Bharat Fin, TechM in focus",https://www.moneycontrol.com/news/business/markets/sensex-nifty-may-openthe-green-bharat-fin-techmfocus-1058531.html
551,"Stocks in news: Tata Motors, Tech Mahindra, Den Net, PNC, Jet",https://www.moneycontrol.com/news/business/stocks/stocksnews-tata-motors-tech-mahindra-den-net-pnc-jet-1058453.html
552,Tech Mahindra Board approves acquisition of CJS Solutions,https://www.moneycontrol.com/news/business/companies/tech-mahindra-board-approves-acquisitioncjs-solutions-1058589.html
553,"Sensex, Nifty hold morning gains; Dredging Corp surges 16%",https://www.moneycontrol.com/news/business/markets/sensex-nifty-hold-morning-gains-dredging-corp-surges-16-1058951.html
554,Nasscom sees FY18 industry growth at 8-10%,https://www.moneycontrol.com/news/business/economy/nasscom-sees-fy18-industry-growth-at-8-10-1060155.html
555,Employees launch petition against 3-month exit notice in IT cos,https://www.moneycontrol.com/news/business/companies/employees-launch-petition-against-3-month-exit-noticeit-cos-1060435.html
556,"Buy, sell, hold: 19 stocks that analysts are watching out today",https://www.moneycontrol.com/news/business/stocks/buy-sell-hold-19-stocks-that-analystswatching-out-today-1033710.html
557,Liquidity-led expansion in valuations unlikely to stay: Deutsche,https://www.moneycontrol.com/news/business/markets/liquidity-led-expansionvaluations-unlikely-to-stay-deutsche-1061649.html
558,Six in Sixty: Stocks you should keep on your radar,https://www.moneycontrol.com/news/business/stocks/sixsixty-stocks-you-should-keepyour-radar-1034015.html
559,"Pininfarina,Hybrid Kinetic ink 65mn euro pact for electric car",https://www.moneycontrol.com/news/business/companies/pininfarinahybrid-kinetic-ink-65mn-euro-pact-for-electric-car-1034289.html
560,FPI holding in BSE-200 cos drops to &#36;305 bn in Dec-qtr: Report,https://www.moneycontrol.com/news/business/economy/fpi-holdingbse-200-cos-drops-to-36305-bndec-qtr-report-1032894.html
561,"Buy RIL, Bharat Financial, IndusInd Bank, Tech Mahindra: Sukhani",https://www.moneycontrol.com/news/business/stocks/buy-ril-bharat-financial-indusind-bank-tech-mahindra-sukhani-1032911.html
562,Six in Sixty: Stocks you should keep on your radar,https://www.moneycontrol.com/news/business/stocks/sixsixty-stocks-you-should-keepyour-radar-1015652.html
563,"Sensex, Nifty continue to be sluggish; Tech Mah, Axis Bank up 2%",https://www.moneycontrol.com/news/business/markets/sensex-nifty-continue-to-be-sluggish-tech-mah-axis-bank2-1015707.html
564,"Nifty holds 8850 amid volatility; Bharti Airtel, ITC drag",https://www.moneycontrol.com/news/business/markets/nifty-holds-8850-amid-volatility-bharti-airtel-itc-drag-1014869.html
565,"Sell Havells, Dr Reddy's; buy Petronet, Siemens: Sukhani",https://www.moneycontrol.com/news/business/stocks/sell-havells-dr-reddys-buy-petronet-siemens-sukhani-1015335.html
566,Tech Mahindra sees bigger business from Vodafone-Idea merger,https://www.moneycontrol.com/news/business/companies/tech-mahindra-sees-bigger-businessvodafone-idea-merger-1015306.html
567,"Wipro can climb to Rs 490, by Cadila Healthcare on dips: Gaba",https://www.moneycontrol.com/news/business/stocks/wipro-can-climb-to-rs-490-by-cadila-healthcaredips-gaba-1005839.html
568,Trump-led US eco recovery not priced into IT stocks: Ashburton,https://www.moneycontrol.com/news/business/markets/trump-led-us-eco-recovery-not-priced-into-it-stocks-ashburton-1005920.html
569,"Sell Apollo Tyres, JSW Steel; buy Tech Mahindra: Sukhani",https://www.moneycontrol.com/news/business/stocks/sell-apollo-tyres-jsw-steel-buy-tech-mahindra-sukhani-1006129.html
570,"TCS, Tech Mahindra, Infosys to get astro support: Satish Gupta",https://www.moneycontrol.com/news/business/markets/tcs-tech-mahindra-infosys-to-get-astro-support-satish-gupta-1003875.html
571,FIIs' stake in Nifty cos at 6-quarter low in Q3; Infosys dumped,https://www.moneycontrol.com/news/business/companies/fiis-stakenifty-cos-at-6-quarter-lowq3-infosys-dumped-1003819.html
572,Midcaps pricey vis-a-vis large caps; like Infy: Motilal‘s Duggad,https://www.moneycontrol.com/news/business/markets/midcaps-pricey-vis-a-vis-large-caps-like-infy-motilalâ€™s-duggad-1003935.html
573,"Buy Torrent Pharma, Tech Mahindra, M&M; sell Asian Paints: LKP",https://www.moneycontrol.com/news/business/stocks/buy-torrent-pharma-tech-mahindra-mm-sell-asian-paints-lkp-1004622.html
574,"Buy Hindalco, Vedanta, Tata Steel, DLF on dips: Ashwani Gujral",https://www.moneycontrol.com/news/business/stocks/buy-hindalco-vedanta-tata-steel-dlfdips-ashwani-gujral-1004702.html
575,Resistance for Bank Nifty at 20500; buy Hexaware: Prakash Gaba,https://www.moneycontrol.com/news/business/technicals/resistance-for-bank-nifty-at-20500-buy-hexaware-prakash-gaba-1005203.html
576,"Buy Natco Pharma, TV Today Network, Tech Mahindra: Gujral",https://www.moneycontrol.com/news/business/stocks/buy-natco-pharma-tv-today-network-tech-mahindra-gujral-1002307.html
577,Six in Sixty: Stocks you should keep on your radar,https://www.moneycontrol.com/news/business/stocks/sixsixty-stocks-you-should-keepyour-radar-1002305.html
578,Top buzzing midcap stocks to trade on February 10,https://www.moneycontrol.com/news/business/stocks/top-buzzing-midcap-stocks-to-tradefebruary-10-1002380.html
579,"Sensex, Nifty volatile; Grasim, Tech Mah, Adani Ports rally 2-3%",https://www.moneycontrol.com/news/business/markets/sensex-nifty-volatile-grasim-tech-mah-adani-ports-rally-2-3-1002397.html
580,"Tech Mahindra, Wipro, TCS, Hexaware to get astro support: Gupta",https://www.moneycontrol.com/news/business/markets/tech-mahindra-wipro-tcs-hexaware-to-get-astro-support-gupta-1002462.html
581,Resistance for Nifty at 8820-8850; buy Hexaware: Prakash Gaba,https://www.moneycontrol.com/news/business/technicals/resistance-for-nifty-at-8820-8850-buy-hexaware-prakash-gaba-1002425.html
582,"MSCI quarterly review: Tech Mahindra, ICICI Bank in focus",https://www.moneycontrol.com/news/business/markets/msci-quarterly-review-tech-mahindra-icici-bankfocus-1002697.html
583,"Like Aurobindo Pharma, Tech Mahindra: Prakash Gaba",https://www.moneycontrol.com/news/business/stocks/like-aurobindo-pharma-tech-mahindra-prakash-gaba-1002743.html
584,Tech Mahindra can climb to Rs 490: Prakash Gaba,https://www.moneycontrol.com/news/business/stocks/tech-mahindra-can-climb-to-rs-490-prakash-gaba-1002758.html
585,Hold Tech Mahindra; target of Rs 472: Axis Direct,https://www.moneycontrol.com/news/business/stocks/hold-tech-mahindra-targetrs-472-axis-direct-1002898.html
586,Six in Sixty: Stocks you should keep on your radar,https://www.moneycontrol.com/news/business/stocks/sixsixty-stocks-you-should-keepyour-radar-1001829.html
587,Trouble in IT: TechM halts appraisal for senior level employees,https://www.moneycontrol.com/news/business/companies/troubleit-techm-halts-appraisal-for-senior-level-employees-1001647.html
588,Buy Tech Mahindra; target of Rs 642: Edelweiss,https://www.moneycontrol.com/news/business/stocks/buy-tech-mahindra-targetrs-642-edelweiss-949104.html
589,Six in Sixty: Stocks you should keep on your radar,https://www.moneycontrol.com/news/business/stocks/sixsixty-stocks-you-should-keepyour-radar-948873.html
590,"Top gainers, losers post FM speech",https://www.moneycontrol.com/news/business/stocks/top-gainers-losers-post-fm-speech-949627.html
591,Buy Tech Mahindra; target of Rs 525: ICICI Direct,https://www.moneycontrol.com/news/business/stocks/buy-tech-mahindra-targetrs-525-icici-direct-950121.html
592,"Sell Tech Mahindra; buy Yes Bank, Tata Chem, Havells: Sukhani",https://www.moneycontrol.com/news/business/stocks/sell-tech-mahindra-buy-yes-bank-tata-chem-havells-sukhani-950173.html
593,"Buy RCF, Can Fin Homes, NBCC, Bharat Financial: Ashwani Gujral",https://www.moneycontrol.com/news/business/stocks/buy-rcf-can-fin-homes-nbcc-bharat-financial-ashwani-gujral--950120.html
594,Accumulate Tech Mahindra; target of Rs 513: KR Choksey,https://www.moneycontrol.com/news/business/stocks/accumulate-tech-mahindra-targetrs-513-kr-choksey-950346.html
595,Buy Tech Mahindra; target of Rs 550: Motilal Oswal,https://www.moneycontrol.com/news/business/stocks/buy-tech-mahindra-targetrs-550-motilal-oswal-950422.html
596,"H-1B visa issue: TCS, Infosys stare at &#36;2.7-bn cost increase",https://www.moneycontrol.com/news/business/companies/h-1b-visa-issue-tcs-infosys-stare-at-3627-bn-cost-increase-950361.html
597,"Buy Bajaj Finserv; sell TCS, Tech Mahindra: Ashwani Gujral",https://www.moneycontrol.com/news/business/stocks/buy-bajaj-finserv-sell-tcs-tech-mahindra-ashwani-gujral-950448.html
598,Tech Mahindra tanks 10% as visa wage hike ups earnings risk,https://www.moneycontrol.com/news/business/stocks/tech-mahindra-tanks-10-as-visa-wage-hike-ups-earnings-risk-950243.html
599,"Infosys, TCS fall 3-5%; H1-B bill proposes double minimum wage",https://www.moneycontrol.com/news/business/stocks/infosys-tcs-fall-3-5-h1-b-bill-proposes-double-minimum-wage-950245.html
600,Here are a few stock ideas from Rajen Shah,https://www.moneycontrol.com/news/business/stocks/here-arefew-stock-ideasrajen-shah-950550.html
601,Trump targets work visas: Here's what it means for Indian IT cos,https://www.moneycontrol.com/news/business/companies/trump-targets-work-visas-heresit-means-for-indian-it-cos-950216.html
602,"Buy, sell, hold: 5 crucial stocks to watch out post Q3 results",https://www.moneycontrol.com/news/business/stocks/buy-sell-hold-5-crucial-stocks-to-watch-out-post-q3-results-950380.html
603,"Stocks in news: Idea, ICICI Bank, Dilip, NMDC, Motilal Oswal",https://www.moneycontrol.com/news/business/stocks/stocksnews-idea-icici-bank-dilip-nmdc-motilal-oswal-950748.html
604,Here is why SP Tulsian feels ICICI Bank is for brave traders,https://www.moneycontrol.com/news/business/stocks/here-issp-tulsian-feels-icici-bank-is-for-brave-traders-950837.html
605,"Tech Mahindra Q3 profit jumps 31% to Rs 845 cr, &#36; revenue up 4%",https://www.moneycontrol.com/news/business/earnings/tech-mahindra-q3-profit-jumps-31-to-rs-845-cr-36-revenue4-947008.html
606,Six in Sixty: Stocks you should keep on your radar,https://www.moneycontrol.com/news/business/stocks/sixsixty-stocks-you-should-keepyour-radar-947162.html
607,"Tech Mahindra Q3 net seen up 21%, &#36; revenue growth may be 2%",https://www.moneycontrol.com/news/business/earnings/tech-mahindra-q3-net-seen21-36-revenue-growth-may-be-2-947124.html
608,"Stocks in news: L&T, HDFC, Guj Alkalies, Geojit BNP, Zuari Agro",https://www.moneycontrol.com/news/business/stocks/stocksnews-lt-hdfc-guj-alkalies-geojit-bnp-zuari-agro-947504.html
609,India Post gets payments bank licence to start services,https://www.moneycontrol.com/news/business/companies/india-post-gets-payments-bank-licence-to-start-services-947634.html
610,"Buy Mahindra & Mahindra, sell Tech Mahindra: Mitessh Thakkar",https://www.moneycontrol.com/news/business/stocks/buy-mahindramahindra-sell-tech-mahindra-mitessh-thakkar-946022.html
611,"Sell Tech Mahindra, Mindtree, Canara Bk; buy KRBL, HPCL: Gujral",https://www.moneycontrol.com/news/business/stocks/sell-tech-mahindra-mindtree-canara-bk-buy-krbl-hpcl-gujral-943867.html
612,Adapting to automation a bigger hurdle than Trump: Tech Mahindra,https://www.moneycontrol.com/news/business/companies/adapting-to-automationbigger-hurdle-than-trump-tech-mahindra-944171.html
613,"Buy Hindalco, Tata Elxsi; sell Tech Mahindra: Sandeep Wagle",https://www.moneycontrol.com/news/business/stocks/buy-hindalco-tata-elxsi-sell-tech-mahindra-sandeep-wagle-945069.html
614,WEF: TechM chief says co will keep investing in hiring US locals,https://www.moneycontrol.com/news/world/wef-techm-chief-says-co-will-keep-investinghiring-us-locals-944954.html
615,Indian IT sector needs new skill sets: C P Gurnani,https://www.moneycontrol.com/news/business/companies/indian-it-sector-needs-new-skill-sets-c-p-gurnani-945555.html
616,Tech Mahindra launches incubator for startups in Milton Keynes,https://www.moneycontrol.com/news/business/companies/tech-mahindra-launches-incubator-for-startupsmilton-keynes-946382.html
617,Tech Mahindra Q3 PAT seen up 6% to Rs 681.9 cr: KR Choksey,https://www.moneycontrol.com/news/business/earnings/tech-mahindra-q3-pat-seen6-to-rs-6819-cr-kr-choksey-946925.html
618,"Buy Power Grid, IOC, Tech Mahindra: Ashwani Gujral",https://www.moneycontrol.com/news/business/stocks/buy-power-grid-ioc-tech-mahindra-ashwani-gujral-940840.html
619,Tech Mahindra Q3 PAT seen up 9.5% to Rs 706.3 cr: Motilal Oswal,https://www.moneycontrol.com/news/business/earnings/tech-mahindra-q3-pat-seen95-to-rs-7063-cr-motilal-oswal-941031.html
620,Six in Sixty: Stocks you should keep on your radar,https://www.moneycontrol.com/news/business/stocks/sixsixty-stocks-you-should-keepyour-radar-941539.html
621,Boosters: 10 stocks that Deutsche Bank is bullish on for 2017,https://www.moneycontrol.com/news/business/stocks/boosters-10-stocks-that-deutsche-bank-is-bullishfor-2017-941274.html
622,"Buy, sell, hold: 21 large & midcap stocks to boost portfolio",https://www.moneycontrol.com/news/business/stocks/buy-sell-hold-21-largemidcap-stocks-to-boost-portfolio-941490.html
623,Here are Sanjiv Bhasin's top trading ideas,https://www.moneycontrol.com/news/business/stocks/heresanjiv-bhasins-top-trading-ideas-941666.html
624,Six in Sixty: Stocks you should keep on your radar,https://www.moneycontrol.com/news/business/stocks/sixsixty-stocks-you-should-keepyour-radar-941903.html
625,Here are Abhimanyu Sofat's top trading ideas,https://www.moneycontrol.com/news/business/stocks/hereabhimanyu-sofats-top-trading-ideas-942026.html
626,Top buzzing midcap stocks to trade on January 6,https://www.moneycontrol.com/news/business/stocks/top-buzzing-midcap-stocks-to-tradejanuary-6-942372.html
627,Only 4% of employees on H1B Visa; Bill not a big hit on co:TechM,https://www.moneycontrol.com/news/business/companies/only-4employeesh1b-visa-bill-notbig-hitcotechm-942265.html
628,IT stocks sink 2-4% after US immigration reform re-introduced,https://www.moneycontrol.com/news/business/stocks/it-stocks-sink-2-4-after-us-immigration-reform-re-introduced-942320.html
629,"Stocks in news: Wockhardt, Tech Mah, Mastek, Glenmark, GE Power",https://www.moneycontrol.com/news/business/stocks/stocksnews-wockhardt-tech-mah-mastek-glenmark-ge-power-942442.html
630,Why H1B visa reform Bill spells bad news for Indian IT cos,https://www.moneycontrol.com/news/business/companies/why-h1b-visa-reform-bill-spells-bad-news-for-indian-it-cos-942228.html
