,Headlines,Links
0,Buy UPL; target of Rs 930: Emkay Global Financial,https://www.moneycontrol.com/news/business/stocks/buy-upl-target-of-rs-930-emkay-global-financial-8487541.html
1,Buy UPL; target of Rs 1010: Prabhudas Lilladher,https://www.moneycontrol.com/news/business/stocks/buy-upl-target-of-rs-1010-prabhudas-lilladher-8490911.html
2,Backward integration gives UPL an edge in inflationary times,https://www.moneycontrol.com/news/opinion/backward-integration-gives-upl-an-edge-in-inflationary-times-8492781.html
3,"UPL Consolidated March 2022 Net Sales at Rs 15,861.00 crore, up 23.95% Y-o-Y",https://www.moneycontrol.com/news/business/earnings/upl-consolidated-march-2022-net-sales-at-rs-15861-00-crore-up-23-95-y-o-y-8479021.html
4,"UPL Standalone March 2022 Net Sales at Rs 4,326.00 crore, up 65.68% Y-o-Y",https://www.moneycontrol.com/news/business/earnings/upl-standalone-march-2022-net-sales-at-rs-4326-00-crore-up-65-68-y-o-y-8478831.html
5,Top 10 trading ideas for next 3-4 weeks as market expected to be volatile,https://www.moneycontrol.com/news/business/markets/top-10-trading-ideas-for-next-3-4-weeks-as-market-expected-to-be-volatile-8437911.html
6,Top 10 trading ideas for next 3-4 weeks as market ekes out gains despite volatility,https://www.moneycontrol.com/news/business/markets/top-10-trading-ideas-for-next-3-4-weeks-as-market-ekes-out-gains-despite-volatility-8341061.html
7,Buy UPL: target of Rs 930: Sharekhan,https://www.moneycontrol.com/news/business/stocks/buy-upl-target-of-rs-930-sharekhan-3-8243081.html
8,What UPL’s first buyback in 8 years says about its finances,https://www.moneycontrol.com/news/opinion/what-upls-first-buyback-in-8-years-says-about-its-finances-8205171.html
9,UPL promoters likely to have put the company on the block for family separation: Sources,https://www.moneycontrol.com/news/business/companies/upl-promoters-likely-to-have-put-the-company-on-the-block-for-family-separation-sources-8189511.html
10,Buy UPL; target of Rs 901: KR Choksey,https://www.moneycontrol.com/news/business/stocks/buy-upl-target-of-rs-901-kr-choksey-8041941.html
11,Buy UPL; target of Rs 910: Emkay Global Financial,https://www.moneycontrol.com/news/business/stocks/buy-upl-target-of-rs-910-emkay-global-financial-8034321.html
12,Buy UPL; target of Rs 980: Prabhudas Lilladher,https://www.moneycontrol.com/news/business/stocks/buy-upl-target-of-rs-980-prabhudas-lilladher-8025711.html
13,"UPL Consolidated December 2021 Net Sales at Rs 11,297.00 crore, up 23.79% Y-o-Y",https://www.moneycontrol.com/news/business/earnings/upl-consolidated-december-2021-net-sales-at-rs-11297-00-crore-up-23-79-y-o-y-2-8015641.html
14,"UPL Consolidated December 2021 Net Sales at Rs 11,297.00 crore, up 23.79% Y-o-Y",https://www.moneycontrol.com/news/business/earnings/upl-consolidated-december-2021-net-sales-at-rs-11297-00-crore-up-23-79-y-o-y-8012211.html
15,"UPL Standalone December 2021 Net Sales at Rs 4,025.00 crore, up 37.8% Y-o-Y",https://www.moneycontrol.com/news/business/earnings/upl-standalone-december-2021-net-sales-at-rs-4025-00-crore-up-37-8-y-o-y-8011781.html
16,Bunge to pick 33% stake in UPL's associate firm Sinagro in Brazil,https://www.moneycontrol.com/news/business/bunge-to-pick-33-stake-in-upls-associate-firm-sinagro-in-brazil-7961881.html
17,UPL Q3 PAT seen up 11.2% YoY to Rs 883 cr: Sharekhan,https://www.moneycontrol.com/news/business/upl-q3-pat-seen-up-11-2-yoy-to-rs-883-cr-sharekhan-7948281.html
18,Top 10 trading ideas for next 3-4 weeks as bulls rule Dalal Street,https://www.moneycontrol.com/news/business/markets/top-10-trading-ideas-for-next-3-4-weeks-as-bulls-rule-dalal-street-7916901.html
19,"LatAm recovery to give fillip to UPL’s growth, profit margins key",https://www.moneycontrol.com/news/opinion/latam-recovery-to-give-fillip-to-upls-growth-profit-margins-key-7835271.html
20,Buy UPL: target of Rs 930: Sharekhan,https://www.moneycontrol.com/news/business/stocks/buy-upl-target-of-rs-930-sharekhan-2-7824491.html
21,UPL stock in focus after promoter raises stake; global brokerage expects 30% upside,https://www.moneycontrol.com/news/business/stocks/upl-stock-in-focus-after-promoter-raises-stake-global-brokerage-expects-30-upside-7759561.html
22,Buy UPL target of Rs 875: Geojit,https://www.moneycontrol.com/news/business/stocks/buy-upl-target-of-rs-875-geojit-7694911.html
23,Neutral UPL; target of Rs 790: Motilal Oswal,https://www.moneycontrol.com/news/business/stocks/neutral-upl-target-of-rs-790-motilal-oswal-7677051.html
24,"UPL displays manufacturing prowess, but rising costs bite",https://www.moneycontrol.com/news/opinion/upl-displays-manufacturing-prowess-but-rising-costs-bite-7665971.html
25,"Hot Stocks | Sun TV Network, Apollo Tyres and UPL can give up to 38% return in short term",https://www.moneycontrol.com/news/business/markets/hot-stocks-sun-tv-network-apollo-tyres-and-upl-can-give-up-to-38-return-in-short-term-7601451.html
26,"UPL share price edges higher after global brokerage retains 'buy', sees 32% upside",https://www.moneycontrol.com/news/business/stocks/upl-share-price-edges-higher-after-global-brokerage-retains-buy-sees-32-upside-7395841.html
27,"UPL Consolidated June 2021 Net Sales at Rs 8,515.00 crore, up 8.71% Y-o-Y",https://www.moneycontrol.com/news/business/earnings/upl-consolidated-june-2021-net-sales-at-rs-8515-00-crore-up-8-71-y-o-y-7268031.html
28,"UPL Standalone June 2021 Net Sales at Rs 3,960.00 crore, up 49.38% Y-o-Y",https://www.moneycontrol.com/news/business/earnings/upl-standalone-june-2021-net-sales-at-rs-3960-00-crore-up-49-38-y-o-y-7266321.html
29,"What should investors do with UPL after Q1 results: buy, sell or hold?",https://www.moneycontrol.com/news/business/markets/what-should-investors-do-with-upl-after-q1-results-buy-sell-or-hold-7259491.html
30,UPL net profit jumps 23%to Rs 678 crore in June quarter,https://www.moneycontrol.com/news/business/earnings/upl-net-profit-jumps-23to-rs-678-crore-in-june-quarter-7254991.html
31,Bajar Gupshup | Markets end at record close; metals outperform,https://www.moneycontrol.com/news/business/markets/bajar-gupshup-markets-end-at-record-close-metals-outperform-7142371.html
32,Buy UPL: target of Rs 930: Sharekhan,https://www.moneycontrol.com/news/business/stocks/buy-upl-target-of-rs-930-sharekhan-7116541.html
33,Interview | We see potential for steady growth: UPL’s Jaidev Shroff,https://www.moneycontrol.com/news/opinion/interview-we-see-potential-for-steady-growth-upls-jaidev-shroff-7116961.html
34,UPL: Upbeat revenue outlook eclipses corporate governance concerns,https://www.moneycontrol.com/news/opinion/upl-upbeat-revenue-outlook-eclipses-corporate-governance-concerns-6900441.html
35,Buy UPL; target of Rs 850: Dolat Capital Market,https://www.moneycontrol.com/news/business/stocks/buy-upl-target-of-rs-850-dolat-capital-market-6892551.html
36,UPL stock price spikes 9% to 52-week high after earnings beat estimates,https://www.moneycontrol.com/news/business/stocks/upl-stock-price-spikes-9-to-52-week-high-after-earnings-beat-estimates-6891641.html
37,"UPL Consolidated March 2021 Net Sales at Rs 12,796.00 crore, up 14.86% Y-o-Y",https://www.moneycontrol.com/news/business/earnings/upl-consolidated-march-2021-net-sales-at-rs-12796-00-crore-up-14-86-y-o-y-6888241.html
38,"UPL Standalone March 2021 Net Sales at Rs 2,611.00 crore, up 28.56% Y-o-Y",https://www.moneycontrol.com/news/business/earnings/upl-standalone-march-2021-net-sales-at-rs-2611-00-crore-up-28-56-y-o-y-6886901.html
39,"UPL Q4 earnings beat estimates, profit jumps 74%; FY21 EBITDA exceeds guidance",https://www.moneycontrol.com/news/business/earnings/upl-q4-earnings-beat-estimates-profit-jumps-74-fy21-ebitda-exceeds-guidance-6885041.html
40,"UPL likely to report around 50% growth in Q4 profit, over 10% increase in revenue",https://www.moneycontrol.com/news/business/earnings/upl-likely-to-report-around-50-growth-in-q4-profit-over-10-increase-in-revenue-6882181.html
41,UPL share price gains after Australian Court dismisses class action litigation against subsidiary,https://www.moneycontrol.com/news/business/stocks/upl-share-price-gains-after-australian-court-dismisses-class-action-litigation-against-subsidiary-6771081.html
42,UPL Q4 PAT seen up 9.7% YoY to Rs. 972  cr: Sharekhan,https://www.moneycontrol.com/news/business/upl-q4-pat-seen-up-9-7-yoy-to-rs-972-cr-sharekhan-6760451.html
43,Quant Pick - UPL : ICICI Direct,https://www.moneycontrol.com/news/business/stocks/quant-pick-upl-icici-direct-6714201.html
44,Buy UPL: target of Rs 720: Sharekhan,https://www.moneycontrol.com/news/business/stocks/buy-upl-target-of-rs-720-sharekhan-6677551.html
45,"Anupam Rasayan IPO: A tiny version of PI Industries, diversifying beyond agro-chem",https://www.moneycontrol.com/news/business/moneycontrol-research/anupam-rasayan-ipo-a-tiny-version-of-pi-industries-diversifying-beyond-agro-chem-6636081.html
46,Neutral UPL; target of Rs 631: Motilal Oswal,https://www.moneycontrol.com/news/business/stocks/neutral-upl-target-of-rs-631-motilal-oswal-6622311.html
47,Buy UPL; target of Rs 632: Sharekhan,https://www.moneycontrol.com/news/business/buy-upl-target-of-rs-632-sharekhan-5-6469161.html
48,Accumulate UPL; target of Rs 601: Prabhudas Lilladher,https://www.moneycontrol.com/news/business/stocks/accumulate-upl-target-of-rs-601-prabhudas-lilladher-6448731.html
49,Accumulate UPL; target of Rs 609: Dolat Capital Market,https://www.moneycontrol.com/news/business/stocks/accumulate-upl-target-of-rs-609-dolat-capital-market-6439451.html
50,Neutral UPL; target of Rs 574: Motilal Oswal,https://www.moneycontrol.com/news/business/neutral-upl-target-of-rs-574-motilal-oswal-6435991.html
51,"UPL Consolidated December 2020 Net Sales at Rs 9,126.00 crore, up 2.63% Y-o-Y",https://www.moneycontrol.com/news/business/earnings/upl-consolidated-december-2020-net-sales-at-rs-9126-00-crore-up-2-63-y-o-y-6432591.html
52,"UPL Standalone December 2020 Net Sales at Rs 2,921.00 crore, up 16.75% Y-o-Y",https://www.moneycontrol.com/news/business/earnings/upl-standalone-december-2020-net-sales-at-rs-2921-00-crore-up-16-75-y-o-y-6431071.html
53,UPL share price gains 3% after company reduces debt by $410 million,https://www.moneycontrol.com/news/business/stocks/upl-share-price-gains-3-after-company-reduces-debt-by-410-million-6284451.html
54,UPL share price tumbles 13% after whistleblower accused promoters of siphoning; CEO Jai Shroff denies accusation,https://www.moneycontrol.com/news/business/stocks/upl-share-price-tumbles-13-after-whistleblower-accused-promoters-of-siphoning-ceo-jai-shroff-denies-accusation-6211791.html
55,Buy UPL: target of Rs 632 : Sharekhan,https://www.moneycontrol.com/news/business/stocks/buy-upl-target-of-rs-632-sharekhan-4-6203881.html
56,Buy UPL; target of Rs 622 KR Choksey,https://www.moneycontrol.com/news/business/stocks/buy-upl-target-of-rs-622-kr-choksey-6088601.html
57,Buy UPL; target of Rs 530: Geojit,https://www.moneycontrol.com/news/business/stocks/buy-upl-target-of-rs-530-geojit-6088571.html
58,Buy UPL; target of Rs 621: Dolat Capital Market,https://www.moneycontrol.com/news/business/stocks/buy-upl-target-of-rs-621-dolat-capital-market-6084361.html
59,Buy UPL: target of Rs 632: Sharekhan,https://www.moneycontrol.com/news/business/stocks/buy-upl-target-of-rs-632-sharekhan-3-6071211.html
60,Auditor conundrum adds to debt concerns at UPL,https://www.moneycontrol.com/news/opinion/auditor-conundrum-adds-to-debt-concerns-at-upl-6063101.html
61,Buy UPL; target of Rs 606: Prabhudas Lilladher,https://www.moneycontrol.com/news/business/stocks/buy-upl-target-of-rs-606-prabhudas-lilladher-2-6060191.html
62,"UPL Standalone September 2020 Net Sales at Rs 3,162.00 crore, up 14.11% Y-o-Y",https://www.moneycontrol.com/news/business/earnings/upl-standalone-september-2020-net-sales-at-rs-3162-00-crore-up-14-11-y-o-y-6057701.html
63,"UPL Consolidated September 2020 Net Sales at Rs 8,939.00 crore, up 14.35% Y-o-Y",https://www.moneycontrol.com/news/business/earnings/upl-consolidated-september-2020-net-sales-at-rs-8939-00-crore-up-14-35-y-o-y-6057051.html
64,Buy UPL; target of Rs 632: Sharekhan,https://www.moneycontrol.com/news/business/stocks/buy-upl-target-of-rs-632-sharekhan-2-6050981.html
65,"UPL: Decently valued, but risks call for caution",https://www.moneycontrol.com/news/business/moneycontrol-research/upl-decently-valued-but-risks-call-for-caution-6049321.html
66,UPL Q2 profit more than doubles to Rs 537 crore; revenue grows 14% YoY,https://www.moneycontrol.com/news/business/markets/upl-q2-profit-more-than-doubles-to-rs-537-crore-revenue-grows-14-yoy-6041951.html
67,Buy UPL; target of Rs 632: Sharekhan,https://www.moneycontrol.com/news/business/stocks/buy-upl-target-of-rs-632-sharekhan-5910291.html
68,UPL shares rise 5% after CLSA retains buy,https://www.moneycontrol.com/news/business/stocks/upl-shares-rise-5-after-clsa-retains-buy-5792061.html
69,Buy UPL; target of Rs 622: KRChoksey,https://www.moneycontrol.com/news/business/stocks/buy-upl-target-of-rs-622-krchoksey-5697931.html
70,Buy UPL; target of Rs 620: Dolat Capital,https://www.moneycontrol.com/news/business/stocks/buy-upl-target-of-rs-620-dolat-capital-2-5669491.html
71,Buy UPL; target of Rs 606: Prabhudas Lilladher,https://www.moneycontrol.com/news/business/stocks/buy-upl-target-of-rs-606-prabhudas-lilladher-5663211.html
72,Neutral UPL; target of Rs 527: Motilal Oswal,https://www.moneycontrol.com/news/business/stocks/neutral-upl-target-of-rs-527-motilal-oswal-5658981.html
73,Buy UPL; target of Rs 550: Sharekhan,https://www.moneycontrol.com/news/business/stocks/buy-upl-target-of-rs-550-sharekhan-5633351.html
74,"UPL Consolidated June 2020 Net Sales at Rs 7,833.00 crore, down 0.92% Y-o-Y",https://www.moneycontrol.com/news/business/earnings/upl-consolidated-june-2020-net-sales-at-rs-7833-00-crore-down-0-92-y-o-y-5637391.html
75,"UPL Standalone June 2020 Net Sales at Rs 2,651.00 crore, up 13.44% Y-o-Y",https://www.moneycontrol.com/news/business/earnings/upl-standalone-june-2020-net-sales-at-rs-2651-00-crore-up-13-44-y-o-y-5637071.html
76,"UPL: Debt a concern, but valuation attractive",https://www.moneycontrol.com/news/business/moneycontrol-research/upl-debt-a-concern-but-valuation-attractive-5636381.html
77,"UPL Standalone March 2020 Net Sales at Rs 2,031.00 crore, up 8.96% Y-o-Y",https://www.moneycontrol.com/news/business/earnings/upl-standalone-march-2020-net-sales-at-rs-2031-00-crore-up-8-96-y-o-y-5325261.html
78,Which companies could gain as global supply chains shift from China – Part1,https://www.moneycontrol.com/news/business/moneycontrol-research/which-companies-could-gain-as-global-supply-chains-shift-from-china-part1-5318931.html
79,Buy UPL; target of Rs 500: Emkay Global Financial,https://www.moneycontrol.com/news/business/stocks/buy-upl-target-of-rs-500-emkay-global-financial-5315241.html
80,UPL shares rise 4% as brokerages retain positive view after Q4 earnings,https://www.moneycontrol.com/news/business/markets/upl-shares-rise-4-as-brokerages-retain-positive-view-after-q4-earnings-5314861.html
81,Buy UPL target of Rs 450: Sharekhan,https://www.moneycontrol.com/news/business/stocks/buy-upl-target-of-rs-450-sharekhan-5314731.html
82,This attractively valued agro-products stock is one for the risk takers,https://www.moneycontrol.com/news/business/moneycontrol-research/this-attractively-valued-agro-products-stock-is-one-for-the-risk-takers-5313301.html
83,"UPL Consolidated March 2020 Net Sales at Rs 11,141.00 crore, up 30.69% Y-o-Y",https://www.moneycontrol.com/news/business/earnings/upl-consolidated-march-2020-net-sales-at-rs-11141-00-crore-up-30-69-y-o-y-5313531.html
84,Buy UPL; target of Rs 620: Dolat Capital,https://www.moneycontrol.com/news/business/stocks/buy-upl-target-of-rs-620-dolat-capital-5308921.html
85,Buy UPL; target of Rs 497: Prabhudas Lilladher,https://www.moneycontrol.com/news/business/stocks/buy-upl-target-of-rs-497-prabhudas-lilladher-5308791.html
86,Proposed ban on some agrochemicals is negative for producers,https://www.moneycontrol.com/news/business/moneycontrol-research/proposed-ban-on-some-agrochemicals-is-negative-for-producers-5290441.html
87,Fertilizer stocks under pressure on govt's draft order to ban select insecticides,https://www.moneycontrol.com/news/business/stocks/fertilizer-stocks-under-pressure-on-govts-draft-order-to-ban-select-insecticides-5286841.html
88,UPL share price up 5% after company acquires Chinese agrochemical maker Yoloo Loating Bio-tech,https://www.moneycontrol.com/news/business/stocks/upl-share-price-up-5-after-company-acquires-chinese-agrochemical-maker-yoloo-loating-bio-tech-5196671.html
89,3-Point Analysis | UPL Q3 review,https://www.moneycontrol.com/news/business/3-point-analysis-upl-ltd-reported-10-percent-increase-in-q3fy2020-4951601.html
90,"UPL Q3 on a fertile pitch, Lat-Am steers the show",https://www.moneycontrol.com/news/business/moneycontrol-research/upl-q3-on-a-fertile-pitch-lat-am-steers-the-show-4930181.html
91,Buy UPL; target of Rs 740: Prabhudas Lilladher,https://www.moneycontrol.com/news/business/stocks/buy-upl-target-of-rs-740-prabhudas-lilladher-4939861.html
92,Buy UPL target of Rs 647: Sharekhan,https://www.moneycontrol.com/news/business/stocks/buy-upl-target-of-rs-647-sharekhan-4925791.html
93,UPL gains 5% on strong Q3 numbers; HSBC maintains buy,https://www.moneycontrol.com/news/business/stocks/upl-gains-5-on-strong-q3-numbers-hsbc-maintains-buy-4924961.html
94,"UPL share price falls 4% as I-T Dept searches offices, plants",https://www.moneycontrol.com/news/business/stocks/upl-share-price-falls-4-as-i-t-dept-searches-offices-plants-4843871.html
95,UPL gets green nod for Rs 353-cr pesticide unit expansion project in Gujarat,https://www.moneycontrol.com/news/india/upl-gets-green-nod-for-rs-353-cr-pesticide-unit-expansion-project-in-gujarat-4731501.html
96,"UPL September quarter: Weak performance, rising debt a concern; Avoid",https://www.moneycontrol.com/news/business/moneycontrol-research/upl-september-quarter-weak-performance-rising-debt-a-concern-avoid-4614611.html
97,Global brokerages remain bullish on UPL despite 67% fall in profit; here is why,https://www.moneycontrol.com/news/business/markets/global-brokerages-remain-bullish-on-upl-despite-67-fall-in-profit-here-is-why-4618721.html
98,UPL Q2 profit plunges 67% to Rs 89 cr on one-time loss,https://www.moneycontrol.com/news/business/markets/upl-q2-profit-plunges-67-to-rs-89-cr-on-one-time-loss-4615801.html
99,Balaji Amines Q2: Strong uptick in volumes to aid rerating,https://www.moneycontrol.com/news/business/moneycontrol-research/balaji-amines-q2-strong-uptick-in-volumes-to-aid-rerating-4605101.html
100,UPL Q2 PAT seen up 87.9% YoY to Rs. 583.5 cr: Kotak,https://www.moneycontrol.com/news/business/earnings/upl-q2-pat-seen-up-87-9-yoy-to-rs-583-5-cr-kotak-4524891.html
101,"Healthy volume activity makes Britannia, Citi Union Bank among top buys; here’s why",https://www.moneycontrol.com/news/business/markets/healthy-volume-activity-makes-britannia-citi-union-bank-among-top-buys-heres-why-4510841.html
102,What should investors buy now? 25 Nifty50 stocks trading at a premium to their 10-yr average,https://www.moneycontrol.com/news/business/markets/what-should-investors-buy-now-25-nifty50-stocks-trading-at-a-premium-to-their-10-yr-average-4452731.html
103,Buy UPL; target of Rs 745: Prabhudas Lilladher,https://www.moneycontrol.com/news/business/stocks/buy-upl-target-of-rs-745-prabhudas-lilladher-4329751.html
104,"Market Headstart: Nifty likely to see weak start; Tech Mahindra, Dabur top buy ideas",https://www.moneycontrol.com/news/business/markets/market-headstart-nifty-likely-to-see-weak-start-tech-mahindra-dabur-top-buy-ideas-4294011.html
105,"UPL: Higher interest cost a Q1 spoiler, margin may feel the heat",https://www.moneycontrol.com/news/business/moneycontrol-research/upl-higher-interest-cost-a-q1-spoiler-margin-may-feel-the-heat-4282361.html
106,Buy UPL; target of Rs 752: Prabhudas Lilladher,https://www.moneycontrol.com/news/business/stocks/buy-upl-target-of-rs-752-prabhudas-lilladher-4277121.html
107,"UPL Consolidated June 2019 Net Sales at Rs 7,906.00 crore, up 91.24% Y-o-Y",https://www.moneycontrol.com/news/business/earnings/upl-consolidated-june-2019-net-sales-at-rs-7906-00-crore-up-91-24-y-o-y-4273581.html
108,"UPL Standalone June 2019 Net Sales at Rs 2,337.00 crore, up 1.39% Y-o-Y",https://www.moneycontrol.com/news/business/earnings/upl-standalone-june-2019-net-sales-at-rs-2337-00-crore-up-1-39-y-o-y-4273561.html
109,UPL to release Q1 earnings today; here's what brokerages expect,https://www.moneycontrol.com/news/business/markets/upl-to-release-q1-earnings-today-heres-what-brokerages-expect-4270961.html
110,"D-Street Buzz: UPL jumps 7%, hits new 52-week high; YES Bank falls 3%, Tata Motors slips",https://www.moneycontrol.com/news/business/markets/d-street-buzz-upl-jumps-7-hits-new-52-week-high-yes-bank-falls-3-tata-motors-slips-4169821.html
111,Buy UPL; target of Rs 1086: Sharekhan,https://www.moneycontrol.com/news/business/stocks/buy-upl-target-of-rs-1086-sharekhan-2-4159691.html
112,UPL climbs 5% as Deutsche maintains buy rating on strong biz outlook,https://www.moneycontrol.com/news/business/markets/upl-climbs-5-as-deutsche-maintains-buy-rating-on-strong-biz-outlook-4123251.html
113,Accumulate UPL; target of Rs 1142: KR Choksey,https://www.moneycontrol.com/news/business/stocks/accumulate-upl-target-of-rs-1142-kr-choksey-4114701.html
114,Buy UPL; target of Rs 1206: Dolat Capital,https://www.moneycontrol.com/news/business/stocks/buy-upl-target-of-rs-1206-dolat-capital-4015081.html
115,Buy UPL; target of Rs 1086: Sharekhan,https://www.moneycontrol.com/news/business/stocks/buy-upl-target-of-rs-1086-sharekhan-4002441.html
116,3 Point Analysis | UPL Q4FY19 Review,https://www.moneycontrol.com/news/eye-on-india/videos/3-point-analysis-upl-q4fy19-review-3995771.html
117,"UPL Q4 earnings: Operational metrics sound, takeover cost dents profit",https://www.moneycontrol.com/news/business/moneycontrol-research/upl-q4-earnings-operational-metrics-sound-takeover-cost-dents-profitability-3994061.html
118,UPL Q4 profit down 72% at Rs 206 cr,https://www.moneycontrol.com/news/business/upl-q4-profit-down-72-at-rs-206-cr-3988411.html
119,"UPL Consolidated March 2019 Net Sales at Rs 8,525.00 crore, up 49.8% Y-o-Y",https://www.moneycontrol.com/news/business/earnings/upl-consolidated-march-2019-net-sales-at-rs-8525-00-crore-up-49-8-y-o-y-3987431.html
120,"UPL Standalone March 2019 Net Sales at Rs 1,864.00 crore, up 13.94% Y-o-Y",https://www.moneycontrol.com/news/business/earnings/upl-standalone-march-2019-net-sales-at-rs-1864-00-crore-up-13-94-y-o-y-3987391.html
121,UPL announces 26.75% stake buy in Allfresh,https://www.moneycontrol.com/news/business/upl-announces-26-75-stake-buy-in-allfresh-3958901.html
122,UPL Q4 PAT seen up 24.5% YoY to Rs. 916.1 cr: Kotak,https://www.moneycontrol.com/news/business/earnings/upl-q4-pat-seen-up-24-5-yoy-to-rs-916-1-cr-kotak-3843191.html
123,Congress seeks CBI probe into BJP-UPL link after EC raid finds propaganda material,https://www.moneycontrol.com/news/politics/congress-seeks-cbi-probe-into-bjps-links-with-upl-3813011.html
124,Regulatory barriers make this phosgene producer a worthy pick,https://www.moneycontrol.com/news/business/moneycontrol-research/regulatory-barriers-make-this-phosgene-producer-a-worthy-pick-3759911.html
125,"Agrochemical sector Q3FY19 review: Mixed bag; muted domestic growth, input costs weigh",https://www.moneycontrol.com/news/business/earnings/agrochemical-sector-q3fy19-review-mixed-bag-muted-domestic-growth-input-costs-weigh-3584441.html
126,UPL hits 18-month high after Jefferies initiates coverage with buy,https://www.moneycontrol.com/news/business/markets/upl-hits-18-month-high-after-jefferies-initiates-coverage-with-buy-3583591.html
127,Buy UPL; target of Rs 943: Motilal Oswal,https://www.moneycontrol.com/news/business/stocks/buy-upl-target-of-rs-943-motilal-oswal-3561651.html
128,Promoters raise stake in 80 companies in last 4 quarters; should you follow suit?,https://www.moneycontrol.com/news/business/markets/promoters-raise-stake-in-80-companies-in-last-4-quarters-should-you-follow-suit-3533611.html
129,Buy UPL; target of Rs 975: Prabhudas Lilladher,https://www.moneycontrol.com/news/business/stocks/buy-upl-target-of-rs-975-prabhudas-lilladher-3519661.html
130,Balaji Amines Q3FY19 review: Input price volatility hits volumes; accumulate on staggered basis,https://www.moneycontrol.com/news/business/moneycontrol-research/balaji-amines-q3fy19-review-input-price-volatility-hits-volumes-accumulate-on-staggered-basis-3504831.html
131,UPL Q3 review: High leveraging to impact margins in short-term,https://www.moneycontrol.com/news/business/moneycontrol-research/upl-q3-review-high-leveraging-to-impact-margins-in-short-term-3486241.html
132,"UPL Consolidated December 2018 Net Sales at Rs 4,921.00 crore, up 17.33% Y-o-Y",https://www.moneycontrol.com/news/business/earnings/upl-consolidated-december-2018-net-sales-at-rs-4921-00-crore-up-17-33-y-o-y-3468261.html
133,"UPL Standalone December 2018 Net Sales at Rs 2,216.00 crore, up 14.11% Y-o-Y",https://www.moneycontrol.com/news/business/earnings/upl-standalone-december-2018-net-sales-at-rs-2216-00-crore-up-14-11-y-o-y-3468231.html
134,First Cut | UPL Q3FY19 review: Healthy performance but one-off affects net margins,https://www.moneycontrol.com/news/business/earnings/first-cut-upl-q3fy19-review-healthy-performance-but-one-off-affects-net-margins-3460581.html
135,UPL Q3 PAT may dip 8.9% YoY to Rs. 571.1 cr: Prabhudas Lilladher,https://www.moneycontrol.com/news/business/earnings/upl-q3-pat-may-dip-8-9-yoy-to-rs-571-1-cr-prabhudas-lilladher-3397481.html
136,UPL's Arysta acquisition: Increased exposure to Europe post deal may hit synergies,https://www.moneycontrol.com/news/business/stocks/upls-arysta-acquisition-increased-exposure-to-europe-post-deal-may-hit-synergies-3329651.html
