,Headlines,Links
137,Hold UPL; target of Rs 777: Sharekhan,https://www.moneycontrol.com/news/business/stocks/hold-upl-target-of-rs-777-sharekhan-3311171.html
138,Buy UPL; target of Rs 924: Motilal Oswal,https://www.moneycontrol.com/news/business/stocks/buy-upl-target-of-rs-924-motilal-oswal-3228521.html
139,UPL rises 2% as Mauritius subsidiary buys agrochemical company in Costa Rica,https://www.moneycontrol.com/news/business/markets/upl-rises-2-as-mauritius-subsidiary-buys-agrochemical-company-in-costa-rica-3203841.html
140,UPL inks pact with Gexcon to work on mitigating industrial accidents,https://www.moneycontrol.com/news/business/upl-inks-pact-with-gexcon-to-work-on-mitigating-industrial-accidents-3181751.html
141,UPL Q2 review – mixed quarter; worthy of keeping on radar,https://www.moneycontrol.com/news/business/earnings/upl-q2-review-mixed-quarter-worthy-of-keeping-on-radar-3099141.html
142,"UPL Standalone September 2018 Net Sales at Rs 2,275.00 crore, up 15.42% Q-o-Q",https://www.moneycontrol.com/news/business/earnings/upl-standalone-september-2018-net-sales-at-rs-2275-00-crore-up-15-42-q-o-q-3091271.html
143,Podcast | Stock picks of the day: Cipla among 3 stocks which could return 14-17%,https://www.moneycontrol.com/news/business/stocks/podcast-stock-picks-of-the-day-cipla-among-3-stocks-which-could-return-14-17-3021621.html
144,"Citi advises investors to stay with defensives, removes Yes Bank from model portfolio",https://www.moneycontrol.com/news/business/markets/citi-advises-investors-to-stay-with-defensives-removes-yes-bank-from-model-portfolio-2992291.html
145,Global brokerages see limited upside for Indian market. Here are 10 strong buys for 1-2 years,https://www.moneycontrol.com/news/business/markets/global-brokerages-see-limited-upside-in-indian-market-here-are-10-strong-buys-for-1-2-years-2961881.html
146,Buy UPL; target of Rs 763: KR Choksey,https://www.moneycontrol.com/news/business/stocks/buy-upl-target-of-rs-763-kr-choksey-2814501.html
147,"UPL Q1: Steady growth, attractive pick",https://www.moneycontrol.com/news/business/earnings/upl-q1-steady-growth-attractive-pick-2797211.html
148,"UPL consolidated Jun-2018 sales at Rs 4,134.00 crore",https://www.moneycontrol.com/news/business/earnings/upl-consolidated-jun-2018-sales-at-rs-4134-00-crore-2786301.html
149,"UPL Q1 profit rises 6% to Rs 514 cr, higher finance cost restricts growth",https://www.moneycontrol.com/news/business/earnings/upl-q1-profit-rises-6-to-rs-514-cr-higher-finance-cost-restricts-growth-2785541.html
150,Buy UPL; target of Rs 664: Motilal Oswal,https://www.moneycontrol.com/news/business/stocks/buy-upl-target-of-rs-664-motilal-oswal-2771011.html
151,UPL-Arysta Life deal: What should investors do with the stock?,https://www.moneycontrol.com/news/business/moneycontrol-research/upl-arysta-life-deal-what-should-investors-do-with-the-stock-2760571.html
152,UPL rallies 15%; analysts remain positive as Arysta deal likely to be value accretive from FY20,https://www.moneycontrol.com/news/business/markets/upl-rallies-15-analysts-remain-positive-as-arysta-deal-likely-to-be-value-accretive-from-fy20-2746831.html
153,UPL Q1 PAT seen up 11.7% YoY to Rs. 549.4 cr: KR Choksey,https://www.moneycontrol.com/news/business/earnings/upl-q1-pat-seen-up-11-7-yoy-to-rs-549-4-cr-kr-choksey-2746941.html
154,"Week Ahead: Earnings, IPO, among 10 things to be on D-Street’s focus",https://www.moneycontrol.com/news/business/markets/week-ahead-earnings-ipo-among-10-things-to-be-on-d-streets-focus-2743581.html
155,UPL stock dips 2% after Investec cuts target price by 25%,https://www.moneycontrol.com/news/business/markets/upl-stock-dips-2-after-investec-cuts-target-price-by-25-2716691.html
156,"Deutsche retains Buy on UPL, sees 40% upside as likely Arysta deal could add leverage",https://www.moneycontrol.com/news/business/markets/deutsche-retains-buy-on-upl-sees-40-upside-as-likely-arysta-deal-could-add-leverage-2697081.html
157,4 largecap stock ideas which could return up to 12% in 30 days,https://www.moneycontrol.com/news/business/4-largecap-stock-ideas-which-could-return-up-to-12-in-30-days-2575691.html
158,Buy UPL; target of Rs 998: KR Choksey,https://www.moneycontrol.com/news/business/stocks/buy-upl-target-of-rs-998-kr-choksey-2564731.html
159,Buy UPL; target of Rs 930: JM Financial,https://www.moneycontrol.com/news/business/stocks/buy-upl-target-of-rs-930-jm-financial-2562907.html
160,Buy UPL; target of Rs 945: Motilal Oswal,https://www.moneycontrol.com/news/business/stocks/buy-upl-target-of-rs-945-motilal-oswal-2561865.html
161,Buy UPL; target of Rs 851: HDFC Securities,https://www.moneycontrol.com/news/business/stocks/buy-upl-target-of-rs-851-hdfc-securities-2561079.html
162,Buy UPL; target of Rs 988: Edelweiss,https://www.moneycontrol.com/news/business/stocks/buy-upl-target-of-rs-988-edelweiss-2561071.html
163,Accumulate UPL; target of Rs 880: Dolat Capital,https://www.moneycontrol.com/news/business/stocks/accumulate-upl-target-of-rs-880-dolat-capital-2561017.html
164,UPL Q4 net drops marginally to Rs 737 crore,https://www.moneycontrol.com/news/business/earnings/upl-q4-net-drops-marginally-to-rs-737-crore-2559377.html
165,UPL Q4 PAT seen up 0.9% YoY to Rs. 745.4 cr: KR Choksey,https://www.moneycontrol.com/news/business/earnings/upl-q4-pat-seen-up-0-9-yoy-to-rs-745-4-cr-kr-choksey-2554251.html
166,Normal monsoon: Brokerages betting on these top 10 stocks,https://www.moneycontrol.com/news/business/normal-monsoon-brokerages-betting-on-these-top-10-stocks-2550337.html
167,"Positive on UPL in long term, maintain Buy on the stock with 49% return potential: Anand Rathi",https://www.moneycontrol.com/news/business/positive-on-upl-in-long-term-maintain-buy-on-the-stock-with-49-return-potential-anand-rathi-2540521.html
168,"Buy Mahindra & Mahindra, Reliance Communications likely to head to Rs 28: Mitessh Thakkar",https://www.moneycontrol.com/news/business/buy-mahindra-mahindra-reliance-communications-likely-to-head-to-rs-28-mitessh-thakkar-2529617.html
169,"If you have a corpus of Rs 10 lakh at 35, this is where you should invest to achieve your millionaire dream",https://www.moneycontrol.com/news/business/at-35-allocate-at-least-70-of-portfolio-towards-equities-to-achieve-your-millionaire-dream-2526763.html
170,"Buy HCL Tech, Ashok Leyland, UPL; sell Ujjivan, HPCL: Sudarshan Sukhani",https://www.moneycontrol.com/news/business/buy-hcl-tech-ashok-leyland-upl-sell-ujjivan-hpcl-sudarshan-sukhani-2523369.html
171,UPL raises $300 mn via issue of bonds,https://www.moneycontrol.com/news/business/upl-raises-300-mn-via-issue-of-bonds-2520993.html
172,"Sell Reliance Infrastructure, UPL; buy Godrej Consumer: Ashwani Gujral",https://www.moneycontrol.com/news/business/sell-reliance-infrastructure-upl-buy-godrej-consumer-ashwani-gujral-2519003.html
173,UPL shares gain over 1% after Motilal Oswal initiates coverage with Buy call,https://www.moneycontrol.com/news/business/stocks/upl-shares-gain-over-1-after-motilal-oswal-initiates-coverage-with-buy-call-2518221.html
174,"Buy Axis Bank, Bajaj Finance, Oberoi Realty, Kotak Mahindra Bank, UPL: Ashwani Gujral",https://www.moneycontrol.com/news/business/buy-axis-bank-bajaj-finance-oberoi-realty-kotak-mahindra-bank-upl-ashwani-gujral-2516355.html
175,"Buy Bajaj Finserv, UPL, Motherson Sumi, Bharat Forge, Jet Airways, Reliance Capital: Ashwani Gujral",https://www.moneycontrol.com/news/business/buy-bajaj-finserv-upl-motherson-sumi-systems-ashwani-gujral-2516343.html
176,"Buy Mindtree, Pidilite Industries; sell UPL, Tata Steel, Tata Motors: Sudarshan Sukhani",https://www.moneycontrol.com/news/business/buy-mindtree-pidilite-industries-sell-upl-tata-steel-tata-motors-sudarshan-sukhani-2513371.html
177,"Sell Reliance Capital, Repco Home; buy United Spirits: Ashwani Gujral",https://www.moneycontrol.com/news/business/sell-reliance-capital-repco-home-buy-united-spirits-ashwani-gujral-2508801.html
178,"Buy Bombay Burmah, Karnataka Bank, Radico Khaitan: Ashwani Gujral",https://www.moneycontrol.com/news/business/buy-bombay-burmah-karnataka-bank-radico-khaitan-ashwani-gujral-2505861.html
179,"Buy UPL, Jindal Steel & Power, Eicher Motors: Ashwani Gujral",https://www.moneycontrol.com/news/business/buy-upl-jindal-steel-power-eicher-motors-ashwani-gujral-2493287.html
180,Buy UPL; target of Rs 935: JM Financial,https://www.moneycontrol.com/news/business/stocks/buy-upl-target-of-rs-935-jm-financial-2504509.html
181,"Buy PNB, UPL, Union Bank of India, Punjab National Bank, ONGC, Exide Industries: Ashwani Gujral",https://www.moneycontrol.com/news/business/buy-pnb-upl-union-bank-of-india-punjab-national-bank-ongc-exide-industries-ashwani-gujral-2490329.html
182,"Buy ICICI Prudential, ICICI Bank, Kotak Mahindra Bank, Torrent Power, UPL: VK Sharma",https://www.moneycontrol.com/news/business/buy-icici-prudential-icici-bank-kotak-mahindra-bank-torrent-power-upl-vk-sharma-2488037.html
183,"Jubilant Food likely to rally to Rs 2,350, NIIT Technologies may test Rs 700: Ashwani Gujral",https://www.moneycontrol.com/news/business/jubilant-food-likely-to-rally-to-rs-2350-niit-technologies-may-test-rs-700-ashwani-gujral-2487551.html
184,"Buy Indiabulls Housing Finance, Maruti Suzuki, UPL, Kotak Mahindra Bank; sell Raymond, KPIT Tech: Ashwani Gujral",https://www.moneycontrol.com/news/business/buy-indiabulls-housing-finance-maruti-suzuki-upl-kotak-mahindra-bank-sell-raymond-kpit-tech-ashwani-gujral-2485887.html
185,"Market Update: Banks propel markets to record highs; HDFC Bank, ICICI, HUL, L&T hit 52-week high, Mindtree zooms 8%",https://www.moneycontrol.com/news/business/market-update-banks-propel-markets-to-record-highs-hdfc-bank-icici-hul-lt-hit-52-week-high-mindtree-zooms-8-2485673.html
186,"Buy Manappuram Finance, Exide Industries, UPL: CA Rudramurthy BV",https://www.moneycontrol.com/news/business/buy-manappuram-finance-exide-industries-upl-ca-rudramurthy-bv-2480561.html
187,"Sell UPL, Apollo Tyres; buy Tata Consultancy Services: Ashwani Gujral",https://www.moneycontrol.com/news/business/sell-upl-apollo-tyres-buy-tata-consultancy-services-ashwani-gujral-2479837.html
188,Buy UPL; target of Rs 950: JM Financial,https://www.moneycontrol.com/news/business/stocks/buy-upl-target-of-rs-950-jm-financial-2433811.html
189,Buy UPL; target of Rs 980: Sharekhan,https://www.moneycontrol.com/news/business/stocks/buy-upl-target-of-rs-980-sharekhan-2-2433073.html
190,Buy UPL; target of Rs 1030: KR Choksey,https://www.moneycontrol.com/news/business/stocks/buy-upl-target-of-rs-1030-kr-choksey-2425891.html
191,UPL Q2 net profit up 43% at Rs 238 cr,https://www.moneycontrol.com/news/business/earnings/upl-q2-net-profit-up-43-at-rs-238-cr-2423345.html
192,"Buy UPL, Edelweiss Financial, Ashok Leyland: Ashwani Gujral",https://www.moneycontrol.com/news/business/buy-upl-edelweiss-financial-ashok-leyland-ashwani-gujral-2409303.html
193,"Buy Bombay Burmah, Delta Corp, Future Consumer, UPL: Ashwani Gujral",https://www.moneycontrol.com/news/business/buy-bombay-burmah-delta-corp-future-consumer-upl-ashwani-gujral-2409299.html
194,Market update: Midcaps outshine Nifty led by Biocon; Delta Corp jumps over 7%,https://www.moneycontrol.com/news/business/market-update-ril-infosys-lupin-keep-nifty-above-10k-midcaps-outperform-2409159.html
195,"Buy UPL, VIP Industries, Escorts: Ashwani Gujral",https://www.moneycontrol.com/news/business/buy-upl-vip-industries-escorts-ashwani-gujral-2408967.html
196,"Market update: Nifty holds above 10K as midcap outperforms, RIL up 1.73%",https://www.moneycontrol.com/news/business/market-update-nifty-holds-above-10k-as-midcap-outperforms-ril-up-1-73-2408991.html
197,"Nifty likely to open lower; buy Godrej Industries, UPL: Prakash Gaba",https://www.moneycontrol.com/news/business/nifty-likely-to-open-lower-buy-godrej-industries-upl-prakash-gaba-2407739.html
198,Buy UPL; target of Rs 980: Sharekhan,https://www.moneycontrol.com/news/business/stocks/buy-upl-target-of-rs-980-sharekhan-2404589.html
199,"Buy Adani Ports, NALCO, Dr Reddy's, GSPL; sell Jet Airways, M&M: Sudarshan Sukhani",https://www.moneycontrol.com/news/business/buy-adani-ports-nalco-dr-reddys-gspl-sell-jet-airways-mm-sudarshan-sukhani-2393463.html
200,"Buy Larsen & Toubro, Bajaj Auto, Capital First, ONGC, Allahabad Bank: Mitessh Thakkar",https://www.moneycontrol.com/news/business/buy-larsen-toubro-bajaj-auto-capital-first-ongc-allahabad-bank-mitessh-thakkar-2390279.html
201,"Resistance for Nifty at 10138; buy Oracle Financial, Syndicate Bank: Prakash Gaba",https://www.moneycontrol.com/news/business/resistance-for-nifty-at-10138-buy-oracle-financial-syndicate-bank-prakash-gaba-2389947.html
202,"Buy Thomas Cook, UPL, PC Jeweller; L&T Finance may test Rs 225: Ashwani Gujral",https://www.moneycontrol.com/news/business/buy-thomas-cook-upl-pc-jeweller-lt-finance-may-test-rs-225-ashwani-gujral-2388969.html
203,"Sell Jet Airways, UPL; buy Future Lifestyle: Ashwani Gujral",https://www.moneycontrol.com/news/business/sell-jet-airways-upl-buy-future-lifestyle-ashwani-gujral-2378333.html
204,"Buy Vedanta, Apollo Tyres; sell Tata Comm, Glenmark Pharma, UPL: Sudarshan Sukhani",https://www.moneycontrol.com/news/business/buy-vedanta-apollo-tyres-sell-tata-comm-glenmark-pharma-upl-sudarshan-sukhani-2362183.html
205,Top 7 stocks which are likely to enter $10 billion market cap in next 3 years: Morgan Stanley,https://www.moneycontrol.com/news/business/markets/top-7-stocks-which-are-likely-to-enter-10-billion-market-cap-in-next-3-years-morgan-stanley-2359539.html
206,"Sell UPL, buy Havells India: Mitessh Thakkar",https://www.moneycontrol.com/news/business/sell-upl-buy-havells-india-mitessh-thakkar-2355031.html
207,"Sell Godrej Consumer, UPL, Sun TV; buy IGL, Bharat Forge: Sudarshan Sukhani",https://www.moneycontrol.com/news/business/sell-godrej-consumer-upl-sun-tv-buy-igl-bharat-forge-sudarshan-sukhani-2354473.html
208,Buy UPL; target of Rs 1015: KR Choksey,https://www.moneycontrol.com/news/business/stocks/buy-upl-target-of-rs-1015-kr-choksey-2-2342771.html
209,"Buy Voltas, M&amp;M, Exide Industries, DCB bank, UPL: Mitessh Thakkar",https://www.moneycontrol.com/news/business/buy-voltas-mm-exide-industries-dcb-bank-upl-mitessh-thakkar-2342475.html
210,Buy UPL; target of Rs 1026: Edelweiss,https://www.moneycontrol.com/news/business/stocks/buy-upl-target-of-rs-1026-edelweiss-2341809.html
211,"Buy UPL, Chennai Petroleum Corporation: Mitessh Thakkar",https://www.moneycontrol.com/news/business/buy-upl-chennai-petroleum-corporation-mitessh-thakkar-2341409.html
212,UPL Q1 profit up 31% at Rs 475 crore,https://www.moneycontrol.com/news/business/earnings/upl-q1-profit-up-31-at-rs-475-crore-2340521.html
213,"Buy UPL, Tata Steel: Sandeep Wagle",https://www.moneycontrol.com/news/business/buy-upl-tata-steel-sandeep-wagle-2336011.html
214,"Buy Apollo Tyres, Indiabulls Housing, UPL, Chennai Petro; sell Ramco Cement: Thakkar",https://www.moneycontrol.com/news/business/buy-apollo-tyres-indiabulls-housing-upl-chennai-petro-sell-ramco-cement-thakkar-2335961.html
215,"Buy Bajaj Auto, UPL; sell NIIT Technologies: Gaurav Bissa",https://www.moneycontrol.com/news/business/buy-bajaj-auto-upl-sell-niit-technologies-gaurav-bissa-2334817.html
216,"Buy UPL, Wipro: Sandeep Wagle",https://www.moneycontrol.com/news/business/buy-upl-wipro-sandeep-wagle-2331933.html
217,UPL Q1 PAT seen up 12.7% YoY to Rs 406.8 cr: KR Choksey,https://www.moneycontrol.com/news/business/earnings/upl-q1-pat-may-dip-45-1-to-rs-406-8-cr-kr-choksey-2327793.html
218,"Buy Tata Motors DVR, Karnataka Bank, UPL: Ashwani Gujral",https://www.moneycontrol.com/news/business/buy-tata-motors-dvr-karnataka-bank-upl-ashwani-gujral-2324119.html
219,"Buy ACC, UPL: Rajat Bose",https://www.moneycontrol.com/news/business/buy-acc-upl-rajat-bose-2323123.html
220,"Buy Bharat Heavy Electricals, UPL, Tata Motors: Ashwani Gujral",https://www.moneycontrol.com/news/business/buy-bharat-heavy-electricals-upl-tata-motors-ashwani-gujral-2322965.html
221,Strong support for Nifty at 9540; 4 stocks which can give decent returns today: Gaba,https://www.moneycontrol.com/news/business/strong-support-for-nifty-at-9540-4-stocks-which-can-give-decent-returns-today-gaba-2317667.html
222,6 hot stock picks from Anand Rathi Share and Stock Brokers,https://www.moneycontrol.com/news/business/technicals/6-hot-stock-picks-from-anand-rathi-share-and-stock-brokers-2316765.html
223,"Stiff resistance for Nifty at 9560; buy Axis Bank, TVS Motor, Titan: Prakash Gaba",https://www.moneycontrol.com/news/business/stiff-resistance-for-nifty-at-9560-buy-axis-bank-tvs-motor-titan-prakash-gaba-2316621.html
224,"Sell Indiabulls Real Estate, Suven Life Sciences: Sandeep Wagle",https://www.moneycontrol.com/news/business/sell-indiabulls-real-estate-suven-life-sciences-sandeep-wagle-2315617.html
225,"Sell Interglobe Aviation, buy UPL: Sandeep Wagle",https://www.moneycontrol.com/news/business/sell-interglobe-aviation-buy-upl-sandeep-wagle-2315373.html
226,"Sell PFC, Tata Motors, State Bank of India; buy IIFL Holdings, SCI: Ashwani Gujral",https://www.moneycontrol.com/news/business/sell-pfc-tata-motors-state-bank-of-india-buy-iifl-holdings-sci-ashwani-gujral-2315369.html
227,Nifty may remain volatile ahead of expiry; 4 stocks to pick today: Prakash Gaba,https://www.moneycontrol.com/news/business/nifty-may-remain-volatile-ahead-of-expiry-4-stocks-to-pick-today-prakash-gaba-2312205.html
228,"Sell Indian Oil Corp, Cummins India; buy UPL, Siemens, Sun TV:  Sudarshan Sukhani",https://www.moneycontrol.com/news/business/sell-indian-oil-corp-cummins-india-buy-upl-siemens-sun-tv-sudarshan-sukhani-2309909.html
229,"Buy Apollo Tyres, Dabur India, SpiceJet: Sudarshan Sukhani",https://www.moneycontrol.com/news/business/stocks/buy-apollo-tyres-dabur-india-spicejet-sudarshan-sukhani-2308225.html
230,"Buy BPCL, India Cements, UPL; Aurobindo Pharma may hit Rs 700: Ashwani Gujral",https://www.moneycontrol.com/news/business/buy-bpcl-india-cements-upl-aurobindo-pharma-may-hit-rs-700-ashwani-gujral-2305815.html
231,Nearly 100 stocks hit 52-week highs while 35 stocks hit fresh lifetime highs on BSE,https://www.moneycontrol.com/news/business/markets/nearly-100-stocks-hit-52-week-highs-while-35-stocks-hit-fresh-lifetime-highs-on-bse-2295879.html
232,"Buy UPL, Max Financial Services, Glenmark Pharma: Ashwani Gujral",https://www.moneycontrol.com/news/business/buy-upl-max-financial-services-glenmark-pharma-ashwani-gujral-2294981.html
233,"Buy UPL, Dr Reddy&#39;s Laboratories, Adani Ports: Ashwani Gujral",https://www.moneycontrol.com/news/business/buy-upl-dr-reddys-laboratories-adani-ports-ashwani-gujral-2292383.html
234,Nifty likely to find support at 9570; 5 stocks which can give up to 5% this week,https://www.moneycontrol.com/news/business/markets/nifty-likely-to-find-support-at-9570-5-stocks-which-can-give-up-to-5-this-week-2292137.html
235,"Buy UPL, Mahindra & Mahindra Financial, Adani Ports: Ashwani Gujral",https://www.moneycontrol.com/news/business/buy-upl-mahindra-mahindra-financial-adani-ports-ashwani-gujral-2291539.html
236,"Stocks in the news: ITC, Sun Pharma, Infosys, Cipla, Lypsa Gems, Nalco",https://www.moneycontrol.com/news/business/stocks/stocks-in-news-itc-sun-pharma-infosys-cipla-lypsa-gems-nalco-2289461.html
237,"Buy UPL, Piramal Enterprises, Jindal Steel & Power: Ashwani Gujral",https://www.moneycontrol.com/news/business/buy-upl-piramal-enterprises-jindal-steel-power-ashwani-gujral-2288865.html
238,Early rains to shower hope for Sensex; top 10 stocks to chase this monsoon,https://www.moneycontrol.com/news/business/markets/early-rains-to-shower-hope-for-sensex-top-10-stocks-to-chase-this-monsoon-2287225.html
239,"Buy Motherson Sumi, HDFC Bank, UPL; sell BPCL, United Spirits: Ashwani Gujral",https://www.moneycontrol.com/news/business/buy-motherson-sumi-hdfc-bank-upl-sell-bpcl-united-spirits-ashwani-gujral-2284881.html
240,"Sell UPL, Bajaj Finserv; buy State Bank of India: Ashwani Gujral",https://www.moneycontrol.com/news/business/sell-upl-bajaj-finserv-buy-state-bankindia-ashwani-gujral-2284077.html
241,"Buy Marico, ITC, bullish on Tata Steel, BoB; sell UPL: Sandeep Wagle",https://www.moneycontrol.com/news/business/buy-marico-itc-bullish-on-tata-steel-bob-sell-upl-sandeep-wagle-2283901.html
242,"Buy ITC, Marico; sell UPL: Sandeep Wagle",https://www.moneycontrol.com/news/business/stocks/buy-itc-marico-sell-upl-sandeep-wagle-2283821.html
243,Buy UPL; target of Rs 887: Geojit Financial Services,https://www.moneycontrol.com/news/business/stocks/buy-upl-target-of-rs-887-geojit-financial-services-2274493.html
244,Buy UPL; target of Rs 1015: KR Choksey,https://www.moneycontrol.com/news/business/stocks/buy-upl-target-of-rs-1015-kr-choksey-2269799.html
245,"Buy Allahabad Bank, sell UPL: Sandeep Wagle",https://www.moneycontrol.com/news/business/buy-allahabad-bank-sell-upl-sandeep-wagle-2267693.html
246,"UPL Q4 profit seen up 10% at Rs 650 cr; Latin America, India biz may drive topline",https://www.moneycontrol.com/news/business/earnings/upl-q4-profit-seen-up-10-at-rs-650-cr-latin-america-india-biz-may-drive-topline-2267397.html
247,"Buy SRF, Can Fin Homes, PVR; expect Rs 1000 in Tata Sponge: Ashwani Gujral",https://www.moneycontrol.com/news/business/buy-srf-can-fin-homes-pvr-expect-rs-1000-in-tata-sponge-ashwani-gujral-2266661.html
248,"Buy UPL, Tata Chemicals, TVS Motor Company: Manoj Murlidharan",https://www.moneycontrol.com/news/business/buy-upl-tata-chemicals-tvs-motor-company-manoj-murlidharan-2266563.html
249,"Nifty reclaims 9,200 and over 250 stocks hit fresh 52-week high on BSE today",https://www.moneycontrol.com/news/business/markets/nifty-reclaims-9200-and-over-250-stocks-hit-fresh-52-week-high-on-bse-2264331.html
250,"Bull's Eye: Buy GSPL, MRPL, EID Parry, UPL, Exide, BEL, Simplex Infra",https://www.moneycontrol.com/news/business/stocks/bulls-eye-buy-gspl-mrpl-eid-parry-upl-exide-bel-simplex-infra-2261647.html
251,"Buy ITC, Reliance Industries, BEL; UPL may head to Rs 900: Ashwani Gujral",https://www.moneycontrol.com/news/business/buy-itc-reliance-industries-bel-upl-may-head-to-rs-900-ashwani-gujral-2260871.html
252,"Bull's Eye: Buy IOC, UPL, Ashoka Buildcon; sell Jet, Bharat Forge",https://www.moneycontrol.com/news/business/stocks/bulls-eye-buy-ioc-upl-ashoka-buildcon-sell-jet-bharat-forge-2260705.html
253,"Buy RBL Bank, State Bank of India, UPL: Ashwani Gujral",https://www.moneycontrol.com/news/business/buy-rbl-bank-state-bank-of-india-upl-ashwani-gujral-2260139.html
254,Buy Eicher Motors; pick UPL above Rs 747: Mitessh Thakkar,https://www.moneycontrol.com/news/business/buy-eicher-motors-pick-upl-above-rs-747-mitessh-thakkar-2257215.html
255,Too much euphoria in markets; Sensex may hover near 29k by Dec: Deutsche's Laijawala,https://www.moneycontrol.com/news/business/markets/there-is-too-much-euphoria-in-markets-sensex-likely-to-hover-around-29000-by-dec-2017-2256515.html
256,"Buy Petronet LNG 420 Call,  Hindustan Unilever 920 Call: Amit Gupta",https://www.moneycontrol.com/news/business/buy-petronet-lng-420-call-hindustan-unilever-920-call-amit-gupta-2252943.html
257,"Support for Nifty at 20600; buy Bharat Financial, Manappuram Finance, UPL: Prakash Gaba",https://www.moneycontrol.com/news/business/support-for-nifty-at-20600-buy-bharat-financial-manappuram-finance-upl-prakash-gaba-2245949.html
258,"Bull's Eye: Buy Britannia, Sintex, Bharti Infratel, Apollo Tyre, UPL",https://www.moneycontrol.com/news/business/stocks/bulls-eye-buy-britannia-sintex-bharti-infratel-apollo-tyre-upl-2244349.html
259,"Bull's Eye: Buy Bajaj Auto, Havells, Apollo Tyres, IGL, GMDC, UPL",https://www.moneycontrol.com/news/business/stocks/bulls-eye-buy-bajaj-auto-havells-apollo-tyres-igl-gmdc-upl-2242791.html
260,"Buy HDFC Bank, UPL; sell Bharti Airtel: Ashwani Gujral",https://www.moneycontrol.com/news/business/buy-hdfc-bank-upl-sell-bharti-airtel-ashwani-gujral-2242149.html
261,"Buy AB Nuvo, Tata Power, REC, Indiabulls Real Estate; sell UPL: Sukhani",https://www.moneycontrol.com/news/business/buy-ab-nuvo-tata-power-rec-indiabulls-real-estate-sell-upl-sukhani-2150711.html
262,New product approvals to aid UPL's revenue growth: Deutsche Bank,https://www.moneycontrol.com/news/business/stocks/new-product-approvals-to-aid-upls-revenue-growth-deutsche-bank-1340115.html
263,"Buy, sell, hold: 4 stocks that you can focus today",https://www.moneycontrol.com/news/business/stocks/buy-sell-hold-4-stocks-that-you-can-focus-today-1061233.html
264,"Bull's Eye: Buy PNB, GSPL, Havells, Mastek, UPL, Yes Bank",https://www.moneycontrol.com/news/business/stocks/bulls-eye-buy-pnb-gspl-havells-mastek-upl-yes-bank-1061169.html
265,"Prefer UPL, see 5-7% upside: Anu Jain",https://www.moneycontrol.com/news/business/stocks/prefer-upl-see-5-7-upside-anu-jain-1057605.html
266,"Bull's Eye: Buy Bajaj Auto, HPCL, Wockhardt, Adani Port;sell PNB",https://www.moneycontrol.com/news/business/stocks/bulls-eye-buy-bajaj-auto-hpcl-wockhardt-adani-portsell-pnb-1057685.html
267,"Buy Reliance Capital, Ashok Leyland; sell UPL: Sandeep Wagle",https://www.moneycontrol.com/news/business/stocks/buy-reliance-capital-ashok-leyland-sell-upl-sandeep-wagle-1058799.html
268,"Buy AB Nuvo, Arvind, Infosys, Titan; short UPL: Sukhani",https://www.moneycontrol.com/news/business/stocks/buy-ab-nuvo-arvind-infosys-titan-short-upl-sukhani-1059109.html
269,"Buy Hindalco Industries, Apollo Hospitals; sell UPL: Gujral",https://www.moneycontrol.com/news/business/stocks/buy-hindalco-industries-apollo-hospitals-sell-upl-gujral-1059803.html
270,"Sell UPL, buy Bharti Infratel: Mitessh Thakkar",https://www.moneycontrol.com/news/business/stocks/sell-upl-buy-bharti-infratel-mitessh-thakkar-1059865.html
271,"Sell JSW Steel, UPL, Ceat, Jet Air; buy Marico: Ashwani Gujral",https://www.moneycontrol.com/news/business/technicals/sell-jsw-steel-upl-ceat-jet-air-buy-marico-ashwani-gujral-1060039.html
